id,title,torrent_url,magnet
366976,"[IKillItTS.com / Trans500.com] Gabriela Estela - Getting it with this Big Booty (kill362) (2023-04-20) [2023, Transsexuals, Shemale, Anal, Blonde, Blowjob, Bubble Butt, Cumshot, Hardcore, Small Tits, 360p, SiteRip]",https://d.ptorrents.com/bt/[ptorrents.com].2975431.torrent,magnet:?xt=urn:btih:a49f07ba09101a2ce0ba8ee6dacc64dcc973977c
366977,"Stepfather's Desires 9 / Stepfather's Desires 9 (Digital Sin) [2023, 18+ Teens, Big Dicks, Blowjobs, Gonzo, WEB-DL, 1080p] (Split Scenes) (Haley Spades, Maria Kazi, Vanessa Moon, Cecelia Taylor)",https://d.ptorrents.com/bt/[ptorrents.com].2975072.torrent,magnet:?xt=urn:btih:9bfed687af566e7ecfb3f9ca8971e1b3ad7070a6
366978,"[PCL104] [4047614] / PCL-104 [Cen] (Ochincos LABO / おちんコスLABO) [2023, Transsexual, Cosplay, Cross Dressing, HDRip 1080p]",https://d.ptorrents.com/bt/[ptorrents.com].2975575.torrent,magnet:?xt=urn:btih:cc4461831ca884eabe43be1cffbc365207c07734
366979,"Achtzehneinhalb 13 / Böse Mösen 13 / Bose Mosen 13 / Evil Fleas 13 (Moli, Magma) [2000, All Sex, WEB-DL] (Betty Love, Elena Maria Ricci, Malory, Peggy Pacific, Zoltan Kabai, Mike Foster, Frank Gun Leslie Taylor",https://d.ptorrents.com/bt/[ptorrents.com].2975548.torrent,magnet:?xt=urn:btih:e4701ba5db6cc1afc03629dc1abc51c84be03bdb
366980,"Private Gold 251:Cherry Kiss Home Parties / Cherry Kiss Home Parties (Cherry Kiss, Private) [2023, All Sex, Anal, WEB-DL, 1080p] (Tiffany Tatum, Karina King, Zlata Shine, Alexis Crystal)",https://d.ptorrents.com/bt/[ptorrents.com].2975116.torrent,magnet:?xt=urn:btih:005032496c2e82e00d02df3d3627e316a8f9db03
366981,"[VRLatina.com] Silvana Reyes - Topless Pool Persuasion [14.04.2023, Big Ass, Big Tits, Blowjob, Brunette, Bubble Butt, Cock Rubbing Pussy, Cowgirl, Cum On Ass, Cum On Back, Doggy Style, Handjob, High Heels , Lateral Cowgirl, Latina, Long Hair, Mastur",https://d.ptorrents.com/bt/[ptorrents.com].2975293.torrent,magnet:?xt=urn:btih:9be1658c32fa02f0edb5888c8874006ad8955855
366982,"[MetArt.com] 2023-04-21 Dariana - Wild Encounter, Alin Luxe - Golden Light, Flamy Nika - Expressing Myself, Margo Pica - Presenting Margo Pica [Solo, Posing, Glamour] [3243x4324-4480x6720, 505 photos]",https://d.ptorrents.com/bt/[ptorrents.com].2975514.torrent,magnet:?xt=urn:btih:12e194628ef7421c6a404b86404f2bcfc1fd870a
366983,"[VRHush.com] Chloe Temple - One Step Closer [2023-01-25, Standing Missionary, Masturbation, Straight, Blonde, Blowjob, Handjob, Small Tits, Natural Tits, Trimmed Pussy, Cowgirl, Reverse Cowgirl, Missionary, Closeup Missionary, Doggystyle, SideBySide,",https://d.ptorrents.com/bt/[ptorrents.com].2975319.torrent,magnet:?xt=urn:btih:6ebb37b6c590d11a68f391276bf4403e72e7d810
366984,"Mandingo Unchained / Mandingo Unchained (Jules Jordan, Jules Jordan Video) [2013, Anal, Gonzo, Interracial, Hardcore, AI Upscale, 2160p] (Split Scenes) (AJ Applegate, Allie Haze, Chastity Lynn, Jessie Volt, Juelz Ventura , Mandingo, Vicki Chase)",https://d.ptorrents.com/bt/[ptorrents.com].2975294.torrent,magnet:?xt=urn:btih:64550dee1acc943cb44e5267a76a1d9a6bf40adb
366985,"Asian Hidden Camera Couples Escorts Pack 073 (202 Clips) [All Sex, Amateur, Asian, Blowjob, Brunette, Couples, Creampie, Doggystyle, Hardcore, Hidden Camera, Skinny, Spycam, Stockings, Teen, Voyeur, 480p, 540p, 720p, 1080p, 2160p, CamRip]",https://d.ptorrents.com/bt/[ptorrents.com].2975217.torrent,magnet:?xt=urn:btih:a79479a1ee1b4cb718355f149e078e708b270b9f
366986,"[Graphis.ne.jp] 2020-01-31 Remu Suzumori - Transparent Body [Asian, Japanese, Gravure, Erotic, Idol, Posing, Solo, Unshaved, Japan] [1920x1280, 140 photos]",https://d.ptorrents.com/bt/[ptorrents.com].2975493.torrent,magnet:?xt=urn:btih:937aac9356e06005b579eb4e5a774f9be2040421
366987,"[Spizoo.com] Misha Maver - Misha Maver Fucks Outdoors (04/19/2023) [2023, Big Tits, Gonzo, Hardcore, All Sex, 480p]",https://d.ptorrents.com/bt/[ptorrents.com].2975307.torrent,magnet:?xt=urn:btih:df8c25b6c2001908ddf285e58b300fc5e1bc8a49
366988,"Kunoichi Slaves [InProgress, 0.2] (PrettyCube) [uncen] [2023, ADV, Animation, Footjob, Anal Sex, Male protagonist, Creampie, Big tits] [eng]",https://d.ptorrents.com/bt/[ptorrents.com].2975507.torrent,magnet:?xt=urn:btih:36fdb3ee0581a8fdea852d5862eebb289a1390af
366989,"[PornFidelity.com / TeenFidelity.com / KellyMadisonMedia.com] Josephine Jackson - Gigantic Ukrainian Tits (21.04.2023) [2023, Big Tits, Gonzo, Hardcore, All Sex, Creampie, 1080p]",https://d.ptorrents.com/bt/[ptorrents.com].2975497.torrent,magnet:?xt=urn:btih:2e3fddc3b8aac651a335cdb25878039760de484f
366990,"[PCL060] [4037318] / PCL-060 [Cen] (Ochincos LABO / おちんコスLABO) [2021, Transsexual, Cosplay, Cross Dressing, HDRip 1080p]",https://d.ptorrents.com/bt/[ptorrents.com].2975573.torrent,magnet:?xt=urn:btih:2b18948c2251e9b1e7a54b5ccf5c3eef8bc56002
366991,"[ClubSweethearts.com / ClubSeventeen.com] Olivia Trunk - Cute Babe Back Seat Climax (04/21/2023) [2023, Solo, Teen, Masturbation, Orgasm, 1080p]",https://d.ptorrents.com/bt/[ptorrents.com].2975495.torrent,magnet:?xt=urn:btih:ca16935dc5fc8af689ba341176a94ff3fd30aeba
366992,"AleksSam13 and MellisaCreative (Pounding and swearing) (8 videos) Pack [2022, Facial, Anal, DP, 720p, 1080p]",https://d.ptorrents.com/bt/[ptorrents.com].2975250.torrent,magnet:?xt=urn:btih:e12526404709d2ace4625d7abd81d97f860787af
366993,"[MetArt.com] 2023-04-20 Casey - Reigning Champion, Nata Ocean - Asana, Pearl - Purple Passion, Nancy A - Blue Gaze [Solo, Posing, Glamour] [4032x6048-5464x8192, 534 photos]",https://d.ptorrents.com/bt/[ptorrents.com].2975285.torrent,magnet:?xt=urn:btih:1f93dd42b282ecb5d37cf7d242ff0db43078f2db
366994,"[DevilsFilm.com / DevilsTGirls.com] Gracie Jane & Aften Opal - Her First Trans Encounter 2 (2023-04-22) [2023, All Sex, Blonde, Brunette, Big Tits, Natural Tits, Tattoo, Petite, Blowjob , Cum in Mouth, Handjob, Massage, Oil, Trans, Trans Fucks Female",https://d.ptorrents.com/bt/[ptorrents.com].2975688.torrent,magnet:?xt=urn:btih:340ed34bc9ca5f853e1578b4ae5cd63c4225b9ab
366995,"[LegalPorno.com / AnalVids.com] Kate Cat - First Anal Casting Kate Cat with Big Cock, Welcome to Porn and Cum in Mouth (2023-03-24) [2023, anal, blowjob, deep throat, facial, gapes, rough , teen, 720p, SiteRip]",https://d.ptorrents.com/bt/[ptorrents.com].2975222.torrent,magnet:?xt=urn:btih:dfc6b2ed3ee73dda8bb3b3c7d080174d34014d9f
366996,"妹!せいかつ ～モノクローム～ / Imouto!? Life ~Monochrome~ [2.0.1] (Inusuku (いぬすく)) [ptcen] [2019, SLG, ADV, Male hero, Incest, Romance, Touching, Internal Cumshot/Creampie, Bukkake, Small Tits/DFC, Blowjob/Oral , Anal, Wolf RPG] [rus]",https://d.ptorrents.com/bt/[ptorrents.com].2975477.torrent,magnet:?xt=urn:btih:2dbec38d4550aa1435c3147fdf359368f97fae6d
366997,"[DevilsFilm.com / DevilsTGirls.com] Gracie Jane & Aften Opal - Her First Trans Encounter 2 (2023-04-22) [2023, All Sex, Blonde, Brunette, Big Tits, Natural Tits, Tattoo, Petite, Blowjob , Cum in Mouth, Handjob, Massage, Oil, Trans, Trans Fucks Female",https://d.ptorrents.com/bt/[ptorrents.com].2975687.torrent,magnet:?xt=urn:btih:813bfc3353cd95840ff53b0cc7d85c2f7100070d
366998,"[LegalPorno.com / AnalVids.com] Anna Esman - An Old Italian and a Young Escort Girl ! First anal (2023-04-20) [2023, anal, big butt, big tits, blowjob, deep throat, double penetration (DP), face fucking, facial, gapes, rough, teen, 1080p, SiteRip]",https://d.ptorrents.com/bt/[ptorrents.com].2975159.torrent,magnet:?xt=urn:btih:56271c7a030f60685c6d2711291d68f752c24efe
366999,"[Pornhub.com] Cuban Queen aka Alynova1 - Trying To Get A Better Deal From The Pregnant Landlord [2023, pregnant, pregnant sex, 720p, SiteRip]",https://d.ptorrents.com/bt/[ptorrents.com].2975531.torrent,magnet:?xt=urn:btih:b1f90116969a25135cd119dcc0c1cb2e5c2f56c0
367000,"[SellYourGF.com / 18Videoz.com] Bernie Svintis aka Bernie, Martha - Hot Blonde Fucking For Bf Debt (04/15/2023) [2023, Teen, Cuckold, Gonzo, Hardcore, All Sex, 1080p]",https://d.ptorrents.com/bt/[ptorrents.com].2975448.torrent,magnet:?xt=urn:btih:9f9b2a2faf0af59aba28bd8efdec7732590e91ed
367001,"[Onlyfans.com] Callme k melons - Pregnant Compilation [2022, solo, pregnant, 1080p, SiteRip]",https://d.ptorrents.com/bt/[ptorrents.com].2975535.torrent,magnet:?xt=urn:btih:02d495cc193e3f95cccdd14aa1f894ff5e361050
367002,"[Graphis.ne.jp] 2020-02-12 Anna Kami - Limited Edition Valentine Special [Asian, Japanese, Gravure, Erotic, Idol, Posing, Shaved, Japan] [1920x1280, 20 photos]",https://d.ptorrents.com/bt/[ptorrents.com].2975499.torrent,magnet:?xt=urn:btih:43973af1f6d40173a41afc05a4f3ffb28d5e539d
367003,"[OnlyFans.com / DreddXXX] Dredd Prone Bone Compilation 3 (Daisy Rae, Nicole Aria, Jessie Rogers, Violet Starr, Esperanza Gomez, Hime Marie, Holly Day, Jenna Starr, Kayla Jade, Khloe Kapri, Nova Flame, Payton Preslee, Tommy King, Xxlayna Marie, Rory K",https://d.ptorrents.com/bt/[ptorrents.com].2975577.torrent,magnet:?xt=urn:btih:0a4af6602663ec6a206cb84f7dc5d4a7b9474d9a
367004,"[FirstAnalQuest.com] Mia Grandy - Cute brunette girl with big tits Mia Grandy loves anal fuck (673) (04/20/2023) [2023, Hardcore, Anal, Blowjob, Butt Plug, Cumshot, SiteRip, 540p]",https://d.ptorrents.com/bt/[ptorrents.com].2975552.torrent,magnet:?xt=urn:btih:e1eb4eb96af4d0d6c8a3710266fbc01ed33e9704
367005,"Private Movies 60: The Art of Tantric Massage (Frank Lentini, Private) [2023, Big Dicks, Couples, Masturbation, Oiled, Shaved, WEB-DL, 1080p] (Angelika Grays, Eveline Dellai, Katy Rose Ria Sunn",https://d.ptorrents.com/bt/[ptorrents.com].2975115.torrent,magnet:?xt=urn:btih:63436260a64195cc320017d37ce48368017dcd61
367006,"[Pornhub.com] CuteLipss (15 videos) [2023, Closeup, Blowjob, Cum in Mouth, Red Lipstick, 1080p, SiteRip]",https://d.ptorrents.com/bt/[ptorrents.com].2975193.torrent,magnet:?xt=urn:btih:109beb6949bb6377ac380e8688b6c9f6bc67b5a4
367007,"[DivineBitches.com / Kink.com] Leigh Raven - Actions Speak Louder Than Words (04/19/2023) [2023, Femdom, Strap-on, Anal, Anal Fingering, Pegging, Dildo, BDSM, Bondage, Facesitting, Ball Gag , Stockings, Fishnet, Nipple Clamps, Prostate Stimulation, Z",https://d.ptorrents.com/bt/[ptorrents.com].2975071.torrent,magnet:?xt=urn:btih:2f191e9d9909e147c9fc3ba4fa8c843e514709ee
367008,"[Graphis.ne.jp] 2018-05-25 Ami Ayuha - Noble Heart [Asian, Japanese, Gravure, Erotic, Idol, Posing, Shaved, Japan] [1920x1278, 120 photos]",https://d.ptorrents.com/bt/[ptorrents.com].2975459.torrent,magnet:?xt=urn:btih:e3179f95460b061413575bdc34b70ccb5636850b
367009,"Der Turm der verbotenen Liebe / Nel Tower (Franz Antel (as Francois Legrand), Fritz Umgelter, Rapid Film, Films EGE, Filmes Cinematografica) [1968, Adventure, Drama, Erotic, DVDRip]",https://d.ptorrents.com/bt/[ptorrents.com].2975605.torrent,magnet:?xt=urn:btih:d50e7be9c165a2f5fb94f8fa01ecae1827e290c7
367010,"[Pornhub.com] DoubleSpicySquad [Colombia, Cali] (9 videos) [2023, Solo, Masturbation, Closeup, Sex Toys, Blowjob, Classic sex, 1080p, SiteRip]",https://d.ptorrents.com/bt/[ptorrents.com].2975195.torrent,magnet:?xt=urn:btih:2ef093a73ca5dc711b3fcf8330e175baab6e956e
367011,"[Bang.com] Purple Bitch, Lia Meow, Sia Siberia - Purple bitch, lia meow and sia siberia have a wild threesome [2021-12-30, Anal Play, Amateur, Anal, Cosplay, Dildo, Girl/Girl, Lesbian, Russian Girls, Toys, Threesome (FFF), 2160p, SiteRip]",https://d.ptorrents.com/bt/[ptorrents.com].2975125.torrent,magnet:?xt=urn:btih:9e0c3d2819fa54298130816726c66291ad237bd3
367012,"[VIPissy.com] Anita Blanche & Arina Shy - Messy Massage (04/18/2023) [2023, Lesbian, MILF, Massage, Pissing On Mouth, Kissing, Pussy Licking, Masturbation, Orgasm, 1080p]",https://d.ptorrents.com/bt/[ptorrents.com].2975318.torrent,magnet:?xt=urn:btih:baeabb2728f778d82fd92439f9a1e4b195c77b18
367013,"Hidden-Zone Asian Edition 01-15 April 2023 (133 Clips) [Amateur, Asian, Hidden Camera, Skinny, Spycam, Teen, Upskirt, Voyeur, 480p, 540p, 720p, 1080p, 2160p, CamRip]",https://d.ptorrents.com/bt/[ptorrents.com].2975579.torrent,magnet:?xt=urn:btih:4813c8873121d4910d96cb30d35f9c2a2991fdae
367014,"Foot Fetish Daily nenetl avril hardcore / Foot Fetish Daily nenetl avril hardcore [2022, Hardcore Foot Fetish, 1080p, HDRip]",https://d.ptorrents.com/bt/[ptorrents.com].2975648.torrent,N/A
367015,"[TeenSexMovs.com / TeenMegaWorld.net] Eva Red - I Need Your Attention And Dick! (04/21/2023) [2023, Teen, Big Ass, Gonzo, Hardcore, All Sex, 720p 3900kbps]",https://d.ptorrents.com/bt/[ptorrents.com].2975567.torrent,magnet:?xt=urn:btih:39847cd24b87e9f7ca07d1b5e53820e5bdc57693
367016,"[SexLikeReal.com/DeepInSex.com] Bunny Madison - Bombshell [2023, VR, Virtual Reality, POV, Hardcore, 1on1, Blonde, Masturbation, English Language, Hardcore, Straight, Blowjob, Handjob, Cum on Stomach, Cum on Tits, Cum on Pussy, Shaved Pussy, Big Tits",https://d.ptorrents.com/bt/[ptorrents.com].2975257.torrent,magnet:?xt=urn:btih:1ecb5d1abf0e2c5f9fe91144d32bf1616dfafed7
367017,"[LesbianSexuality.com] (27) SiteRip [2022, Lesbian, Teen, 1080p]",https://d.ptorrents.com/bt/[ptorrents.com].2975603.torrent,magnet:?xt=urn:btih:fa7c87449fe12672dab22c8a51bf867e099153e1
367018,"[OnlyFans.com / DreddXXX] Dredd Doggy Style Compilation 2 (Hazel Moore, April Olsen, Rory Knox, Jessie Rogers, Khloe Kapri, Romi Rain, Alexis Fawx, Angela White, Savannah Bond, Doctor Kelly, Freya Parker, Holly Day, Lolly Dames, Mona Azar, Nickey Hun",https://d.ptorrents.com/bt/[ptorrents.com].2975600.torrent,magnet:?xt=urn:btih:280862a3422ef7fb6b8126b6beae84f5e43a272a
367019,"[Transfixed.com/AdultTime.com] Eliza Eves, Erica Cherry(Slumber Party Peeking)[2023, Transsexual, Feature, Hardcore, All Sex, 1080p]",https://d.ptorrents.com/bt/[ptorrents.com].2975427.torrent,magnet:?xt=urn:btih:7582c1268e403729147d7eca67a8b6c78d8e0698
367020,"Studio SPC Cum Shots And Cum Swallowing Scenes Selected By Semen Fans Best 20 vol. 2 [ASW-104] (SPC) [cen] [2012, Blowjob, Cum Swallowing, Oral cum, Semen, Handjob, 480p] (Akari Hoshino, Mika Osawa, Shizuka Kano, Uta Kohaku)",https://d.ptorrents.com/bt/[ptorrents.com].2975345.torrent,magnet:?xt=urn:btih:697812a34c010b94da9c759720dcdfd191fdb9e5
367021,"[UltraFilms.com] Elizabeth T (Love Boner)[2023, ,Gonzo, Hardcore, All Sex, Couples, 1080p]",https://d.ptorrents.com/bt/[ptorrents.com].2975184.torrent,magnet:?xt=urn:btih:c9eb3fb526d0b6dbab757b921b2045a4d052aaf4
367022,"[NaughtyAmericaVR.com / NaughtyAmerica.com] Avery Black, Mazy Myers, Minxx Marley || Kyle Mason (Hot and sweaty trio Avery Black, Mazy Myers, and Minxx Marley love to work out on your thick cock! / 31816) [2023-04-21, Group Sex, POV, All Sex, Straigh",https://d.ptorrents.com/bt/[ptorrents.com].2975590.torrent,magnet:?xt=urn:btih:53a890754167f8ca0a0c7c7c223b96fda3cbe19f
367023,"[LegalPorno.com / AnalVids.com] Anna Esman - An Old Italian and a Young Escort Girl ! First anal (2023-04-20) [2023, anal, big butt, big tits, blowjob, deep throat, double penetration (DP), face fucking, facial, gapes, rough, teen, 480p, SiteRip]",https://d.ptorrents.com/bt/[ptorrents.com].2975157.torrent,magnet:?xt=urn:btih:e233bfee1407609c93f6fc2607ab8de823389c55
367024,"Creampie Confessions 3 (Raw Attack) [2023, Creampie, Cumshots, Erotic Vignette, Lingerie, POV, Small Tits, WEB-DL, 1080p] (Split Scenes) (Eliza Eves, May Thai, Alba Lala, Medusa Porn)",https://d.ptorrents.com/bt/[ptorrents.com].2975080.torrent,magnet:?xt=urn:btih:536d04c7d3446764c291e3f0e7edff8e44487da1
367025,"[HandsonHardcore.com / DDFNetwork.com] Katia De Lys - Needs Her Salsa [2013.06.23, Big Ass, DP, Natural Tits, 1080p, SiteRip]",https://d.ptorrents.com/bt/[ptorrents.com].2975595.torrent,magnet:?xt=urn:btih:090fdbace2ab3b3961474c529064f032fe9645ba
367026,"Sofia Simens - please DEEP YOUR DICK IN MY THROAT - saying my Step-sis (talk) [2023, Blowjob, 1080p, WebCam]",https://d.ptorrents.com/bt/[ptorrents.com].2975234.torrent,magnet:?xt=urn:btih:3f24db4486babbb6379cc6d38b6f5659216d2a06
367027,"Beautiful Tits Vol. 9/ Fine Boobs #9 (Mimefreak, Arch Angel) [2023, Gonzo, Hardcore, All Sex, WEB-DL, 1080p] (Hazel Moore , Blake Blossom , Lexi Luna , Odette Fox.)",https://d.ptorrents.com/bt/[ptorrents.com].2975190.torrent,magnet:?xt=urn:btih:4cea6976ed8a012a84d8ed6ec041e5a87e243344
367028,"[Moreamateurs.com] Swtmolly [2023-01-27, Lesbian, Strapon, 720p, WebCam]",https://d.ptorrents.com/bt/[ptorrents.com].2975280.torrent,magnet:?xt=urn:btih:07ebd05d54a86d2dc8a127446adb46b6bc9ed556
367029,"[Onlyfans.com] Callme k melons - Pregnant Sextape [2022, pregnant, pregnant sex, 1080p, SiteRip]",https://d.ptorrents.com/bt/[ptorrents.com].2975537.torrent,magnet:?xt=urn:btih:fb417790b80b2e56b13cb2a991e7657dd546cc28
367030,"[Mature.nl] Max Casanova (37), Sofia Pearl (EU) (38) - Naughty mom getting anal and a good hard fuck from her taxidriver (13806) [09-09-2020, Anal, Blowjob, Cum, Facial, Hardcore, Moms, Public Porn, Pussy Licking, Doggystyle, Orgasm, Titfuck, Big Nip",https://d.ptorrents.com/bt/[ptorrents.com].2975351.torrent,magnet:?xt=urn:btih:29802fee1d13840dcfbbababc65428f64f0d03eb
367031,"[IKillItTS.com / Trans500.com] Gabriela Estela - Getting it with this Big Booty (kill362) (2023-04-20) [2023, Transsexuals, Shemale, Anal, Blonde, Blowjob, Bubble Butt, Cumshot, Hardcore, Small Tits, 720p, SiteRip]",https://d.ptorrents.com/bt/[ptorrents.com].2975437.torrent,magnet:?xt=urn:btih:3899e72679fd86fe1b635b725f4662a2e7a9833a
367032,"[BDWC] Baddies #8/ Villains #8(Laurent Sky , Blacked ) [2023, Gonzo, IR ,Hardcore, All Sex , WEB-DL, 480p] (Split Scenes)(Kazumi, Vic Marie, Scarlett Jones, Riley Star.)",https://d.ptorrents.com/bt/[ptorrents.com].2975428.torrent,magnet:?xt=urn:btih:49a00563ffba29bdc50fe8ac547fb7ccc455a8f3
367033,"[OnlyFans.com / DreddXXX] Dredd Prone Bone Compilation 2 (Hazel Moore, Angel Youngs, Jessie Rogers, Mandy Muse, Amari Gold, Allie Adams, Charlotte Sins, Karmen Karma, Lolly Dames, Mandy Waters, Kelsi Monroe, Mona Azar, Rory Knox, Skye Mae, Sophia Bur",https://d.ptorrents.com/bt/[ptorrents.com].2975098.torrent,magnet:?xt=urn:btih:577cface7009f1f1e3ab812262a3485549b01624
367034,"[Bongacams] ToxicTiger - hairy-pussy anal toys [2023-04-20, Anal, Hairy, Amateur, Dildo, Toys, Masturbation, Squirt, 960p, WebCam]",https://d.ptorrents.com/bt/[ptorrents.com].2975325.torrent,magnet:?xt=urn:btih:451f34b568e97588d90506b1ef56e3ccf601060d
367035,"The Pen Pal / Pen Pal (Franck Vicomte , Marc Dorcel ) [2022, Feature, Couples, All Sex ,Hardcore ,Threesome ,Anal, WEB-DL 2160p] (Split Scenes) ( Alexa Flexy, Alyssa Bounty, Bonnie Dolce , Asia Vargas)",https://d.ptorrents.com/bt/[ptorrents.com].2975672.torrent,magnet:?xt=urn:btih:14b827cf7b4764136aa2b4e0dc46c1a3fcef5420
367036,"[LesbianSexuality.com] (27) SiteRip [2022, Lesbian, Teen, 2160p]",https://d.ptorrents.com/bt/[ptorrents.com].2975602.torrent,magnet:?xt=urn:btih:a7ddfbf9268713af4c908160daf1c0eb58dd9be1
367037,"Alien Autopsy / Alien Autopsy [2020, Horror, Sci-Fi, DVDRip]",https://d.ptorrents.com/bt/[ptorrents.com].2975279.torrent,magnet:?xt=urn:btih:90eeaafa744556d36bfa4ebbdedfbb594c00a8fd
367038,"[Cum4k.com] Gabbie Carter - Creamy Strokes [2019-05-28, Blonde, Teen, POV, Big Tits, Big Dick, Pale, Curvy, Cumshot, Facial, Creampie, Blowjob, Reverse Cowgirl, Cowgirl, Doggystyle, 2160p, SiteRip]",https://d.ptorrents.com/bt/[ptorrents.com].2975106.torrent,magnet:?xt=urn:btih:911d9aa13660c7ff1cf555f9934dba3e9a32ef70
367039,"[TheWhiteBoxxx.com / LetsDoeIt.com] Angelica Heart & Stefany Kyler - Double Package (07/31/2022) [2022, Threesome, MILF, Teen, Gonzo, Hardcore, All Sex, 480p]",https://d.ptorrents.com/bt/[ptorrents.com].2975168.torrent,magnet:?xt=urn:btih:6ac4d6de19ac7172116a985eb2b42b4dce5d5992
367040,"[21EroticAnal.com / 21Naturals.com] Mia Capri(Better Than Tea) [2023, Gonzo, All Sex, Hardcore, Anal 1080p]",https://d.ptorrents.com/bt/[ptorrents.com].2975429.torrent,magnet:?xt=urn:btih:0987976ade82b38b77b553839842787a4c35ed84
367041,"[SensualHeat.com / AdultPrime.com] Eyla Moore aka Casey Nohrman - She Loves To Ride Her Toy (04/20/2023) [2023, Solo, Strap-On, Teen, Masturbation, Orgasm, 1080p]",https://d.ptorrents.com/bt/[ptorrents.com].2975315.torrent,magnet:?xt=urn:btih:a18a5a8ad00c1a8ff6879dd820440a0fe999a9fe
367042,"[VRCosplayX.com] Anna De Ville - MALEFICENT A XXX PARODY [2022-06-23, Cum In Mouth, Babe, Fucking, Blowjob, Villain, Teen, 7K, 180, Doggystyle, Anal, Brunette, Movie, SideBySide, 3584p, SiteRip] [Oculus Rift/Vive]",https://d.ptorrents.com/bt/[ptorrents.com].2975206.torrent,magnet:?xt=urn:btih:f6575ee767dc75b347cd49e36940ce33ce1e51b5
367043,"Demon Sex / Demon Sex (Greg Lewolt) [2005, Sci-Fi, DVDRip]",https://d.ptorrents.com/bt/[ptorrents.com].2975601.torrent,magnet:?xt=urn:btih:c599bde1de8f5d3d39fa8e0e9bc44fb021397081
367044,"[Pornhub.com] IncredibleGirl [USA] (156 videos) [2021-2023, POV, Solo, Masturbation, Panties, 720p, 1080p, SiteRip]",https://d.ptorrents.com/bt/[ptorrents.com].2975238.torrent,magnet:?xt=urn:btih:18f09d6dae7e1bf817c70eee81554217ee90f5e9
367045,"[Graphis.ne.jp] 2019-10-18 Asuna Kawai - Limited Edition [Asian, Japanese, Gravure, Erotic, Idol, Posing, Solo, Unshaved, Japan] [1920x1280, 20 photos]",https://d.ptorrents.com/bt/[ptorrents.com].2975491.torrent,magnet:?xt=urn:btih:be290ea95f46eee4165ed38bf58572ea61b5d6ef
367046,"[OnlyFans.com / DreddXXX] Dredd Cowgirl Compilation 2 (Jessie Rogers, Hazel Moore, Angela White, Savannah Bond, Alexis Fawx, April Olsen, Rory Knox, Doctor Kelly, Freya Parker, Holly Day, Jenna Starr, Kayley Gunner, Khloe Kapri , Lolly Dames, Mona Az",https://d.ptorrents.com/bt/[ptorrents.com].2975609.torrent,magnet:?xt=urn:btih:aca80da671de33d1d236df923d39e2c9f5308a7b
367047,"Body Heat / Body Heat (with Russian translation) (Robby D, Digital Playground) [2010, Feature, Action, Big Budget, BDRip, 1080p] [rus] (Jesse Jane, Kayden Kross, Katsuni, Riley Steele, Raven Alexis , Bridgette B, Tommy Gunn, Manuel Ferrara, Mick Blue",https://d.ptorrents.com/bt/[ptorrents.com].2975441.torrent,magnet:?xt=urn:btih:9206c416a57bddd0e4595c2e68d02a6ed578fca7
367048,"[twitter.com/Goddess Rainn] Goddess Brooke Rainn [Bikini, Blonde, Big Tits, Domination, Erotic, Femdom, Fetish, Foot Fetish, Natural Tits, POV, Pregnant, Posing, Shaved, Softcore, Solo] [229x407-4032- 3024, 1102 photos, 1 set]",https://d.ptorrents.com/bt/[ptorrents.com].2975066.torrent,magnet:?xt=urn:btih:7112a4bbd817b3c18d334667af73ed02741a8475
367049,"[CzechVR.com] Ria Sunn - No Panties is Sexy (CzechVR 592) [17.04.2023, Anal, Anal Creampie, Bedroom, Big Tits, Blowjob, Braless, Brunette, Closeup, Couple, Cowgirl, Curvy, Czech, Doggy Style, Handjob, Hardcore, High Heels, Husband, Large Labia, Long",https://d.ptorrents.com/bt/[ptorrents.com].2975363.torrent,magnet:?xt=urn:btih:56abbc4246246ff425047e661dae5110525aeab5
367050,"[VRPorn.com/VRCucking] Tory Sweet - Fucking Daddy's Friend [2023-04-19, VR, Binaural Sound, Blonde, Blowjob, Cuckold, Cumshots, Doggystyle, Fingering, High Heels, Lingerie, Missionary, Natural Tits, Voyeur POV, Reverse Cowgirl, Russian, Sex, Shaved P",https://d.ptorrents.com/bt/[ptorrents.com].2975233.torrent,magnet:?xt=urn:btih:0cd3e83bd7b3999c3bb7087eef5ecf080b7fcde8
367051,"[XSinsVR.com] Alexis Crystal - One Ass versus Three Dicks [2023-04-01, Babe, European, Leggy, Natural, Petite, Small tits, POV, Nylon, Lingerie, English speaking, Teasing, Ass gaping, Anal, Pornstar , Blowjob, BoyGirl (hardcore), VR - Virtual-Reality",https://d.ptorrents.com/bt/[ptorrents.com].2975453.torrent,magnet:?xt=urn:btih:cdbf899842febffa60e36967591c8262588f63fa
367052,"Love at Sea / Love at Sea (DORCEL / HPG Prod) [2022, Anal, Ass to Mouth, Big Dicks, Gaping, Group Sex, Threesomes, WEB-DL] (Split Scenes) (Amirah Adara, Angel Emily, Honey Demon, Kesha Ortega, Nelly Kent",https://d.ptorrents.com/bt/[ptorrents.com].2973933.torrent,magnet:?xt=urn:btih:baa43c6a74ff6d4e87f6e245f0ae5f853cb429b2
367053,"Tushy Raw V43 / Raw Buns 43 (Tushy Raw) [2022, Anal, Ass to Mouth, Big Dicks, Big Tits, Blowjobs, Cumshots, Gaping, Naturally Busty, Sex Toy Play, WEB-DL] (Split Scenes) ( Scarlett Jones, Tommy King, Candice Dare, Honey Hayes)",https://d.ptorrents.com/bt/[ptorrents.com].2974624.torrent,magnet:?xt=urn:btih:3cb169860859dfc5a8a6254fec092cdeccfda8ee
367054,"[VRLatina.com] April Angel - Too Hot To Handle [27.03.2023, Big Ass, Big Tits, Blowjob, Booty Shorts, Brunette, Bubble Butt, Cowgirl, Cum On Pussy, Cum On Stomach, Doggy Style, Handjob, Latina, Lingerie, Missionary, Pov, Reverse Cowgirl, Shaved, Tatt",https://d.ptorrents.com/bt/[ptorrents.com].2974350.torrent,magnet:?xt=urn:btih:2df33597d5a7001ea02afedc2e59e5f258905b2e
367055,"Dirty Masseur #25 / Dirty Masseur 25 (Brazzers) [2022, All Sex, Big Dicks, Big Tits, Ethnic, Massage, Oiled, WEB-DL, 720p] (Emma Hix, Richelle Ryan, Karma RX, Diamond Jackson, Vienna Black Nathaly Cherie",https://d.ptorrents.com/bt/[ptorrents.com].2974040.torrent,magnet:?xt=urn:btih:06123aeab7cd923e699242ef239b1bbd31da19d1
367056,"[SexLikeReal.com/VRpornjack] Sarah Diamond - Sarah's Holly Glory [2021-11-23, VR, Blowjob, Brunette, Cumshot, Facial, Gloryhole, Lipstick, Fishnet Stockings, NonPOV, Shaved Pussy, Teen / Young, SideBySide, 3072p, SiteRip] [Oculus Rift/Vive]",https://d.ptorrents.com/bt/[ptorrents.com].2974229.torrent,magnet:?xt=urn:btih:1302ebdaf6beafaad8253de34bb4372856c44ce7
367057,"Roberta Gemma (Roberta Missoni, Floriana Panella) (31 videos) Pack [2007-2020, Anal, Big Ass, Big Tits, Blowjob, Facial, Handjob, MILF, Natural Tits, POV, Straight, Titfuck, 1080p, 720p]",https://d.ptorrents.com/bt/[ptorrents.com].2974633.torrent,magnet:?xt=urn:btih:2f449a9d671bb25711d7c90bf6b8b13b2dd64d04
367058,"Tushy Raw V41 / Raw Buns 41 (Tushy Raw) [2022, Anal, Ass to Mouth, Big Dicks, Big Tits, Blowjobs, Cumshots, Gaping, Naturally Busty, Sex Toy Play, WEB-DL] (Split Scenes) ( Savannah Bond, Bella Rolland, Lena Anderson, Nicole Aria, Olivia Sparkle)",https://d.ptorrents.com/bt/[ptorrents.com].2974626.torrent,magnet:?xt=urn:btih:5da5eee472610c4ba9759de19e28608a2316697b
