id,title,torrent_url,magnet
366724,"Tushy Raw V44 / Raw Buns 44 (Tushy Raw) [2023, Anal, Ass to Mouth, Big Dicks, Big Tits, Blowjobs, Cumshots, Gaping, Naturally Busty, Sex Toy Play, WEB-DL, 1080p] (Split Scenes ) (Kenna James, Pristine Edge, Penelope Woods, Lina Luxa)",https://d.ptorrents.com/bt/[ptorrents.com].2974301.torrent,magnet:?xt=urn:btih:4179944be0410cd54fda4f6b65a0610f446e5b96
366725,"[DreamTranny.com] Gabriela Estela & Pietra Candy - Fabulous Fucking Four-Way (2023-04-13) [2023, Transsexuals, Shemale, Anal, Bareback, Blonde, Blowjob, Cumshot, Foursome, Hardcore, Small Tits, 1080p , SiteRip]",https://d.ptorrents.com/bt/[ptorrents.com].2973795.torrent,magnet:?xt=urn:btih:1aac676ab8c5203287bea2854d7747c217e78682
366726,"[DigitalPlayground.com] Chanel Preston & Nina North - Banging the Babysitter [2018-04-25, Big Tits, Lesbian, MILF, Masturbation, Tattoos, 720p, SiteRip]",https://d.ptorrents.com/bt/[ptorrents.com].2974809.torrent,magnet:?xt=urn:btih:030233086bdc4b1078f2b5b1b03e7a51b9b8d916
366727,"BriannaBellxxx.com - Brianna Bell (12 videos) - Femdom, Footfetish, Legs, Heels, Cam Play (BriannaBellxxx.com, BriannaBellxxx.com) [2020, Femdom, Footfetish, High Heels, Legs, Dirty talks, Cum Play, Blowjobs, 2160p, HDRip]",https://d.ptorrents.com/bt/[ptorrents.com].2972454.torrent,magnet:?xt=urn:btih:0e20416f95b72787a58d7f1d5bcd4fe21c9a4718
366728,"Yayoi Mizuki - Spence Breast Development Clinic [PPPE-116] (Oppai) [cen] [2023, Creampie, Big Tits, Titty Fuck, Hardcore, Squirting, HDRip] [720p]",https://d.ptorrents.com/bt/[ptorrents.com].2973980.torrent,magnet:?xt=urn:btih:a32b063e1435590520e0debe5cbed5348b563971
366729,"[SexBabesVR.com] Lady D - Surprise For Hotwife [2023-04-14, 5K+, 60fps, POV, blowjob, brunette, cowgirl, doggystyle, facial, cumshot, girl-boy, hardcore, masturbation, missionary, pussy licking, reverse cowgirl, shaved pussy, small boobs, tattoo, VR,",https://d.ptorrents.com/bt/[ptorrents.com].2974983.torrent,magnet:?xt=urn:btih:2e70c496c678228a07f7df5c3be6cc164fe2e6ef
366730,"[SLR Originals / SexLikeReal.com] Bella Rolland, Maddy May - Birthday Anal Competition [2023-04-12, Anal, Big Ass, Big Tits, Brunette, Close Ups, Cowgirl, Reverse Cowgirl, Facials, Fisheye, 200°, 60 FPS, Doggy Style, Hardcore, Missionary, Oiled, Engl",https://d.ptorrents.com/bt/[ptorrents.com].2973913.torrent,magnet:?xt=urn:btih:61668159e85db2f42ec2c55476b416e8e8276eb7
366731,"[Tiny4K.com] Hime Marie - Pussy Stretch [2021-12-23, All Sex, Masturbation, Blowjob, Cum Shot, Small Tits, Natural Tits, 2160p, SiteRip]",https://d.ptorrents.com/bt/[ptorrents.com].2969501.torrent,magnet:?xt=urn:btih:3358f83b45d6d961ffa779652bceb403e56907b8
366732,"[LegalPorno.com / PissVids.com] Greta Foss - My first Anal Goes Wet, Greta Foss, BWC, Balls Deep, No Pussy, Rough Sex, Big Gapes, Pee Drink, Cum in Mouth, Swallow XF302 (2023-04-17 ) [2023, anal, ass to mouth, big ass, blowjob, cum swallowing, deep t",https://d.ptorrents.com/bt/[ptorrents.com].2974708.torrent,magnet:?xt=urn:btih:1cd16e06b7be9af81f4af21606a10a551832f8cc
366733,"[pornhub.com] Sweety Fox - Wild Brunette Worked Out Gift With Deepthroat & Hot Fuck till Cum on Pretty Face (Blowjob, Stocking) [2023-04-14, Amateur, Brunette, Big Ass, Big Tits, Blowjob, Cumshot, Stockings , Teen, 1080p, SiteRip]",https://d.ptorrents.com/bt/[ptorrents.com].2974998.torrent,magnet:?xt=urn:btih:17a6554c26e8ba5f8bfb571293cae826997205a1
366734,"[CzechVRFetish.com] Vine - Take a Good Look! (CzechVRFetish 388) [05.04.2023, Big Pussy Lips, Blonde, Close ups, Croptop, Curvy, Gaping, Kitchen, Long Hair, Masturbation, Natural Boobs, POV, Pussy Closeup, Pussy Gaping, Shaved Pussy, Shorts, Speculum",https://d.ptorrents.com/bt/[ptorrents.com].2972250.torrent,magnet:?xt=urn:btih:e037e2cb6e6d11c395e7eed7cb7582f660b6c286
366735,"[DPFanatics.com / 21Sextury.com] Sata Jones (Straight To The Point)[2023, Gonzo, All Sex, Hardcore, Anal, DP 1080p]",https://d.ptorrents.com/bt/[ptorrents.com].2974102.torrent,magnet:?xt=urn:btih:35a142b7d96e1680a15b3c35cafc68c408669c90
366736,"[PornWorld.com] Emily F aka Kennia Lex, Emily First - Pair Of Teachers DP And Facialize Horny Girl GP2630 (04/08/2023) [2023, DP, Anal, Teen, Gonzo, Hardcore, 1080p]",https://d.ptorrents.com/bt/[ptorrents.com].2972061.torrent,magnet:?xt=urn:btih:1fa2f0192eef2bbd8fae5dab92239f8717fc053f
366737,"Fujiko Mio - Banned 15 Beauty Student Nanami (21) [WZEN-063] (Naomi, Waap Entertainment) [cen] [2023, Creampie, Older Sister, Deep Throat, Drug, Confinement, Evil, HDRip] [720p]",https://d.ptorrents.com/bt/[ptorrents.com].2972937.torrent,magnet:?xt=urn:btih:db7c0883fd30ad144f3188aec75388a643310f23
366738,"[OnlyFans.com / DreddXXX] Dredd Doggy Style Compilation 1 (Esperanza Gomez, Sophia Burns, Catherine Knight, Charlotte Sins, Tommy King, Violet Starr, Hime Marie, Angel Youngs, Daisy Rae, Kayla Jade, Lola Rose, Mandy Muse, Kelsi Monroe, Payton Preslee",https://d.ptorrents.com/bt/[ptorrents.com].2973724.torrent,magnet:?xt=urn:btih:90f5dd11aac21b9d1c56532d339221c577f3d75b
366739,"[SexLikeReal.com/No2StudioVR] Ariana - Ariana's Holly Glory [2022-08-05, VR, Blonde, Blowjob, Cumshots, Facials, Gloryhole, Handjob, English Speech, NonPOV, Shaved Pussy, Tattoos, Glasses, SideBySide, 3072p, SiteRip ][Oculus Rift/Vive]",https://d.ptorrents.com/bt/[ptorrents.com].2974201.torrent,magnet:?xt=urn:btih:13ef25cedfac8187b9c66ff53f8567ee1474ec76
366740,"[BaDoinkVR.com] Blake Blossom, Kay Lovely - Better Together [2023-04-14, Facial, Big Tits, 7K, Blonde, Hairy, Threesome, Blowjob, Babe, Pornstar, Doggystyle, 180, VR, SideBySide, 3584p, SiteRip ][Oculus Rift/Vive]",https://d.ptorrents.com/bt/[ptorrents.com].2974908.torrent,magnet:?xt=urn:btih:1731b61e7de4f1c1c04273528a3edda64623cd37
366741,"Peccato veniale / A sin worthy of forgiveness (Salvatore Samperi, Clesi Cinematografica) [1973, Comedy, DVD5] [rus] (Laura Antonelli, Alessandro Momo, Orazio Orlando)",https://d.ptorrents.com/bt/[ptorrents.com].2973963.torrent,magnet:?xt=urn:btih:d401e6c6a159fe44d4b4337f6d89fc45cf208975
366742,"[Tushy.com] Kelly Collins & Sia Siberia - Birthday Gift (2023-04-09) [2023, Anal, Big Tits, Blowjob, Bubble Butt, Gonzo, Hardcore, Natural Tits, Petite, Small Tits, Threesome, 1080p, SiteRip ]",https://d.ptorrents.com/bt/[ptorrents.com].2972497.torrent,magnet:?xt=urn:btih:40b123de6cd7a1b62531b9aaaf2aef09ac5af729
366743,"[MyDirtyVault.com / BangBros.com] 2021-10-08 Rose Monroe - Rose Monroe's Big Ass Fucks BBC (dv17924) [all sex, blowjob, brunette, hardcore, cumshot, latina, big ass, interracial, big tits, shaved, deep throat, petite, big dick, busty, big booty, dogg",https://d.ptorrents.com/bt/[ptorrents.com].2974583.torrent,magnet:?xt=urn:btih:cf651866008fd9c47a34db0356a266453b509ec0
366744,"[FitnessRooms.com / SexyHub.com] Cherry Kiss, Katy Rose, Mina K aka Mina - Lesbian Threesome With Yoga Teacher (04/18/2023) [2023, Threesome, Lesbian, Kissing, Pussy Licking, Masturbation, Orgasm, 1080p]",https://d.ptorrents.com/bt/[ptorrents.com].2974736.torrent,magnet:?xt=urn:btih:dc80d37100a7942a523fa87cfcfe3c6bdbb18f26
366745,"Jennifer Stone (Scene from ""Voglio Anali"") [2010, Anal, Straight, BBC., DVDRip]",https://d.ptorrents.com/bt/[ptorrents.com].2974985.torrent,magnet:?xt=urn:btih:48c3e4db049a3aef4f1f9506d458daf1ea39c360
366746,"[Onlyfans.com / EvaElfie.com] Eva Elfie - Anal with boyfriend [2023-04-08, Anal, Babyface, Blowjob, Russian Girls, Straight, Teen, 720p, SiteRip]",https://d.ptorrents.com/bt/[ptorrents.com].2972317.torrent,magnet:?xt=urn:btih:0a68830570d77f1bed74137706a3f7d6b1b84862
366747,"[RealJamVR.com] Arabelle Raphael - BDSM: Session with Arabelle Raphael [2023-04-09, American, Anal, BDSM, Big tits, Boobs, Brunette, Butts, Cowgirl, Doggy style, English speech, French, Hardcore, MILF, Missionary, Pornstars, POV, Reverse cowgir, Tatt",https://d.ptorrents.com/bt/[ptorrents.com].2974903.torrent,magnet:?xt=urn:btih:e8d7a4b7f08543aede6c76b74421ae90de68408d
366748,"[MetArt.com] 2023-04-09 Charlotte Brooke - Presenting Charlotte Brooke, Arina Shy - Private Party, Debora C - Healthy Glow [Solo, Posing, Glamour] [3648x5472-4480x6720, 359 photos]",https://d.ptorrents.com/bt/[ptorrents.com].2972393.torrent,magnet:?xt=urn:btih:5b54ad292d4e68d6355a3fe583646b5c57d5a370
366749,"Nishimura Nina, Yuki Chitose (Saegusa Chitose / Yura Chitose) - Wet And Sweaty Sex In A Mixed Bathing Sauna [JUQ-228] (Biba☆Gonzo, Madonna) [cen] [2023, Big Tits, Married Woman, Slut, Mature Woman HDRip] [720p]",https://d.ptorrents.com/bt/[ptorrents.com].2971957.torrent,magnet:?xt=urn:btih:33e1ad611ddca96352e8b66deb51cbf087f96cf4
366750,"Katou Momoka (Satou Nonoka) - [Uncensored Leaked] [Anthropomorphic AV] My Smartphone Has Become A Sensitive Girl, But Also Kato Momo ) [uncen] [2019 / 2023, Uncensored, All Sex, BlowJob, Cunnilingus, Pissing, Cosplay, HDRip] [1080p]",https://d.ptorrents.com/bt/[ptorrents.com].2972195.torrent,magnet:?xt=urn:btih:cd1feafcc3eae701d0d26877e54ac73adc6e8c05
366751,"[Abbywinters.com] Selvaggia - Outdoors [2023-04-08, Solo, 1080p]",https://d.ptorrents.com/bt/[ptorrents.com].2972192.torrent,magnet:?xt=urn:btih:034b5f30c8e4b3f77ec466b47fc71e5757fee41e
366752,"[X-Sensual.com / DirtyFlix.com] Lina Star aka Lina Shisuta - Teeny Has Anal Sex In A Kitchen (04/15/2023) [2023, Anal, Teen, Gonzo, Hardcore, 480p]",https://d.ptorrents.com/bt/[ptorrents.com].2973908.torrent,magnet:?xt=urn:btih:ff9751ca778d6b5499ca5e96730754b3b550ede5
366753,"[Graphis.ne.jp] 2018-04-06 Miko Matsuda - Metamorphosis [Asian, Japanese, Gravure, Erotic, Idol, Posing, Unshaved, Shaved, Japan] [1920x1278, 120 photos]",https://d.ptorrents.com/bt/[ptorrents.com].2974614.torrent,magnet:?xt=urn:btih:95240add68f1a15cd9f8632e72047a46fcbec815
366754,"[NaughtyAmericaVR.com / NaughtyAmerica.com] Bella Blu , Chanel Camryn , Lilian Stone || Kyle Mason (COCK HUNGRY COWGIRLS / Hot cowgirls Bella Blu, Chanel Camryn, and Lilian Stone want to ride your big cock like a wild bull! / 31806) [2023-04-14, POV,",https://d.ptorrents.com/bt/[ptorrents.com].2973722.torrent,magnet:?xt=urn:btih:c70ccf94bc15375201d3e93c71c0a47e3c64dffe
366755,"[Graphis.ne.jp] 2018-05-02 Miko Matsuda, Moko Sakura - Limited Edition [Asian, Japanese, Gravure, Erotic, Idol, Posing, Unshaved, Japan] [1920x1278, 20 photos]",https://d.ptorrents.com/bt/[ptorrents.com].2974621.torrent,magnet:?xt=urn:btih:217a0bc6465125c7aac7eff47156aae9fe26db0f
366756,"[PornWorld.com] Lia Lin - Skinny Babe Lia Lin Fucks Her Boyfriend After Morning Masturbation GP2640 (04/19/2023) [2023, Teen, Gonzo, Hardcore, All Sex, 1080p]",https://d.ptorrents.com/bt/[ptorrents.com].2974953.torrent,magnet:?xt=urn:btih:d59283c7a6376fbaef5b9772b5dc0d874886aa84
366757,"[PenthouseGold.com] Lia Lin - Exotic Nurse Lia Lin Fucks In The C (04/09/2023) [2023, Teen, Gonzo, Hardcore, All Sex, 720p]",https://d.ptorrents.com/bt/[ptorrents.com].2972427.torrent,magnet:?xt=urn:btih:8d18821a79681f6d8fa9ef147d93338a0faf981a
366758,"[Pornhub.com] BigDarkLips [UK] (46 videos) [2022-2023, Amateur, Homemade, Solo, Masturbation, Closeup, Sex Toys, SD, 720p, 1080p, SiteRip]",https://d.ptorrents.com/bt/[ptorrents.com].2974277.torrent,magnet:?xt=urn:btih:eac1b09471778123cbbe2ab658ad8bb50e77962c
366759,"[BrazzersExxtra.com / Brazzers.com] Lila Lovely And Katie Kush - Squirty Pregnant GF & Paramedic Threesome (09-01-2023) [2023, Threesome, Big Tits, Big Ass, BBW, Squirting, Pregnant, BJ, Gonzo , Hardcore, All Sex, SiteRip]",https://d.ptorrents.com/bt/[ptorrents.com].2947494.torrent,magnet:?xt=urn:btih:7835401226127d4cae43fc37c6db6b2b054a9a11
366760,"[Pornhub.com] ArtErotica [USA, Los Angeles] (173 videos) [2015-2023, Closeup, Blowjob, Cunnilingus, Classic sex, SD, 720p, 1080p, SiteRip]",https://d.ptorrents.com/bt/[ptorrents.com].2974232.torrent,magnet:?xt=urn:btih:36071230d2823b4864f9eba66cbce51a29c319e8
366761,"NTR.CASE02 -淫花、咲ク- / NTR.CASE02 -Indecent Flower, Saku- [1.0] (HUMAN BASSIST) [cen] [2023, jRPG, NTR, School / Academy, Cuckoldry (Netorare), Masturbation, Shame / Humiliation , Orgy Sex, Urination / Peeing, Anal, Oral, Cumshot] [jap]",https://d.ptorrents.com/bt/[ptorrents.com].2974016.torrent,magnet:?xt=urn:btih:3927f81b6df7ecd581daed80839a2a3675669bc9
366762,"[Perfect18.com] Julia Swork aka Angel Kris, Angel Kriss - Solo (04/17/2023) [2023, Solo, Teen, Masturbation, Orgasm, 1080p]",https://d.ptorrents.com/bt/[ptorrents.com].2974544.torrent,magnet:?xt=urn:btih:965b229aab01bddf001886e71b6703ab443bd377
366763,"[pornworld.com] 2003 Vica aka Natalya aka Natasha - Moldovan Vika [Oral, Deep throat] [1689x2592, 115 photos]",https://d.ptorrents.com/bt/[ptorrents.com].2974588.torrent,magnet:?xt=urn:btih:00045f34f7ac31df62bad6a070af0792201d8d19
366764,"Korean blogger Yumi 03 [Teen, Dildo / Toys, Korean] [640x854 - 3024x4032, 56 photos, 1 sets]",https://d.ptorrents.com/bt/[ptorrents.com].2974836.torrent,magnet:?xt=urn:btih:648e169e70505e2fa94ef4f1160e341a803729fc
366765,"[LethalHardcoreVR.com] Demi Hawks - Tiny 84 Pound Teen Demi Loves Huge Cock [2023-04-17, VR, Big Cock, Blonde, Blowjob, Cowgirl, Cum On Face, Cumshot, Doggystyle, Missionary, Natural Tits, Piercing, Reverse Cowgirl, Shaved Pussy, Small Tits, Petite,",https://d.ptorrents.com/bt/[ptorrents.com].2974827.torrent,magnet:?xt=urn:btih:20e0154e1217587e9132b98d23bdac0460650626
366766,"[MetArt.com] 2023-04-08 Gia Rae - Neon Fun , Emelie Crystal - Vacation Time, Sky Pierce - Pulse Racing, Sailor - Head To Toe [Solo, Posing, Glamour] [4024x6048-4480x6720, 573 photos]",https://d.ptorrents.com/bt/[ptorrents.com].2972232.torrent,magnet:?xt=urn:btih:3ab77ccaf5d4169febf4c3edc1beb736be7657fc
366767,"[LegalPorno.com / AnalVids.com] Anita Snow - Hard Anal 18yo Anita Snow with Big Cock, Gapes and Cum in Mouth (2023-04-08) [2023, anal, blowjob, deep throat, gapes, small tits, teen, 1080p, SiteRip]",https://d.ptorrents.com/bt/[ptorrents.com].2972079.torrent,magnet:?xt=urn:btih:494d86b886bae1764d3b62d8de8d4cd4f05cce8c
366768,"[onlyfans.com] Dawn Marie (@tildawn) [Full nude photos. Including public nudity, butt plugs, showers and tons more.] [800x100 - 4032x3024, 964]",https://d.ptorrents.com/bt/[ptorrents.com].2974337.torrent,magnet:?xt=urn:btih:87cd33c165f9e3c6171d756424cbbf1b2c4ba93c
366769,"[Blacked.com] Jia Lissa - Secret Session (2023-04-15) [2023, Anal, Blowjob, Bubble Butt, Gonzo, Hardcore, Interracial (IR), Natural Tits, Redhead, Small Tits, 720p, SiteRip]",https://d.ptorrents.com/bt/[ptorrents.com].2974024.torrent,magnet:?xt=urn:btih:421cdb00706879139f781127a17ba7208ad0a616
366770,"[BangBus.com / BangBros.com] Anna Kovachenko - Hot Yoga Student Banged in Bus (bb19087) [2023-04-05, blowjob, anal, white, hardcore, cumshot, facial, blonde, interracial, small tits, shaved, deep throat, doggy, euro, cowgirl, doggystyle, missionary,",https://d.ptorrents.com/bt/[ptorrents.com].2971386.torrent,magnet:?xt=urn:btih:22e3b5faee2ac796248ca977fbf65713fd9b3242
366771,"[PenthouseGold.com] Lia Lin - Exotic Nurse Lia Lin Fucks In The C (04/09/2023) [2023, Teen, Gonzo, Hardcore, All Sex, 1080p]",https://d.ptorrents.com/bt/[ptorrents.com].2972426.torrent,magnet:?xt=urn:btih:c60b535665ddec8a1660e9b6c1e5563a5f37e2c9
366772,"[LegalPorno.com / AnalVids.com] Monika Fox - Balls Deep, Monika Fox, 1on1, BBC, Anal and No Pussy, ATM, Rough Sex, Big Gapes, ButtRose, Squirt, Cum in Mouth, Swallow GL599 [11-01- 2022, Anal, Ass To Mouth, Blonde, Blowjob, Cum Swallowing, Deep Throat",https://d.ptorrents.com/bt/[ptorrents.com].2975044.torrent,magnet:?xt=urn:btih:5483008a812a57054b97802fca951a505a382002
366773,"[LegalPorno.com/Pornbox.com] Bella Tornado & Baby Bamby - VS Italian Monster Cock by Leo Casanova - Original Series[2023, Gonzo, Hardcore, All Sex, Anal, 480p]",https://d.ptorrents.com/bt/[ptorrents.com].2974178.torrent,magnet:?xt=urn:btih:7a2cdd4e91f4cce2820fef6597ac321d6b0b4c30
366774,"[Manyvids.com] Mila Volker - Oiled Boobs Bouncing In Slow Motion [2020-03-01, Big Tits, Natural Tits, Solo, 720p, SiteRip]",https://d.ptorrents.com/bt/[ptorrents.com].2974821.torrent,magnet:?xt=urn:btih:2d20bcbd03f5077c29495f6403f55403ff3e341e
366775,"[SexLikeReal.com/VRixxens] Miley Sin - Gloryhole Tryout [2022-11-04, VR, Blowjob, Brunette, Cum In Mouth, Gloryhole, Doggystyle, Hardcore, Fishnet Stockings, NonPOV, Glasses, SideBySide, 3072p, SiteRip] [Oculus Rift/Vive]",https://d.ptorrents.com/bt/[ptorrents.com].2974209.torrent,magnet:?xt=urn:btih:fab218f6f51934a6608a7b4b9107d0e5e1e6c57e
366776,"[YoungCourtesans.com / DirtyFlix.com] Rebecca Nikson - Magic Sex With Blue-Haired Teen (04/07/2023) [2023, Teen, Gonzo, Hardcore, All Sex, 720p]",https://d.ptorrents.com/bt/[ptorrents.com].2972133.torrent,magnet:?xt=urn:btih:b80d26fab829c668965e98ec1dfbd78144da7f51
366777,"[VRHush.com] Hazel Moore - The Heroic Seeds [17.04.2023, Blowjob, Brunette, Closeup Missionary, Cowgirl, Doggy Style, Hairy Pussy, Handjob, Implied Creampie, Long Hair, Masturbation, Missionary, Natural Tits, POV, Reverse Cowgirl , Standing Missionar",https://d.ptorrents.com/bt/[ptorrents.com].2974895.torrent,magnet:?xt=urn:btih:573381de527cfff3ad106274ce983a8c57d096de
366778,"[Juicy-Honey.com] 2019-03-29 Kana Momonogi, AIKA, Suzu Honjo, JULIA - Authentic Visual Collection Cards PLUS#2 [Asian, Japanese, Gravure, Erotic, Idol, Posing, Unshaved, Shaved, Japan] [1920x1280 , 400 photos]",https://d.ptorrents.com/bt/[ptorrents.com].2973886.torrent,magnet:?xt=urn:btih:6b570760696c7999da369dca043599f85b6fb738
366779,"[TSGirlfriendExperience.com / Trans500.com] Marcela Dimov - Laying it on Marcela (tsgfe077) (2023-04-06) [2023, Transsexuals, Shemale, Anal, Big Tits, Blowjob, Brunette, Bubble Butt, Cumshot, Hardcore , 2160p, SiteRip] 4K",https://d.ptorrents.com/bt/[ptorrents.com].2971846.torrent,magnet:?xt=urn:btih:faefb2b869b01d7f14e25779cf0d22e41e2b0f67
366780,"[SexLikeReal.com/VRpornjack] Bella Blue - Bella's Holly Glory [2022-07-26, VR, Blowjob, Close Ups, Gloryhole, Handjob, NonPOV, Redhead, Shaved Pussy, Tattoos, SideBySide, 3072p, SiteRip] [Oculus Rift / vive]",https://d.ptorrents.com/bt/[ptorrents.com].2974204.torrent,magnet:?xt=urn:btih:6202ad5002f3db864d50c8feac167282389abaa6
366781,"[AssHoleFever.com / 21Sextury.com] Kitty Li - The Deep End (04/15/2023) [2023, Anal, MILF, Gonzo, Hardcore, 2160p]",https://d.ptorrents.com/bt/[ptorrents.com].2973865.torrent,magnet:?xt=urn:btih:9a1f3fc167c661edc13eda6bd2585d47a5d0b358
366782,"Neo Akari - Exposing Your True Nature By Drinking Alcohol! Dirty Little Schoolgirl! ? No Script! No Rubber! 2 Days And 1 Night! Completely Private Vero Sickness Creampie Staying Gonzo Date 4 Sex! [MVSD-543] (M's Video Group) [cen] [2023, Creampie, PO",https://d.ptorrents.com/bt/[ptorrents.com].2974659.torrent,magnet:?xt=urn:btih:415c42be852285613b159ad2cc163f8179ba1752
366783,"[MetArt.com] 2023-04-15 Camilla Benz - Presenting Camilla Benz, Eness - Fine China, Rona Talin - Classical Art, Rosalina - Summer Breeze [Solo, Posing, Glamour] [4024x6048-5464x8192, 483 photos]",https://d.ptorrents.com/bt/[ptorrents.com].2973952.torrent,magnet:?xt=urn:btih:ea0e54a9d7cc068b4bff6884c2197027cdf89c92
366784,"[18VR.com] Valentina Lapiedra, Shrima Malati - Two Is Better Than One [2023-04-10, 180, Blowjob, Facial, Doggystyle, Tattoo, Brunette, Threesome, Babe, Anal, Cum On Body, 5K, VR, SideBySide , 2700p, SiteRip] [Oculus Rift / Vive]",https://d.ptorrents.com/bt/[ptorrents.com].2973658.torrent,magnet:?xt=urn:btih:8232275f26fc20e3df789ce0be2a8b3421ec37c4
366785,"Yasui Kaoru - 98cmH Cup Big Breasts Gravure! The Ban On Kaoru Yasui's Vaginal Cum Shot Is Lifted! Transfer SPECIAL! [PPPE-111] (Oppai) [cen] [2023, Creampie, 3P, 4P, Big Tits, Titty Fuck, Entertainer, HDRip] [720p]",https://d.ptorrents.com/bt/[ptorrents.com].2973689.torrent,magnet:?xt=urn:btih:fddfb60aa8267d11b72ff0c663c170141cbce561
366786,"[Mature-Lessons.com] (28 videos) Pack [2016 2017, Mature, Teen, Threesome (FFM), 480p, 720p]",https://d.ptorrents.com/bt/[ptorrents.com].2974362.torrent,magnet:?xt=urn:btih:3db3e9f4cf1c21811fd1874cde6368888d7c36eb
366787,"[Digital Photobook] 2019-03-01 AIKA - Aphrodite [Asian, Japanese, Gravure, Erotic, Idol, Posing, Shaved, Japan] [1920x1280, 88 photos]",https://d.ptorrents.com/bt/[ptorrents.com].2973890.torrent,magnet:?xt=urn:btih:add7a3de9c55882ba5e8a337c5c3ca48eaf5a4c2
366788,"[SexArt.com / MetArt.com] Nata Ocean & Lili Charmelle - Guide To Pleasure [2023-01-06, Lesbian, Toys, blue eyes, pretty face, perky tits, slim, pale, russian, european, brunette, slender, blonde, long hair, tight body, small natural ass, fit body, mo",https://d.ptorrents.com/bt/[ptorrents.com].2974157.torrent,magnet:?xt=urn:btih:010d17f07f6ad2a18f30acd759574a68b49304f9
366789,"Otsu Alice, Chanyota - When I Called A Slut Who Specializes In A Reverse 3P, The Women Who Used To Bully Me A Long Time Ago Came... I Trained A Cheeky Tanned Plump Busty Gal With Money And Cock! [JUFE-475] (Fitch) [cen] [2023, Creampie, 3P, 4P, Gal,",https://d.ptorrents.com/bt/[ptorrents.com].2973992.torrent,magnet:?xt=urn:btih:4a02f07fde5ea0b40504666c16874d135979a3dd
366790,"[SexMex.xxx] Connie Garcia (Fucking in Front of Grandpa) [2021, Threesome FMM, Hardcore, Oral, Blowjob, All Sex, 720p]",https://d.ptorrents.com/bt/[ptorrents.com].2968814.torrent,magnet:?xt=urn:btih:38f6514fb6decda20f6f73f5dfa2a5c62e85f3f2
366791,"[LegalPorno.com / AnalVids.com] Alice Atwood - PISS BDSM with Young babe ! Pissing humiliation (2023-04-16) [2023, anal, ass to mouth, cum swallowing, deep throat, face fucking, facial, gapes, piss, rough, small tits, teen, 1080p, SiteRip]",https://d.ptorrents.com/bt/[ptorrents.com].2974085.torrent,magnet:?xt=urn:btih:3b86e1ae791de01e06286ca989d0bf39b400daf2
366792,"[CzechVRFetish.com] Eden Ivy - Touch Yourself (CzechVRFetish 308) [09/08/2021, Brunette, Closeup, Cum Licking , Cum Play, Dildo, Fetish, Fingering, Jerk Off Instruction, Lingerie, Living Room, Long Hair, Masturbation, Natural Tits, Nipple Play, Panti",https://d.ptorrents.com/bt/[ptorrents.com].2974052.torrent,magnet:?xt=urn:btih:19d621e5d0e6c783606fe1a28970cab554298269
366793,Les orgasmes de Lara Juicy vol.1,https://d.ptorrents.com/bt/[ptorrents.com].2974595.torrent,magnet:?xt=urn:btih:380c6f328fac2855a3e10e3590d5c545705415f9
366794,"[WankzVR.com] Maria Anjel - Stuck In Your Stepsister [2023-04-14, 60 FPS, Big Cocks, Blonde, Blowjob, College, Couples, Cowgirl, Cum On Face, Doggy Style, Missionary, Reverse Cowgirl, Small Tits, Spreadeagle, VR, SideBySide, 3600p, SiteRip] [Oculus R",https://d.ptorrents.com/bt/[ptorrents.com].2974174.torrent,magnet:?xt=urn:btih:3d93934cf7494e1afe06e7b13dc28391a993aa0e
366795,"[SexLikeReal.com/No2StudioVR] Ayana - Ayana's Holly Glory [2021-11-19, VR, Blowjob, Brunette, Cumshots, Curly, Long Hair, Gloryhole, NonPOV, Shaved Pussy, Tattoos, SideBySide, 3072p, SiteRip] [Oculus Rift] /vive]",https://d.ptorrents.com/bt/[ptorrents.com].2974202.torrent,magnet:?xt=urn:btih:c8dd4d9ca9bedc59845f14f8b075d9b57e759865
366796,"Meisa Hanai - Psychometrist Kiriko - Reading Residual Thoughts - Meisa Hanai [ATID-152] (BIG FACE, Attackers) [cen] [2009, Restraint, Big Tits, Rape, SiteRip] [1080p]",https://d.ptorrents.com/bt/[ptorrents.com].2972852.torrent,magnet:?xt=urn:btih:e1b9aabe6dfebf59a8b948d3ac04ef09e00ef712
366797,"Hamasaki Mao - He Was An Old Company Man Who Was Left To Wither In The Office, But When He Shoved His Big Dick Into This Naughty And Haughty Career Woman, She Melted Like Butter In His Hands [NGOD-168] (JET Eizou) [ cen] [2022, Big Tits, Married Woma",https://d.ptorrents.com/bt/[ptorrents.com].2974691.torrent,magnet:?xt=urn:btih:85f0c0cb7f8f7feac07790b9cfeadf70c6e61e4a
366798,"[Tuk Tuk Patrol] Roasting in the hotel room of a Thai skinny [All Sex, hairy, asian, small tits, brunette, Gonzo 1080p]",https://d.ptorrents.com/bt/[ptorrents.com].2974246.torrent,magnet:?xt=urn:btih:d3e9cd0ac938a6dca4b8b14bd74312804f43182b
366799,"[SexMex.xxx] Salomé Gil (Double Penetration For The Slave) [2021, Anal, DP, Cum in Ass, CreamPie, Threesome FMM, Hardcore, Oral, Blowjob, All Sex, 1080p]",https://d.ptorrents.com/bt/[ptorrents.com].2970770.torrent,magnet:?xt=urn:btih:7007b288d94ea06a63569b16b6d85c78aee7404e
366800,"[Camshows.tv] Aynmarie [2023-04-15, Masturbation, Solo, Tattoos, 720p, WebCam]",https://d.ptorrents.com/bt/[ptorrents.com].2974869.torrent,magnet:?xt=urn:btih:c86ed0dcbf76740adc66d4df4322a69afc44aa51
366801,"[RealJamVR.com] Angelique Lapiedra - Hot Sexologist Session [2023-03-27, Babe, Brunette, Close ups, Cowgirl, Doggy style, Hardcore, Missionary, Petite / slim, POV, Reverse cowgirl, Shaved pussy, Spaniard, Tattoo, VR, SideBySide, 3584p, SiteRip] [Ocul",https://d.ptorrents.com/bt/[ptorrents.com].2972404.torrent,magnet:?xt=urn:btih:c6ee5106d1570a8f456b1e4cb307d31bbc5bba30
366802,"Bratty Sis Vol. 12 / Cheeky Sis 12 (Nubiles) [2023, 18+ Teens, Erotic Vignette, Family Roleplay, Gonzo, POV, WEB-DL, 1080p] (Split Scenes) (Kyler Quinn, Penelope Kay, Madison Summers, Michelle Anthony)",https://d.ptorrents.com/bt/[ptorrents.com].2974135.torrent,magnet:?xt=urn:btih:b884433d66feb6a2557997c171c1c7ea7d7a6eb3
366803,"[Pornhub.com] akari1089 (55 videos) [2020-2021, Amateur, Homemade, Solo, Masturbation, SD, 720p, 1080p, SiteRip]",https://d.ptorrents.com/bt/[ptorrents.com].2974216.torrent,magnet:?xt=urn:btih:e869ecc538c73fdb2ca5d015707694e083c83cda
366804,"[Manyvids.com] Sarah Rae - Mommy Is Your Pregnant Fuck Slut POV [2019, solo, pregnant, bbw, big tits, 1080p, SiteRip]",https://d.ptorrents.com/bt/[ptorrents.com].2973736.torrent,magnet:?xt=urn:btih:5744bd4e3e5388488a9e7b08d373abadf8c84054
366805,"[Private.com] Tory Sweety - Tory Sweety Gets Horny At The Gym (04/19/2023) [2023, Teen, Gonzo, Hardcore, All Sex, 1080p]",https://d.ptorrents.com/bt/[ptorrents.com].2974950.torrent,magnet:?xt=urn:btih:43ec44fdbc1923a9cb73c467b29cce3b50ae3600
