id,title,torrent_url,magnet
366244,"Suburban Buttnicks - Buttnicks 3 (Michael Carpenter, Coast to Coast) [1992, All Sex, DVDRip] (Cameo, Leanna Foxxx, Tiffany Mynx, Meekah)",https://d.ptorrents.com/bt/[ptorrents.com].2973390.torrent,magnet:?xt=urn:btih:774a16bdfab640a08ea6461998ea89eacd28cab8
366245,"[SexLikeReal.com/No2StudioVR] Ariana - Pervy Lucky Photographer [2022-04-01, VR, Blonde, Blowjob, Close Ups, Cowgirl, Reverse Cowgirl, Long Hair, Cock Rubbing Pussy, Hardcore, Mixed POV, Shaved Pussy, Tattoos, Leash, Spanking, SideBySide, 3072p, Site",https://d.ptorrents.com/bt/[ptorrents.com].2973419.torrent,magnet:?xt=urn:btih:a8cdae32cffae2a69a8b5404415ca9140212e0b4
366246,"[Private.com] Shrima Malati - Shrima Malati, Anal Break At The Office (04/14/2023) [2023, Anal, MILF, Gonzo, Hardcore, 1080p]",https://d.ptorrents.com/bt/[ptorrents.com].2973548.torrent,magnet:?xt=urn:btih:97bbeb58a1fecd59d09180c4f78d431162183263
366247,"[SexMex.xxx] Analia (Sex With Her Sugar Daddy) [2021, CreamPie, Hardcore, Oral, Blowjob, All Sex, 480p]",https://d.ptorrents.com/bt/[ptorrents.com].2973510.torrent,magnet:?xt=urn:btih:db0dfa2b02f124fd18da8eaf13a6e7297c8b8e54
366248,"[AVJiali.com] Spying at work in the changing room at a lovely lady getting naked [AVJI-157] (Princess Dolly) [uncen] [2022-12-19, Blowjob, Chinese, Close Up, Cumshot, Shaved Pussy , Pantyhose, Big Tits, Straight, SiteRip] [1080p]",https://d.ptorrents.com/bt/[ptorrents.com].2973434.torrent,magnet:?xt=urn:btih:6912fa86787de07caf8653518eda1e73e3669963
366249,"[EverythingButt.com / Kink.com] Katrina Colt, Liz Jordan - Anal Punishment: Katrina Colt And Liz Jordan (04/12/2023) [2023, BDSM, Bondage, Lesbian, Anal, Dildo, LezDom, Ass Licking, Rimming, Buttplug, Pussy Licking, Fingering, Spanking, SiteRip, 1080",https://d.ptorrents.com/bt/[ptorrents.com].2973405.torrent,magnet:?xt=urn:btih:280e34b9d237a825d885c51e161a7f4dc5aa82d9
366250,"[GlossTightsGlamour.com] (387 videos) Pack [2020-2022, Fetish, Lingerie, Lesbian, Nylon, Pantyhose, Posing, Solo, Upskirt, Uniform, BTS, 1080p, 2160p]",https://d.ptorrents.com/bt/[ptorrents.com].2973635.torrent,magnet:?xt=urn:btih:7485641952b36f39c1f816f48b34421adf23b93c
366251,Sniffing socks FU,https://d.ptorrents.com/bt/[ptorrents.com].2973605.torrent,magnet:?xt=urn:btih:e65ea9798205fee20306880c7ff2d89208ad182f
366252,"[SexLikeReal.com/VRoomed] Black Cat - Zero Masturbation Skills [2022-08-31, VR, Chubby / Curvy, Big Tits, Blowjob, Close Ups, Cowgirl, Cumshot, Redhead, Handjob, Hardcore, English Speech, POV, Trimmed Pussy, Piercing, Tattoo, Glasses, JOI, Femdom, Si",https://d.ptorrents.com/bt/[ptorrents.com].2973243.torrent,magnet:?xt=urn:btih:b4a462ccc8a4323e3317c4bb6b3788ee7af8f501
366253,"[SexMex.xxx] Giselle Montes (My Friends Hot Sister) [2019, Anal, DP, Anal Fisting, Cum in Ass, Squirt, Threesome FMM, Hardcore, Oral, Blowjob, All Sex, 480p]",https://d.ptorrents.com/bt/[ptorrents.com].2973464.torrent,magnet:?xt=urn:btih:b8063842e9730c9bb5b72aea3413b8a6e61fa1e0
366254,"[MetArt.com] 2023-04-12 Katty Muss - Revelation, Guinevere Huney - Checkers Fantasy, Milkavi - Sensual Blue, Nyx - Towel Drop [Solo, Posing, Glamour] [3840x5760-4480x6720, 537 photos]",https://d.ptorrents.com/bt/[ptorrents.com].2973099.torrent,magnet:?xt=urn:btih:ec22b177ee05c7676239c65b3ff60461562b4753
366255,"[DorcelClub.com] Jia Lissa - Jia Lissa's Desires [23.03.2023, Blowjob, Cowgirl, Cumshot, Doggy Style, Hardcore, Kissing, Lingerie, Missionary, Redhead, Teen, 1080p, SiteRip]",https://d.ptorrents.com/bt/[ptorrents.com].2973171.torrent,magnet:?xt=urn:btih:cc8c48a24de0d0a95c45074db591cfdf8dd0e8ba
366256,"[Onlyfans.com] Kelly Payne - 9 Months Pregnant Dirty Cum Slut [2022, solo, pregnant, 1080p, SiteRip]",https://d.ptorrents.com/bt/[ptorrents.com].2973071.torrent,magnet:?xt=urn:btih:d2e12518f831a2880c75c77d615114000d8ac136
366257,"[GenderXFilms.com] Jade Venus & Janie Blade - TNT 4 (2023-04-13) [2023, Transsexuals, Shemale, Big Tits, Anal, Deepthroat, RedHead, Blonde, Tattoo & Piercing, Rimming, Lingerie, Trans Fucks Trans, Blowjob, Cumshot, Handjob, Hardcore, Doggystyle, Miss",https://d.ptorrents.com/bt/[ptorrents.com].2973339.torrent,magnet:?xt=urn:btih:7f8b925d50d59fedcc55159ac69f57242d517a65
366258,"Sayaka Oonuki - A Memory From Summer [ENFD-5880] (E-NET FRONTIER イーネット・フロンティア) [ecchi] [2019, Solowork, Idol, Image Video, HDRip] [1080p]",https://d.ptorrents.com/bt/[ptorrents.com].2973166.torrent,magnet:?xt=urn:btih:0fe641603d6e9fbcc50f7c8ced40196bb3e43ecf
366259,"[SexMex.xxx] Analia (Sex With Her Sugar Daddy) [2021, CreamPie, Hardcore, Oral, Blowjob, All Sex, 720p]",https://d.ptorrents.com/bt/[ptorrents.com].2973509.torrent,magnet:?xt=urn:btih:bee68b664cc3ffe7b9185a510ebdad759294051b
366260,"[OnlyTease.com] 2023-04-07 - Kristina (aka Melissa, Lexa, Melisa Mendini) - #25693 [MILF, Brunette, Solo, Posing, Stockings, Lingerie, Big Ass, Natural Tits, Booty] [4482x6720, 155 photos ]",https://d.ptorrents.com/bt/[ptorrents.com].2973165.torrent,magnet:?xt=urn:btih:36c0ff7ff3e64f45e73137492e7207933613f7d3
366261,"Aya Mitsuki - I Always Thought Of Her As Just A Friend, But After I Saw Her Having Sex With My Dad, My Feelings Towards Her Have Changed [MKON-026] (No-ton, Kaguya Hime Pt ​​/ Mousozoku) [cen] [ 2020 Creampie, Gangbang, Schoolgirl, School Uniform, Cu",https://d.ptorrents.com/bt/[ptorrents.com].2973503.torrent,magnet:?xt=urn:btih:500ced9feccfce428e62a4f06a7563759c0447ac
366262,"[LegalPorno.com / PissVids.com] Stacy Bloom & Kira Viburn - Pee Between Girls, Stacy Bloom & Kira Viburn, 2on2, Fisting, ATOGM, DAP Gapes, ButtRose, Pee Drink, Squirt, Creampie GIO2443 (2023-04-14) [2023, anal, anal creampie, ass fisting, ass to mout",https://d.ptorrents.com/bt/[ptorrents.com].2973536.torrent,magnet:?xt=urn:btih:5afc2b7206d0c2f9c8c125d70a2fdded32bb01d8
366263,"Shiina Yuna - Huge Black Dick. Black Tera-Dick On The Road Yuna Shina Volume [BDD-38] (Abashiri Ikka, Global Media Entertainment) [cen] [2014, 3P, 4P, Rape, Slender, Black Actor, HDRip] [720p]",https://d.ptorrents.com/bt/[ptorrents.com].2973223.torrent,magnet:?xt=urn:btih:d4d110a350105532c8569eb2514ef470a40c3308
366264,"Couples Seeking Teens #19 Pristine Edge, Nina Elle, Ashley Adams, Mercedes Carrera, Jojo Kiss)",https://d.ptorrents.com/bt/[ptorrents.com].2973343.torrent,magnet:?xt=urn:btih:5acb09f2e8e21134e8709c79de7b5bb78550751b
366265,"Kawakita Meisa, Minami Kozue, Ohana Non - At School, A Vibe Was Fixed For A Long Time And Left For A Long Time, And She Continued To Put Up With It, But A Chasing Aphrodisiac Crashed A Gangimari Girl ○ Raw 2 [NHDTB- 724] (Sakurai Banira, Natural High",https://d.ptorrents.com/bt/[ptorrents.com].2973212.torrent,magnet:?xt=urn:btih:4ec2819852d737ad9460ee831771fc086a9c1532
366266,"[VirtualRealPorn.com] Kama Oxi - A Well-Deserved Break [2023-04-03, Blowjob, Brunette, Cowgirl, Handjob, Missionary, Natural tits, Reverse cowgirl, Skinny, VR, SideBySide, 3840p, SiteRip] [Oculus Rift / vive]",https://d.ptorrents.com/bt/[ptorrents.com].2973384.torrent,magnet:?xt=urn:btih:8dfceac67079057d61272f15226d490710ff0bcc
366267,"[ElegantRaw.com] Elen Milion - Anal Encounters 6 Ep3 (04/13/2023) [2023, Anal, Interracial, BBC, MILF, Big Tits, Gonzo, Hardcore, 1080p]",https://d.ptorrents.com/bt/[ptorrents.com].2973329.torrent,magnet:?xt=urn:btih:8d1bf1ca19e4966515a5b546c98b4c96f7d0d64b
366268,"[Adulttime.com/Transfixed.com] Lucy Hart & Maddy May - Belle Of The Ballroom (12-04-2023) (Stella Smut, Adulttime) [2023, Shemale On Female, Kissing, Blowjob, Stockings, Tattoos, Bareback , Piercing, Hairy, Creampie, 1080p, SiteRip]",https://d.ptorrents.com/bt/[ptorrents.com].2973504.torrent,magnet:?xt=urn:btih:0e12b74e27437d893efa44ae3977a9017873c490
366269,"Oshikawa Yuri - I Hated Him But he Tested My G-Spot And Sent Me Into A Pissing Orgasm [PPPD-666] (Oppai) [cen] [2018, Creampie, Big Tits, Titty Fuck, Cuckold, HDRip] [1080p] ]",https://d.ptorrents.com/bt/[ptorrents.com].2973501.torrent,magnet:?xt=urn:btih:8266ac8fd8359d66324b074121a9c4c46908ce5a
366270,"[AssParade.com / BangBros.com] 2022-02-07 Kate Dee - Kate Dee's Magic Booty (ap18416) [all sex, blowjob, white, hardcore, cumshot, facial, big ass, blonde, milf, big tits, shaved, deep throat, busty, big booty, facefuck, doggystyle, missionary, ridin",https://d.ptorrents.com/bt/[ptorrents.com].2973156.torrent,magnet:?xt=urn:btih:27d22bf06981fd1bf8a9390c8a8257c3d724132b
366271,"[LegalPorno.com/Pornbox.com]Effy End - SLAVEGIRL EFFY END ANAL CASTING AND DOUBLE PENETRATION[2023, Gonzo, Hardcore, All Sex, Anal,DP 1080p]",https://d.ptorrents.com/bt/[ptorrents.com].2973613.torrent,magnet:?xt=urn:btih:a349ad407ddeeee919d1a13d0c7cb212a72e9aab
366272,"[DorcelClub.com] Jia Lissa - Jia Lissa's Desires [23.03.2023, Blowjob, Cowgirl, Cumshot, Doggy Style, Hardcore, Kissing, Lingerie, Missionary, Redhead, Teen, 480p, SiteRip]",https://d.ptorrents.com/bt/[ptorrents.com].2973177.torrent,magnet:?xt=urn:btih:886edbc233eff0ea062cae3aed5fccc9ced4f22a
366273,"[SexLikeReal.com/VRoomed] Black Cat - Not That Kind of Girl [2022-12-19, VR, Big Tits, Blowjob, Cowgirl, Cumshot, Domination, Fingering, Glasses, Missionary, POV, Redhead, Reverse Cowgirl, Spanking, Fishnet, Stockings, Tattoos, SideBySide, 3072p, Sit",https://d.ptorrents.com/bt/[ptorrents.com].2973242.torrent,magnet:?xt=urn:btih:df882ab396669d1a737fdbdd9248c6b08c9289b5
366274,"Hamasaki Mao - Naughty Nurses [GG-260] (Mishima Rokusaburo, Glory Quest) [cen] [2013, Big Tits, Married Woman, Incest, Old Man, HDRip] [720p]",https://d.ptorrents.com/bt/[ptorrents.com].2973476.torrent,magnet:?xt=urn:btih:fa1dff0ae5e093ce15d7a55712b7fb3a8a16180f
366275,"[BigTitsRoundAsses.com / BangBros.com] 2021-02-13 Gabriela Lopez - Gabriela Gets Wet (btra17998) [all sex, blowjob, brunette, hardcore, cumshot, latina, facial, big ass, big tits, shaved, busty, big booty, young, doggystyle, missionary, riding, cow g",https://d.ptorrents.com/bt/[ptorrents.com].2973386.torrent,magnet:?xt=urn:btih:3aef9cdfa15bdcc47367aa220da3ccca6490b667
366276,"[BecomingFemme.com] Bailey Wilde - Submissive And Compliant Sissy Maid (04/14/2023) [2023, Shemale, Hardcore, Blowjob, Anal, Bareback, 480p]",https://d.ptorrents.com/bt/[ptorrents.com].2973618.torrent,magnet:?xt=urn:btih:faee0921552ead6ff4cde1430d4c58299ea4f6df
366277,"[SexLikeReal.com/VRoomed] Lara Sins - Horny Glory [2023-02-01, VR, Blowjob, Brunette, Cumshot, Long Hair, Gloryhole, Handjob, NonPOV, Shaved Pussy, Toys, SideBySide, 3072p, SiteRip] [Oculus Rift] /vive]",https://d.ptorrents.com/bt/[ptorrents.com].2973270.torrent,magnet:?xt=urn:btih:7f61f8dd1db1f3b0c86f58494e82c950930f70f7
366278,"[DarkRoomVR.com] Lika Star, Mona Blue - Landlord's Rules [2021-02-02, VR, Blonde, Blowjob, Cowgirl, Cum Eating, Threesome (FFM), Hardcore, Natural Tits, POV, Shaved Pussy, Small Tits, Teen , SideBySide, 3630p, SiteRip] [Oculus Rift / Vive]",https://d.ptorrents.com/bt/[ptorrents.com].2973224.torrent,magnet:?xt=urn:btih:7600987e108146c1ce83381096bdf773fa68c81e
366279,"[LegalPorno.com/Pornbox.com]Effy End - SLAVEGIRL EFFY END ANAL CASTING AND DOUBLE PENETRATION[2023, Gonzo, Hardcore, All Sex, Anal,DP 720p]",https://d.ptorrents.com/bt/[ptorrents.com].2973608.torrent,magnet:?xt=urn:btih:7f643dd2002e9e7858c5cc327faaf121f513bf1c
366280,"[PinkOTgirls.com] Jacqueline Santos & May Akemi - A Woman, A Man And A Transsexual Fucked And Assfucked To Scream (04/13/2023) [2023, Threesome, TS Shemale Fucks / On Male, TS Shemale Fucks / On FeMale, Big Cock, Anal, Bareback, Hardcore, 1080p]",https://d.ptorrents.com/bt/[ptorrents.com].2973422.torrent,magnet:?xt=urn:btih:00b34121b90ba5ecbeb0addf1dfb5daea30e4e00
366281,"[SexMex.xxx] Giselle Montes (My Friends Hot Sister) [2019, Anal, DP, Anal Fisting, Cum in Ass, Squirt, Threesome FMM, Hardcore, Oral, Blowjob, All Sex, 1080p]",https://d.ptorrents.com/bt/[ptorrents.com].2973462.torrent,magnet:?xt=urn:btih:8826235cb69b6669c6c4fc36aca3c6ef0466b391
366282,"[SexLikeReal.com/VRoomed] Black Cat - Let's Cuck for Christmas [2022-12-24, VR, Big Tits, Blowjob, Titfuck, Chubby / Curvy, Cowgirl, Creampie, Cuckold / Girl Fucks Husband Watches, Doggystyle, Hardcore, English Speech, Nylons, Stockings, PAWG, POV, R",https://d.ptorrents.com/bt/[ptorrents.com].2973231.torrent,magnet:?xt=urn:btih:7df9093d2d6b3635c23fca4c20cb8940aeef4528
366283,"Ohana Non - My Senpai's Proud Fair-Skinned Big Tits Girlfriend Fucked Me Rawly For 3 Days And Creampied Her Over And Over Again (True Story) [DVDMS-898] (Nagase Swing, Deeps) [cen] [2022, Creampie, Big Tits, Titty Fuck, Cuckold, HDRip] [720p]",https://d.ptorrents.com/bt/[ptorrents.com].2973209.torrent,magnet:?xt=urn:btih:6e57a7d2ac6768fd17ceb480828cd1cc802ad83c
366284,"[LegalPorno.com / AnalVids.com] August - First DP for Big Ass 18yo August with Gape, Two Big Cock And Natural Cum in Mouth VG171 (2023-04-12) [2023, anal, big butt, big tits, blowjob, deep throat, double penetration (DP), face fucking, facial, gapes,",https://d.ptorrents.com/bt/[ptorrents.com].2973090.torrent,magnet:?xt=urn:btih:00b7d6964f4b5a6af24e02ce740d7906e0b061f0
366285,Pretty girl sniffs stinky baresandals (2 videos),https://d.ptorrents.com/bt/[ptorrents.com].2973342.torrent,magnet:?xt=urn:btih:258f6e955f4e2451da11019375c3bcb47014f55f
366286,"[PutaLocura.com] Darsi Devil - Mamadote Y Folleteo A Ucraniana Sexy - Sucking And Fucking A Sexy Ukrainian (04/12/2023) [2023, Gonzo, Hardcore, All Sex, 720p]",https://d.ptorrents.com/bt/[ptorrents.com].2973081.torrent,magnet:?xt=urn:btih:a68265198f9a28976fbe793494427d48939c7dcd
366287,"[AVJiali.com] Taiwanese female soldier Ye Chenxin fucks her colleague [AVJI-119] [uncen] [2022-05-23, Blowjob, Chinese, Close Up, Cumshot, Shaved Pussy, Small Tits, Straight, SiteRip] [ 1080p]",https://d.ptorrents.com/bt/[ptorrents.com].2973429.torrent,magnet:?xt=urn:btih:910b3af6ce83047346a998fb5f40ae84838f0553
366288,"[SheIsNerdy.com / DirtyFlix.com] Bella Gray aka Bella Gray - Exploring Anal With Teen Model (04/09/2023) [2023, Anal, Teen, Gonzo, Hardcore, 1080p]",https://d.ptorrents.com/bt/[ptorrents.com].2973078.torrent,N/A
366289,"[SexLikeReal.com/VRixxens] Black Cat - Step Teacher [2023-01-14, VR, Big Tits, Blowjob, Titfuck, Big Ass, Chubby / Curvy, Close Ups, Ripped Clothes, Shorts / Skirts, Reverse Cowgirl, Cumshot, High Heels, Hardcore, English Speech, Nylon, Pantyhose, PO",https://d.ptorrents.com/bt/[ptorrents.com].2973246.torrent,magnet:?xt=urn:btih:e0c49551b58a91dd9c8a531b9428b899353ae21f
366290,"[GenderXFilms.com] Jade Venus & Janie Blade - TNT 4 (2023-04-13) [2023, Transsexuals, Shemale, Big Tits, Anal, Deepthroat, RedHead, Blonde, Tattoo & Piercing, Rimming, Lingerie, Trans Fucks Trans, Blowjob, Cumshot, Handjob, Hardcore, Doggystyle, Miss",https://d.ptorrents.com/bt/[ptorrents.com].2973338.torrent,magnet:?xt=urn:btih:bb31be880fa5e05bb468b0b987c9e73759fcb501
366291,"Super Cute #16 / Super Cute #16 (Mason, Hard X) [2023, Gonzo, Hardcore , All Sex, Anal, 540p WEB-DL] (Split Scenes)(Dakota Tyler , Demi Hawks , Samantha Reigns , Olivia Madison )",https://d.ptorrents.com/bt/[ptorrents.com].2973581.torrent,magnet:?xt=urn:btih:a6bd49e715512cd1d635361af381b04412a7e56a
366292,"[SexLikeReal.com/VRixxens] Black Cat - Mistress Has a Crush [2022-12-09, VR, Big Tits, Blowjob, Titfuck, Big Ass, Chubby / Curvy, Close Ups, Cowgirl, Reverse Cowgirl, Cumshot Twice, Handjob, Cock Rubbing Pussy, Hardcore, English Speech, Fishnet, Pant",https://d.ptorrents.com/bt/[ptorrents.com].2973228.torrent,magnet:?xt=urn:btih:414712a567594ed1c551b8eb6e332e87b4fba23f
366293,"[TushyRaw.com] 2023-04-12 Penelope Kay - Drip [Anal, Big Ass, Big Tits, Blowjob, Bubble Butt, Gonzo, Hardcore, Natural Tits] [3000x2000, 72 photos]",https://d.ptorrents.com/bt/[ptorrents.com].2973210.torrent,magnet:?xt=urn:btih:2cb3ad9b5ebe5d9a91fa802bfc15fb55aa521f0b
366294,[clips4sale.com] Sniffing baresandals FU (3 videos),https://d.ptorrents.com/bt/[ptorrents.com].2973619.torrent,magnet:?xt=urn:btih:23ed6e81788357d635c0202131bff3f13c3c4557
366295,"[Onlyfans.com] Kelly Payne - Sexy Cat Walk & Tease 9 Months Pregnant [2022, solo, pregnant, 1080p, SiteRip]",https://d.ptorrents.com/bt/[ptorrents.com].2973072.torrent,magnet:?xt=urn:btih:51a6b3c16d03293d79f0832eef8b1d3915f6e4a8
366296,"[VirtualRealTrans.com] Bellatrix Fontes & Marcelle Herrera (Private Outtakes) [2019, POV, Gangbang, Threesome, Two Skinny Brazilian Shemales, Cowgirl, Blowjob, Handjob, Hardcore, Anal, Bareback, Reverse, Cumshot, Voyeur, Lingerie, Big Tits , Rounded",https://d.ptorrents.com/bt/[ptorrents.com].2973176.torrent,magnet:?xt=urn:btih:22c5fbf1e219aa702babfb40319c269fc2cf25a0
366297,"[Private.com] Shrima Malati - Shrima Malati, Anal Break At The Office (04/14/2023) [2023, Anal, MILF, Gonzo, Hardcore, 720p]",https://d.ptorrents.com/bt/[ptorrents.com].2973549.torrent,magnet:?xt=urn:btih:5f9b7ff03c1f5fc1ff2a853f8802e90ca0796dc8
366298,"Private Peepshow Special #11 / Peepshow Special #11 by Private (Remington Steel, Home Town Video) [2000, AllSex, Anal, DP, Facial, NaturalTits, DVDRip] Michelle B., Layla Jade, Sasha Lee",https://d.ptorrents.com/bt/[ptorrents.com].2973528.torrent,magnet:?xt=urn:btih:6390212cc26f69bbe059b2c2e0380f9663bb03b5
366299,"[BigTitsRoundAsses.com / BangBros.com] Gabriela Lopez - Gabriela Gets Wet (btra17998) [2021-02-13, All sex, blowjob, brunette, hardcore, cumshot, latina, facial, big ass, big tits, shaved, busty, big booty, young, doggystyle, missionary, riding, cow",https://d.ptorrents.com/bt/[ptorrents.com].2973389.torrent,magnet:?xt=urn:btih:1af0f843aeb52d480ca1242bcba92c25d4dcad10
366300,"[SexLikeReal.com/VRoomed] Black Cat - Talent Casting Agent [2022-08-03, VR, Blowjob, Titfuck, Chubby / Curvy, Cowgirl, Cum In Mouth, Cumshot, Handjob, Hardcore, English Speech, POV, Redhead, Shaved Pussy, Piercing, Tattoos, Glasses, SideBySide, 3072p",https://d.ptorrents.com/bt/[ptorrents.com].2973245.torrent,magnet:?xt=urn:btih:80cd0304056e74ab958496d57549591a0a3d639d
366301,"[SexMex.xxx] Analia (Sex With Her Sugar Daddy) [2021, CreamPie, Hardcore, Oral, Blowjob, All Sex, 2160p, 4k]",https://d.ptorrents.com/bt/[ptorrents.com].2973318.torrent,magnet:?xt=urn:btih:b23c70d97fcd5cae3497928bbe55db5ca9b572d2
366302,"Takarada Monami, Himesaki Hana, Hayami Io - Nipple Development Filthy ● 2 [NHDTB-646] (Rafutin Maeshiro, Natural High) [cen] [2022, Humiliation, Big Tits, Squirting, Toy, HDRip] [720p]",https://d.ptorrents.com/bt/[ptorrents.com].2973214.torrent,magnet:?xt=urn:btih:92fff0ea4d82356b11d5ccd69e1b1745551066ab
366303,"[Onlyfans.com] Charlotte Star - Pregnant Compilation [2022, solo, pregnant, 1080p, SiteRip]",https://d.ptorrents.com/bt/[ptorrents.com].2973173.torrent,magnet:?xt=urn:btih:6be5df459b26de3f0177ca52e8ac4d94a2c5e286
366304,"[GenderXFilms.com] Jade Venus & Janie Blade - TNT 4 (2023-04-13) [2023, Transsexuals, Shemale, Big Tits, Anal, Deepthroat, RedHead, Blonde, Tattoo & Piercing, Rimming, Lingerie, Trans Fucks Trans, Blowjob, Cumshot, Handjob, Hardcore, Doggystyle, Miss",https://d.ptorrents.com/bt/[ptorrents.com].2973340.torrent,magnet:?xt=urn:btih:8141977360e11c42c87130bb0aa1a8e3ee5f99f4
366305,"[LegalPorno.com/Pornbox.com]Eliza Crystal - Very beautiful Eliza Crystal aka Marry Doll took part in Leo Casanova's anal casting taking in his monstrous cock (FLX058)[2023, Gonzo, Hardcore, All Sex, Anal, 720p]",https://d.ptorrents.com/bt/[ptorrents.com].2973612.torrent,magnet:?xt=urn:btih:f0285aa98557d08e1fd68ebe5e285675d8e52225
366306,"Doin the Rounds (Russ Michaels, VCA) [1995, All Sex, DVD5] (Autumn Daye, Chella, Jordan Lee, Holly Body, Caressa Savage)",https://d.ptorrents.com/bt/[ptorrents.com].2973381.torrent,magnet:?xt=urn:btih:6e0bff003526ca8adc329b1234e3e3df6d5dbac8
366307,"Shiina Yuna - The Sexy PTA Chairwoman And The Naughty Student Council President Yuna Shina [GVG-046] (Hyon, Glory Quest) [cen] [2014, Big Tits, Gangbang, Drama, Shotacon, HDRip] [720p]",https://d.ptorrents.com/bt/[ptorrents.com].2973502.torrent,magnet:?xt=urn:btih:c1d0fbc62e0b611bbe3146f65360674bd47f4fd5
366308,"[PinkOTgirls.com] Jacqueline Santos & May Akemi - A Woman, A Man And A Transsexual Fucked And Assfucked To Scream (04/13/2023) [2023, Threesome, TS Shemale Fucks / On Male, TS Shemale Fucks / On FeMale, Big Cock, Anal, Bareback, Hardcore, 720p]",https://d.ptorrents.com/bt/[ptorrents.com].2973423.torrent,magnet:?xt=urn:btih:d997c1950f74b3c0c6de0d9807ddc0e659f7a9e2
366309,"[SexLikeReal.com/VRixxens] Christal Hot - Escorted Glory [2023-01-24, VR, Blowjob, Cum In Mouth, Long Hair, Gloryhole, Handjob, Bodystockings, NonPOV, Glasses, SideBySide, 3072p, SiteRip] [Oculus Rift / vive]",https://d.ptorrents.com/bt/[ptorrents.com].2973460.torrent,magnet:?xt=urn:btih:e427b814f2533748ce4b0d39933efa5aefa60899
366310,"[SexLikeReal.com/VRixxens] Black Cat - Dismissal Sex [2023-03-05, VR, Blowjob, Chubby / Curvy, Cowgirl, Reverse Cowgirl, English Speech, Nylons, Stockings, POV, Whispering, Redhead, Shaved Pussy, Piercing, Glasses, SideBySide, 3072p, SiteRip] [Oculus",https://d.ptorrents.com/bt/[ptorrents.com].2973233.torrent,magnet:?xt=urn:btih:f82fa96d55969e71b5fefba3c2ba588fe447db1b
366311,"[LegalPorno.com/Pornbox.com]Eliza Crystal - Very beautiful Eliza Crystal aka Marry Doll took part in Leo Casanova's anal casting taking in his monstrous cock (FLX058)[2023, Gonzo, Hardcore, All Sex, Anal, 480p]",https://d.ptorrents.com/bt/[ptorrents.com].2973610.torrent,magnet:?xt=urn:btih:8eb0f75f7693758a2e52cc91222b3c3c704b7601
366312,"Asian Hidden Camera Couples Escorts Pack 070 (146 Clips) [All Sex, Amateur, Asian, Blowjob, Brunette, Couples, Creampie, Doggystyle, Hardcore, Hidden Camera, Skinny, Spycam, Stockings, Teen, Voyeur, 480p, 540p, 720p, 1080p, 2160p, CamRip]",https://d.ptorrents.com/bt/[ptorrents.com].2973626.torrent,magnet:?xt=urn:btih:5d0ee89c83951bf1a32502328885a970277c331e
366313,"[TsPov.com] Alice Levv - A Big Dick Always Turns Things Around (04/12/2023) [2023, POV, Shemale, Hardcore, Blowjob, Anal, Bareback, 1080p]",https://d.ptorrents.com/bt/[ptorrents.com].2973075.torrent,magnet:?xt=urn:btih:dddea60580841db745d941afa0fe0133880a3a9b
366314,"[BangBrosClips.com / BangBros.com] 2020-05-01 Lilly Hall & Gabriela Lopez - Step Family Threesome (bbc17571) [all sex, blowjob, brunette, hardcore, cumshot, latina, big ass, threesome, big tits, shaved, bts, cowgirl, busty, big booty, 3some, doggysty",https://d.ptorrents.com/bt/[ptorrents.com].2973350.torrent,magnet:?xt=urn:btih:b233d30d7bf22f5a9034370df7834aa22962bd1b
366315,"[YoungLibertines.com / 18Videoz.com] Kate Love - Bathroom BJ And Bedroom Fuck (04/07/2023) [2023, Teen, Gonzo, Hardcore, All Sex, 1080p]",https://d.ptorrents.com/bt/[ptorrents.com].2973571.torrent,magnet:?xt=urn:btih:31f0bed2d9f5dcc7dab3c54718ff799d29b34196
366316,"[Camvids.org] Crystalreves [2022-04-15, Masturbation, Solo, Teen, 720p, WebCam]",https://d.ptorrents.com/bt/[ptorrents.com].2973161.torrent,magnet:?xt=urn:btih:641136b5ddf6eb7ca6df58b9781a1c0a684ce3d1
366317,"[SheIsNerdy.com / DirtyFlix.com] Bella Gray aka Bella Gray - Exploring Anal With Teen Model (04/09/2023) [2023, Anal, Teen, Gonzo, Hardcore, 720p]",https://d.ptorrents.com/bt/[ptorrents.com].2973079.torrent,magnet:?xt=urn:btih:ba004b10d2d8ab3e6a8f05fa6a9c9d7c014a84bd
366318,"[ManyVids.com] AnalGirlOlive / Post shower play session [2023, Amateur, Solo Teen, Self Anal Fisting, Big Dildo Toys, Bottle, Hairy Pussy, Prolapse, 1080p, SiteRip]",https://d.ptorrents.com/bt/[ptorrents.com].2973356.torrent,magnet:?xt=urn:btih:f8fd148daec6237f0e5c258a348f35152d7807bf
366319,[Mfvideoxxx.com / MF Video] Brazil Lezdom [Part 1] [15 videos] Cunnilingus 1080p SiteRip],https://d.ptorrents.com/bt/[ptorrents.com].2973289.torrent,magnet:?xt=urn:btih:ee3db8b06a8b9b659c1615d118da0ab5ce94f9f9
366320,"[SexLikeReal.com/VRixxens] Eva Wild - Glory to the Cuck [2022-12-27, VR, Big Tits, Blowjob, Cum In Mouth, Gloryhole, Handjob, MILF, NonPOV, SideBySide, 3072p, SiteRip] [Oculus Rift / vive]",https://d.ptorrents.com/bt/[ptorrents.com].2973281.torrent,magnet:?xt=urn:btih:2fdce9e7f442c091c4eeb6f8f023dac22a901b7c
366321,"[SexLikeReal.com/EllieLouiseVR] Ellie Louise - Cuckold Surprise [2022-05-26, VR, Blowjob, Cuckold / Girl Fucks Husband Watches, Doggystyle, Hardcore, English Speech, Mixed POV, Redhead, British, Bondage, SideBySide, 2880p, SiteRip] [Oculus Rift/Vive]",https://d.ptorrents.com/bt/[ptorrents.com].2973497.torrent,magnet:?xt=urn:btih:24ce3e52b4fcbd2912d9597023c5f3659a325f9d
366322,"[VRConk.com] Elle Lee - Spy X Family: Yor Forger (A XXX Parody) [2022-08-12, Brunette, Fetish, Hairy, Hentai, Interracial, Babe, Small Tits, Blowjob, Cum In Mouth, Cum on Face , Skinny, Masturbation, Balls Licking, Cum Swallow, Cowgirl, Doggystyle, R",https://d.ptorrents.com/bt/[ptorrents.com].2973516.torrent,magnet:?xt=urn:btih:e4c6979345d26c8f79aa1f454e35b83ca086c642
366323,"Muff 'N' Jeff (Jim Enright, Zane Entertainment Group) [1992, All Sex, DVDRip] (Lynn LeMay, Gail Force, Teri Diver, Sonya)",https://d.ptorrents.com/bt/[ptorrents.com].2973097.torrent,magnet:?xt=urn:btih:6b499093a894efc5fab7d66acbd5c4ad24f297f6
366324,"[AssParade.com / BangBros.com] 2021-11-22 Kate Dee - Aquatic Pornstars (ap18328) [all sex, brunette, white, hardcore, cumshot, big ass, milf, big tits, shaved, oil, fingering, busty, big booty, doggystyle, missionary, riding, vaginal, titfuck] [2000x",https://d.ptorrents.com/bt/[ptorrents.com].2973100.torrent,magnet:?xt=urn:btih:40ee17d5ab2d26322da6826d093622c0493c4a23
366325,"Die Sperma Nymphomanin (John Thompson, GGG) [2006, All Sex, Orgy, Bukkake, DVD5] (Marscha, Tima)",https://d.ptorrents.com/bt/[ptorrents.com].2973098.torrent,magnet:?xt=urn:btih:347305b492c69dd1b47b315fb900e426e9222320
366326,"[Ersties.com] Alexa L [2023, Solo, Big tits, Masturbation, Toys, Orgasm, Toys, 1080p]",https://d.ptorrents.com/bt/[ptorrents.com].2973537.torrent,magnet:?xt=urn:btih:3b5ffef73d42bca3653edcec985d9ee91188304a
