id,title,torrent_url,magnet
366000,"Une Nuit a Londres / Night in London (Liselle Bailey, DORCEL) [2023, Anal, Big Dicks, Erotic Vignette, Lingerie, Shaved, WEB-DL, 720p] (Split Scenes) (Candee Licious, Carolina Cherry, Bella Tina , Amber Jayne, Myla Elyse",https://d.ptorrents.com/bt/[ptorrents.com].2972369.torrent,magnet:?xt=urn:btih:69b6709db9eaf9c477d2bc1a16d699ee68a0694d
366001,"[CumEatingCuckolds.com] Jay Taylor - Their Modern Marriage Remastered (04/08/2023) [2023, Cuckold, Gonzo, Hardcore, All Sex, 720p]",https://d.ptorrents.com/bt/[ptorrents.com].2972197.torrent,magnet:?xt=urn:btih:8bfb0d565b4b420ca88d35235f8978021f713b43
366002,"[VirtualPorn.com / BangBros.com] Molly Little - Showering with Stepsis Molly [2023-03-30, brunette, white, hardcore, cumshot, amateur, small tits, shaved, deep throat, doggy, cowgirl, teen, doggystyle, missionary , riding cow girl, small booty, small",https://d.ptorrents.com/bt/[ptorrents.com].2972843.torrent,magnet:?xt=urn:btih:f748655e2a6d7d653e444af57ec92d9d3a1686c6
366003,"Views Vol. 4 / Views 4 (Julia Grandi, Tushy) [2022, Gonzo, Anal, Hardcore, All Sex, Threesome, WEB-DL, 480p] (Split Scenes) (Stefany Kyler & Avery Cristy, Scarlett Jones, Mary Rock, Evelina Darling",https://d.ptorrents.com/bt/[ptorrents.com].2972613.torrent,magnet:?xt=urn:btih:58fcd303e049b3fdbdb004dcd3507e01656379e3
366004,"[William H., Elegant Angel] Lisa Ann, Sophie Dee - Busty Waitresses / Busty Waitresses Three scenes in 60fps [2009, Big Ass, Big Tits, Blowjob, Creampie, Facial, MILF, Straight, Uniform, Pornstars, 1080p, Upscale]",https://d.ptorrents.com/bt/[ptorrents.com].2971406.torrent,N/A
366005,"[Assumethepositionstudios.com] Chrissy Marie, Delta Hauser - Judicial Caning - Chrissy Marie And Delta Stripped For The Strap And Cane Fetish, Caning, Strapping, 1080p, SiteRip]",https://d.ptorrents.com/bt/[ptorrents.com].2972465.torrent,magnet:?xt=urn:btih:f46737dc808ac8d4be6442996eaeb0cc12b4354c
366006,"[Chanelpreston.com] Chanel Preston - Sinks In for a Gonzo Fingers Session [2014, Big Tits, MILF, Masturbation, Piercing, Posing, Solo, Tattoos, 1080p, SiteRip]",https://d.ptorrents.com/bt/[ptorrents.com].2972350.torrent,magnet:?xt=urn:btih:3041f151f7c6fb3c66449e36f9437a9a9a1cc37d
366007,"[Assylum.com] Rebel Rhyder - The Impossible Anal Journey (Filth Studies 1) (04/01/2023) [2023, BDSM, Hardcore, Anal, Piss Drinking, Blowjob, Ass Licking, Rimming, Pissing, Deepthroat, Caning, Foot Licking, Cumshot, Facial, SiteRip, 720p]",https://d.ptorrents.com/bt/[ptorrents.com].2972310.torrent,magnet:?xt=urn:btih:ea66664cfbcb4878829598aa1e82a56c0547c46f
366008,"[LegalPorno.com / AnalVids.com] Magnificent Lynx - FIRST ANAL! New busty slut Magnificent Lynx with beautiful green eyes drinks piss & gets intense anal outwork 0% pussy ATM Only Anal EKS148 (2023-04-07) [2023, anal, ass to mouth, ass to pussy (ATP),",https://d.ptorrents.com/bt/[ptorrents.com].2972305.torrent,magnet:?xt=urn:btih:b70904f93463c5d1713802b6a28a270256d78c9e
366009,"Dirty Little Schoolgirl Stories 11 / Paul Woodcrest Eddie Powell, New Sensations [2023, 18+ Teens, Big Dicks, Character, Clothing, Erotic Vignette, WEB-DL, 1080p] (Split Scenes) ( Liz Jordan, Maria Kazi, Bianca Bangs, Athena Heart)",https://d.ptorrents.com/bt/[ptorrents.com].2969750.torrent,magnet:?xt=urn:btih:e2c1e22352571c02250d1a430b1fb5e3c2a6cc2f
366010,"[SexMex.xxx] Analia (First Double Penetration) [2020, Anal, Cum in Ass, DP, Threesome FMM, Hardcore, Oral, BlowJob, All Sex, 720p]",https://d.ptorrents.com/bt/[ptorrents.com].2971118.torrent,magnet:?xt=urn:btih:08bda2f379a841efb34f4c49380cccafb2e78282
366011,"[Stunning18.com] 2023-04-03 Graces J - 1st Time [All sex] [2000x3000, 147 photos]",https://d.ptorrents.com/bt/[ptorrents.com].2971020.torrent,magnet:?xt=urn:btih:0173d9e62a8699ca74c8e8b1a7abea3344af84b5
366012,"[clips4sale.com] Milora sniffs baresandals, socks and says FU (Milora studio) [2020, footfetish, 1080p, BDRip]",https://d.ptorrents.com/bt/[ptorrents.com].2972185.torrent,magnet:?xt=urn:btih:4898f7cbee86804ab988d86e496fe57373447f9c
366013,"[PornWorld.com] Lissa Bon - Slutty Blonde Lissa Bon Takes A DP Slamming On Couples Photoshoot GP2634 (04/12/2023) [2023, DP, Anal, Teen, Gonzo, Hardcore, 480p]",https://d.ptorrents.com/bt/[ptorrents.com].2973002.torrent,magnet:?xt=urn:btih:f2d8a0a172de6baf3a19284abac72a794e7de4c9
366014,"Shiina Yuna - Nude Model NTR Shocking Cheating Video Of A Wife Drowning In Shame With Her Boss [JUQ-206] (Kimura Hiroyuki, Madonna) [cen] [2023, Creampie, Big Tits, Married Woman, Mature Woman, Cuckold, HDRip] [720p]",https://d.ptorrents.com/bt/[ptorrents.com].2971959.torrent,magnet:?xt=urn:btih:38e7b6fde7d7343fcf611c40e1ac70a867ab895e
366015,"My Brother Tom / My Brother Tom (Dom Rotheroe, British Screen Productions) [2001, Drama, DVD5] [rus] (Jenna Harrison, Ben Whishaw, Jonathan Hackett, Michael Erskine, Adrian Rawlins, Judith Scott, Michael Tusek, Michael Power, Daniel Bliss, Adam Paul",https://d.ptorrents.com/bt/[ptorrents.com].2972513.torrent,magnet:?xt=urn:btih:5e9a5767b9eded18617262a3fb1765765431e4e1
366016,"[SpankingMags.com] Joanna, Caroline, Angelina - Prefect's Discipline - Spank",https://d.ptorrents.com/bt/[ptorrents.com].2972383.torrent,magnet:?xt=urn:btih:621a336f095e77ca2b016957b38ad0d9658a03ce
366017,"Die Sex Nanny 3 / Sexy Nanny 3 (Deutschland Porno) [2019, Mature, Threesome, Anal, Stockings, Lesbian, Glasses, WEB-DL, 1080p] (Da Cada)",https://d.ptorrents.com/bt/[ptorrents.com].2972748.torrent,magnet:?xt=urn:btih:58df71dcdd57c228ead2eacd7daf0e7a037ee7bd
366018,"[DarkRoomVR.com] Milena Ray - Private Therapy [2022-07-01, Blowjob, Brunette, Cowgirl, Creampie, Doggy Style, Hardcore, High Heels, Lingerie, Natural Tits, POV, Reverse Cowgirl, Shaved Pussy, Teen, SideBySide, 3072p, BDRip] [Oculus Rift / Vive]",https://d.ptorrents.com/bt/[ptorrents.com].2973063.torrent,magnet:?xt=urn:btih:d3ebac0caef3e42245d1e3f0791cf0298f11dd60
366019,"[SlutStepMom.com / NaughtyAmerica.com] Slut Stepmom - Slut Stepmom | Full Sets Packs 2019-2020 (Alex Coal, Karla Kush, Reagan Foxx, Sybil Stallone) [All Sex, Straight, Oral Sex, PornStars, Group Sex, POV, Slut Step Mom] [390x590 - 2500x1667, 1171 pic",https://d.ptorrents.com/bt/[ptorrents.com].2972286.torrent,magnet:?xt=urn:btih:19073973d7b552ebd1ad1607cc5eb2cf2a3fc158
366020,"[LegalPorno.com / PornBox.com] Emma Rose & Gracie Jane - Emma Rose and Gracie Jane tag team Black Cock (2022-08-11) [2022, Transsexuals, Shemale, Anal, Big Ass, Big Tits, Blonde, Blowjob, Cumshot, Handjob, Hardcore, Interracial, Male Fucks Trans, POV",https://d.ptorrents.com/bt/[ptorrents.com].2972593.torrent,magnet:?xt=urn:btih:a0476d8565a76ef114c21c126fd3174f3c710e8f
366021,"[Onlyfans.com] 2020-2023 Mistress Mercy (@mistressmercyxox) [FemDom, Lingerie, Solo, Stockings, Latex, Rubber, Blonde, Young] [3840x2880-476x463, 2395 Photos]",https://d.ptorrents.com/bt/[ptorrents.com].2972363.torrent,magnet:?xt=urn:btih:d623e73a925a875a84e0878c18468fccfc3c04cd
366022,"The Golden Grain (DesireSFM) [2022, 3DCG, Animation, Big Tits, Creampie, Dickgirl, Futanari, Futa, Huge Cock, Rough, Vaginal, HDRip, 1080p] [eng]",https://d.ptorrents.com/bt/[ptorrents.com].2972856.torrent,magnet:?xt=urn:btih:87213678fa2444007cf888470939e7ca9b7fbe11
366023,"[CzechVRFetish.com] Lilit Sweet - Full Latex With Useful Holes (CzechVRFetish 354) [03.08.2022, Big Tits, Blowjob, Brunette, Closeup Missionary, Cowgirl, Facial, Fetish, Footjob, Handjob, Latex, Latex Bodysuit, Masturbation, Missionary , Ponytail, Po",https://d.ptorrents.com/bt/[ptorrents.com].2971989.torrent,magnet:?xt=urn:btih:46238f180e31757d5519b9386b22be02abaf0f00
366024,"Horny Young Vixens 4 To Mouth, Pussy To Mouth, POV, Cum Swallow, Blonde, Tattoo & Piercing, Fishnets, Bubble Butt, Fingering, Rimming, Gaping, Small Tits, WEB-DL, 720p] (Split Scenes) (Alexia Anders, Chanel Camryn, Marilyn Johnson, Queenie Sateen",https://d.ptorrents.com/bt/[ptorrents.com].2971968.torrent,magnet:?xt=urn:btih:e8e9dd7059fe710fcb7d674303b865ccc7ed4ee9
366025,"[SexLikeReal.com/No2StudioVR] Rosse, Deity Bastet, Siri Taylor - Jacuzzi 4some [2023-02-28, VR, Big Tits, Blonde, Brunette, Blowjob, Cowgirl, Foursome FFFM, Group Sex, Handjob, Natural Tits, POV, Redhead, Shaved Pussy, 6K, SideBySide, 3072p, SiteRip]",https://d.ptorrents.com/bt/[ptorrents.com].2970896.torrent,magnet:?xt=urn:btih:486ee094eaa269a02bc64a8d40b183846bc1b470
366026,"Sniffing baresandals FU (11 videos) / Natasha sniffed the sandals and said fu (Fulovesandals, Home studio) [2021, footfetish, 1080p, Webcam]",https://d.ptorrents.com/bt/[ptorrents.com].2972140.torrent,magnet:?xt=urn:btih:b7abc40d99bf2dfd773f360358df29e99c498878
366027,"[onlyfans.com] JoKa Photos [BBW, Big Belly, Big Ass, Big Tits, Brunette, Blowjob, Hardcore, Onlyfans, butthole, posing] [3024x4032 - 639x1130, 1671 Photos]",https://d.ptorrents.com/bt/[ptorrents.com].2972274.torrent,magnet:?xt=urn:btih:42d82cc9787d9a2f980868587dda7c6d7e8b82ae
366028,"[SexMex.xxx] Emily Thorne (Hotwife Gets Medical Assistance) [2023, Anal, Cum in Ass, Hardcore, Oral, Blowjob, Russian, All Sex, 1080p]",https://d.ptorrents.com/bt/[ptorrents.com].2972798.torrent,magnet:?xt=urn:btih:4b0efda1ccc55fb1bd84dc4e3ca31b2377cce1e9
366029,"[Zishy.com] 2020-2022 Olivia Yukon - Zishy - Olivia Yukon [Amateur,Solo,Posing] [1920*1280, 263 photos, 5 sets]",https://d.ptorrents.com/bt/[ptorrents.com].2972343.torrent,magnet:?xt=urn:btih:0cbd90c0e3de82f74c8d2c9d0d7c0ee3725cec48
366030,"Yayoi Mizuki - I Can't Resist The Temptation Of My Wife's Unprotected See-through Panties And Big Butts! ! [TPIN-051] (Tsubakihoin) [cen] [2023, Creampie, Married Woman, Huge Butt, HDRip] [720p]",https://d.ptorrents.com/bt/[ptorrents.com].2972389.torrent,magnet:?xt=urn:btih:1bd2ce376f1b49b1ee47f358bfb0878cf6654bdc
366031,"Himesaki Hana - In Front Of My Boss... My Wife Became A Nude Model. 6 [NSFS-175] (Tomitake Taro, Nagae Style) [cen] [2023, Big Tits, Married Woman, Affair, Drama, Cuckold, HDRip] [720p]",https://d.ptorrents.com/bt/[ptorrents.com].2972211.torrent,magnet:?xt=urn:btih:cac0489221f873a2ac4f00e835b492956bfab720
366032,"Sato Haruki - Black Tera Dick On The Road - Haruki Sato Edition [BTC-03] (Abashiri Ikka, Global Media Entertainment) [cen] [2015, Creampie, Facials, Gangbang, Mature Woman, Black Actor, HDRip] [1080p] ]",https://d.ptorrents.com/bt/[ptorrents.com].2972733.torrent,magnet:?xt=urn:btih:5a653b1e7f190427adc2ea22b0ff7221f7156c4e
366033,"[VRConk.com] Kylie Rocket - DC Comics: Zatanna (A Porn Parody) [2023-03-31, 6K, VR Porn, Blowjob, Cum on Body, Brunette, Cosplay, Hairy, Latina, Parody, Small Tits, Tattoo, Teen, Natural Tits, American, Balls Licking, Close Up, Cowgirl, Doggystyle, R",https://d.ptorrents.com/bt/[ptorrents.com].2970696.torrent,magnet:?xt=urn:btih:98d22300beb48f89bc8e68e3e1453ece337d770d
366034,"[SexMex.xxx] Silvana Martell (The Motherfuckers Club - Bukkake) [2020, Foursome FMMM, Bukkake, Group, Hardcore, Oral, Blowjob, 720p]",https://d.ptorrents.com/bt/[ptorrents.com].2972524.torrent,magnet:?xt=urn:btih:90a6657fd8d5944e906c5a623ae068c6ee478022
366035,"[LegalPorno.com/Pornbox.com] Nat Owen -First DP 19 yo Nat Owen VS 2 Monster Cock - Non Stop Anal Fuck[2023, Gonzo, Hardcore, All Sex, Anal,DP 1080p]",https://d.ptorrents.com/bt/[ptorrents.com].2972847.torrent,magnet:?xt=urn:btih:aadbe45c20bf9ce19ac349e57fef1307bf1d3d27
366036,"Mizuhara Misono, Hijiri Toa - Double Colossal Tits Harem Of Jcup Dream Your Desires Will Be Granted! Great Ascension With Erotic Cosplay & Healing Milk Fetish Play! Boin ""Suwon Misono & Seiri Toa"" Box [BOBB-372] (Abc/ Mousou Zoku) [cen] [2023, Cospla",https://d.ptorrents.com/bt/[ptorrents.com].2972719.torrent,magnet:?xt=urn:btih:f0b874de279f6ffbbc5aa9f6bd03ac92c1f3bc91
366037,"[Tuk Tuk Patrol] Pretty thai prostitute [All Sex, hairy, asian, small tits, brunette, Gonzo 720p]",https://d.ptorrents.com/bt/[ptorrents.com].2972955.torrent,magnet:?xt=urn:btih:52bf1848ab827f778163ff78bb1b50aeb4dc49b0
366038,"Kimijima Mio - A Big Tits Widow Was Gang Bang Fucked By A Bunch Of Elderly Laborers And Turned Into Their Sex Slave [GVG-713] (Mishima Rokusaburo, Glory Quest) [cen] [2018, Gangbang, Big Tits, Hardcore, Training, Old Man, HDRip] [1080p]",https://d.ptorrents.com/bt/[ptorrents.com].2972735.torrent,magnet:?xt=urn:btih:e525399d9b30058fee76987710bc0d6f80643fe3
366039,"Arai Rima - I started dating my childhood friend and she, sincerely loving me, nevertheless got a lover. / BSS I Loved You First... One Day, My Childhood Friend Who Stole My Virginity Called A Handsome Man With A Big Cock While Having POV Sex On The",https://d.ptorrents.com/bt/[ptorrents.com].2972169.torrent,magnet:?xt=urn:btih:b76a268a530ecc115531bc144ed562b55df89c11
366040,"Dirty Intentions 26 / Dirty Intentions 26 (Reality Kings) [2023, Big Dicks, Big Tits, Blowjobs, Naturally Busty, WEB-DL, 720p] (Split Scenes) (Bridgette B, Kendra Sunderland, Ariana Van X, Alyssa Bounty Layla Belle",https://d.ptorrents.com/bt/[ptorrents.com].2972413.torrent,magnet:?xt=urn:btih:68cb0d8d57c80dbfa9b2aa0aaa1f6bc33c32d58a
366041,"[WoodmanCastingX.com] Audrey Jane (* UPDATED * - CASTING X 154 ) [2023, Gonzo, Hardcore, All Sex, DP, Anal, 540r]",https://d.ptorrents.com/bt/[ptorrents.com].2972324.torrent,magnet:?xt=urn:btih:5fca8ca083a29199c9fcdd4014a6f1528e66130d
366042,"[CzechVR.com] Catherine Knight, Eva Berger - Take Us Both (CzechVR 566) [01/07/2023, Blowjob, Brunette, Cowgirl, Cum In Mouth, Doggy Style, FFM, Fingering, Garter Belt, Handjob, Hardcore, High Heels , Lingerie, Long Hair, Masturbation, Missionary, Na",https://d.ptorrents.com/bt/[ptorrents.com].2972680.torrent,magnet:?xt=urn:btih:73adaad8d60dfd6801022409f30175b25855fc50
366043,"[SexMex.xxx] Silvana Martell (The Motherfuckers Club - Bukkake) [2020, Foursome FMMM, Bukkake, Group, Hardcore, Oral, Blowjob, 1080p]",https://d.ptorrents.com/bt/[ptorrents.com].2972471.torrent,magnet:?xt=urn:btih:02e26f8b7f0b8fed4ad7963a1ecc2301ac0f295a
366044,"[TabooVRPorn.com] Krissy Knight - Stepbro Tries Sexual Abstinence [2022-10-16, VR, Blonde, Blowjob, Cowgirl, Doggystyle, Handjob, Missionary, Small Natural Tits, POV, Shaved Pussy, Stepsister, 8K, SideBySide, 4096p, SiteRip] [Oculus Rift/Vive]",https://d.ptorrents.com/bt/[ptorrents.com].2970675.torrent,magnet:?xt=urn:btih:95b55ab88121ed10c878684706f9cfe13c14981c
366045,"Ueha Aya - The Never-ending Days Of Vaginal Cum Shot Circles [JUQ-224] (Mamezawa Mametarou, Madonna) [cen] [2023, Creampie, Gangbang, Big Tits, Married Woman, Mature Woman, HDRip] [720p]",https://d.ptorrents.com/bt/[ptorrents.com].2971963.torrent,magnet:?xt=urn:btih:0c337f1b3197ee8d95c9b4d05d550079a8d3e1a0
366046,"[VirtualRealPorn.com] Megan Venturi - Let's Have Some Fun! [2023-03-24, VR, Anal, Blowjob, Brunette, Cowgirl, Doggystyle, Handjob, Missionary, Natural Tits, Petite, POV, Shaved Pussy, 8K, SideBySide, 3840p, SiteRip] [Oculus Rift / Vive]",https://d.ptorrents.com/bt/[ptorrents.com].2970693.torrent,magnet:?xt=urn:btih:0a365b4c644b913ccf80d1cfd1ac0fd59861ef9f
366047,"[YoungCourtesans.com / DirtyFlix.com] Rebecca Nikson - Magic Sex With Blue-Haired Teen (04/07/2023) [2023, Teen, Gonzo, Hardcore, All Sex, 480p]",https://d.ptorrents.com/bt/[ptorrents.com].2972134.torrent,magnet:?xt=urn:btih:994d02f2e7c5f27a13551dbfcf7b9413c9c789ca
366048,"[Misc] IAHFY (KYHUafterdark) Artwork collection Solo, Erotic] ​​[JPG] [eng]",https://d.ptorrents.com/bt/[ptorrents.com].2972194.torrent,magnet:?xt=urn:btih:752cc79f192c957383140d002a7d28b2aa4c6c73
366049,"[AnalIntroductions.com / Private.com] Misha Maver & Catherine Knight - Misha Maver And Catherine Knight Enjoy A Full Anal Threesome (04/12/2023) [2023, Anal, Threesome, Big Tits, Gonzo, Hardcore, 360p]",https://d.ptorrents.com/bt/[ptorrents.com].2972999.torrent,magnet:?xt=urn:btih:70450708e864f736cb47a5ee367baa2f34fbb3f3
366050,"[LegalPorno.com / AnalVids.com / PissVids.com] Valeria Atreides / Trans in Piss, Valeria Atreides, 3on1, ATM, DAP, Gapes, ButtRose, Pee, Pee Cocktail, Pee Drink, Cum in Mouth, Swallow BTG107 (2023- 04-12) [2023, anal, ass to mouth, big ass, big tits,",https://d.ptorrents.com/bt/[ptorrents.com].2973037.torrent,magnet:?xt=urn:btih:fde1d66dcf5a59f13e70ad0841871e43281e9826
366051,"[FakeHostel.com / FakeHub.com] Mia Trejsi & Kaira Kampen - Backpackers From Outer Space (04/11/2023) [2023, Threesome, Teen, Gonzo, Hardcore, All Sex, 480p]",https://d.ptorrents.com/bt/[ptorrents.com].2972793.torrent,magnet:?xt=urn:btih:bd3ff8f7da3731ade763d41a8151ad54ccca849b
366052,"MILF Trip 5 / Milf Trip 5 (Globe Twatters) [2023, Blowjobs, Creampie, Cumshots, Gonzo, MILF, Oral, POV, Reality Porn, WEB-DL, 720p] (Split Scenes) (Lauren Phillips, Silvia Saige, Aaliyah Love, Candela",https://d.ptorrents.com/bt/[ptorrents.com].2972710.torrent,magnet:?xt=urn:btih:916279cf7ac9bf3bd378c8c42df6a54707347bc5
366053,"[OnlyFans] Sofi n Den (Petite Princess FemDom) (51 photos) 2021-2022 [POV, Russian Girls, Cunnilingus, Domination, Erotic, Softcore, Femdom, Fetish, Foot Fetish, Latex, Muff Diving, Redhead, Rimming, Smother, BDSM] [1280x622-3024x4032]",https://d.ptorrents.com/bt/[ptorrents.com].2972874.torrent,magnet:?xt=urn:btih:49e4df0da386b991a0f527cc04d3d0a126158ceb
366054,"La Foire aux sexes / Sex-cirkusse / Hottest Show in Town / Sex Fair / Sex Circus / Hottest Show in Town (Eberhardt Kronhausen, Phyllis Kronhausen) [1973, Classic, Adult, Comedy, Upscale, 1080p] (Anne Bie Warburg, Lone Gersel, Lizzy, Bent Warburg)",https://d.ptorrents.com/bt/[ptorrents.com].2972922.torrent,magnet:?xt=urn:btih:02f673a112f8fb6dcf34dd6acd6438e9044eb720
366055,"Malèna / Malena (Giuseppe Tornatore, Medusa Film) [2000, Drama, Romance, War, BDRip, 1080p] [rus] (Monica Bellucci, Giuseppe Sulfaro, Luciano Federico, Matilde Piana, Pietro Notarianni, Gaetano Aronica, Gilberto Idonea, Angelo Pellegrino, Gabriella D",https://d.ptorrents.com/bt/[ptorrents.com].2972034.torrent,magnet:?xt=urn:btih:7bc15fc9236c97586c99446528a1355bcb8e6017
366056,"[PornForce.com] Foxy Elf aka Ariana Ess - She Loves To Be Used - Gorgeous Redhead College Babe Fucked Rough - Foxy Elf (04/11/2023) [2023, Teen, Gonzo, Hardcore, All Sex, 480p]",https://d.ptorrents.com/bt/[ptorrents.com].2972894.torrent,magnet:?xt=urn:btih:788f6dc7d4fe28063533da39f436cde4bc266587
366057,"Kinoshita Ririko - The Long-awaited Live-action Version Of The Popular Doujin Work Of [mother X Son]! ! My Mother And My Favorite Person [URE-090] (Innabar, Madonna) [cen] [2023, Married Woman, Incest, Mature Woman, Mother, Original Collaboration, HD",https://d.ptorrents.com/bt/[ptorrents.com].2972146.torrent,magnet:?xt=urn:btih:64070e8185b97783ad7ecf47518af6ea85835b14
366058,"完堕ち x 寝取 ら れ 家族 ～ 、 許し て。 私たち 浮気 浮気 セックス 本気 で ハマ た の ～ ～ ～ / kan ochi x netorare Kazoku ～ anata, yurushite. [1.1] (POISON) [cen] [2023, ADV, Big Tits, Male Hero, Netorare/NTR/Netori, Group, Housewives, Gal, Pregnant] [jap]",https://d.ptorrents.com/bt/[ptorrents.com].2972982.torrent,magnet:?xt=urn:btih:0ffeddd375db03963141d65673efb72c1d17caa4
366059,"[SlutStepSister.com / NaughtyAmerica.com] Slut Stepsister - Slutty Step Sister | Full Set Packs 2018-2019 [All Sex, Straight, Anal Sex, Oral Sex, PornStars, Group Sex, Slut Step Sister] [800x534 - 2500x1667, 6906 pics, 18 sets, Full SiteRip]",https://d.ptorrents.com/bt/[ptorrents.com].2972257.torrent,magnet:?xt=urn:btih:5f047a9b1a4191071dc83e39e39b6b259ec8aa12
366060,"[DeviceBondage.com / Kink.com] Sophia Locke - Brutal Homecoming Of Sophia Locke (04/10/2023) [2023, BDSM, Bondage, Dildo, Vibrator, Fingering, Flogging, Zapper, Caning, Clothespins, SiteRip, 1080p]",https://d.ptorrents.com/bt/[ptorrents.com].2972715.torrent,magnet:?xt=urn:btih:612339cf472058352778d1f03207b4cc0c1de69e
366061,"[Zishy.com] 2021-2022 Dabney Conrad - Zishy - Dabney Conrad [Amateur,Solo,Posing] [1920*1280, 300 photos, 5 sets]",https://d.ptorrents.com/bt/[ptorrents.com].2972266.torrent,magnet:?xt=urn:btih:aad8aa02a7a1703531649e90c31601a058b6c893
366062,"[PornForce.com] Foxy Elf aka Ariana Ess - She Loves To Be Used - Gorgeous Redhead College Babe Fucked Rough - Foxy Elf (04/11/2023) [2023, Teen, Gonzo, Hardcore, All Sex, 720p]",https://d.ptorrents.com/bt/[ptorrents.com].2972893.torrent,magnet:?xt=urn:btih:c7a635377b611d8cf42257e201e65592e9cdf033
366063,"[Pure-ts.com] Renata Morales - Classy Trans Stunner Makes Her Move (04/10/2023) [2023, Shemale, Hardcore, Blowjob, Anal, Bareback, 720p]",https://d.ptorrents.com/bt/[ptorrents.com].2972618.torrent,magnet:?xt=urn:btih:96c026275fcd034c5175e3f77070008593330928
366064,"I Skyttens tegn / Under the sign of Sagittarius (Russian subtitles) (Werner Hedmann, Scanbox / Happy Film) [1978, Classic, Adult, Comedy, Upscale, 1080p] (Ole Søltoft, Paul Hagen og Søren Strømberg, Judy Gringer)",https://d.ptorrents.com/bt/[ptorrents.com].2971944.torrent,magnet:?xt=urn:btih:6a299203f4bc4d7b48329ca7933982d32396ac02
366065,"[SexMex.xxx] Kourtney Love (Threesome In High Sea) [2020, Threesome FMM, Hardcore, Oral, Blowjob, All Sex, 1080p]",https://d.ptorrents.com/bt/[ptorrents.com].2972532.torrent,magnet:?xt=urn:btih:f0b3b20f0c4224028296af04f405ce0366c09916
366066,"[stasyqvr.com] IngieQ - Sexy Time in the Penthouse [23.03.2023, Brunette, Softcore, Solo, SideBySide, 2700p] [Oculus Rift / Vive]",https://d.ptorrents.com/bt/[ptorrents.com].2972177.torrent,magnet:?xt=urn:btih:738741e3a18833e08598180270b86af1e94c8f04
366067,"Kami Anna - Kamijiri Nurse's Full-Power Service Gema Ass Sex Healing Smile And Prickets Dejected Ji ○ Po Full Ejaculation Ejaculation! [IPZZ-011] (IDEA POCKET) [cen] [2023, Cowgirl, Slut, Nurse, Butt, HDRip] [720p]",https://d.ptorrents.com/bt/[ptorrents.com].2972394.torrent,magnet:?xt=urn:btih:d48f561e70b351bda60f4aa13e92c045ec38ee10
366068,"Ranka - Busty Tanned Gal Was Imprisoned In A Garbage Room And Was Repeatedly Disliked By Her Unclean Cock And Finally Fell Into Pleasure [REAL-819] (Joni- Shibuya, K.M.Produce) [cen] [2023, Gal, Big Tits, Deep Throat, Confinement, Sun tan, HDRip] [72",https://d.ptorrents.com/bt/[ptorrents.com].2972210.torrent,magnet:?xt=urn:btih:c14a5c9e90e2ecc8fff8978c7e44cb41f9e723b2
366069,"Meisa Hanai, Rin Aoki, Ruru Anoa, Hinata Komine - Super Tits SPECIAL [MIRD-066] (Kyousei, MOODYZ) [cen] [2009, Lesbian, Big Tits, Titty Fuck, Promiscuity, Digital Mosaic, SiteRip] [720p ]",https://d.ptorrents.com/bt/[ptorrents.com].2972993.torrent,magnet:?xt=urn:btih:84e55622ba9b010aa72608ae3d9be4c1b1419ee8
366070,"[Analized.com] Nataly Gold - Sexy Anal Whore Gets Her Ass Sfuffed With BBC (04/11/2023) [2023, Anal, Interracial, BBC, Gonzo, Hardcore, 480p]",https://d.ptorrents.com/bt/[ptorrents.com].2972897.torrent,magnet:?xt=urn:btih:a97124f9ba7aecb538307585ce9430428ee4e704
366071,"Natalia Tihomirova (Nataly, Tihomirova, Natasha) | (Sanktor.com, SuicideGirls.com) [Solo, Posing, Big Tits] [2832x3776 - 3507x5260, 133 photos in 3 sets]",https://d.ptorrents.com/bt/[ptorrents.com].2970860.torrent,magnet:?xt=urn:btih:df3cf54cd9b8d447b3eec126093adbe2d229be02
366072,"Haruna Hana - Shin / Amateur Mask Sexual Desire Processing Masochist 3 [NITR-534] (Buddha D, Crystal Eizou) [cen] [2023, Restraint, Big Tits, Submissive Woman, Masked, HDRip] [720p]",https://d.ptorrents.com/bt/[ptorrents.com].2972714.torrent,magnet:?xt=urn:btih:8f6aec461970a4b1a43e7860cfdb7859b54355c9
366073,"[LegalPorno.com / AnalVids.com / PissVids.com] Valeria Atreides / Trans in Piss, Valeria Atreides, 3on1, ATM, DAP, Gapes, ButtRose, Pee, Pee Cocktail, Pee Drink, Cum in Mouth, Swallow BTG107 (2023- 04-12) [2023, anal, ass to mouth, big ass, big tits,",https://d.ptorrents.com/bt/[ptorrents.com].2973036.torrent,magnet:?xt=urn:btih:a0d0614b8c09a3ecedcb7123ea7aca3533aa76f9
366074,"[LethalHardcoreVR.com] Selina Bentz - Petite Selina Bangs The Boss To Get Her Way [2023-03-30, VR, Blowjob, Brunette, Cowgirl, Facial, Doggystyle, Missionary, Natural Tits, Teen, Petite, Fishnet Stockings, Shaved Pussy , True 8K, SideBySide, 4096p, S",https://d.ptorrents.com/bt/[ptorrents.com].2970928.torrent,magnet:?xt=urn:btih:37033f858aead6c4472fa45f7fd164f346337d2e
366075,"[Nude-in-russia.com] 2023-04-04 Lera S - Burning forest [Posing,Exhibitionism] [2700*1800, 81 photos]",https://d.ptorrents.com/bt/[ptorrents.com].2972482.torrent,magnet:?xt=urn:btih:3f9c59f6d0f58d015b28889606a84d21cecb23b8
366076,"[PenthouseGold.com] Lia Lin - Exotic Nurse Lia Lin Fucks In The C (04/09/2023) [2023, Teen, Gonzo, Hardcore, All Sex, 558p]",https://d.ptorrents.com/bt/[ptorrents.com].2972428.torrent,magnet:?xt=urn:btih:65ae4b03df4534f84e930cda1f68f4b9a69913f7
366077,"[NaughtyAmericaVR.com / NaughtyAmerica.com] Cherry Kiss || Dan Damage (Gorgeous European Pornstar Cherry Kiss gives you a naughty experience you won't forget! / 31798) [2023-04-10, Blonde, Natural Tits, POV, All Sex, Straight, Oral Sex, PSE Porn Star",https://d.ptorrents.com/bt/[ptorrents.com].2972684.torrent,magnet:?xt=urn:btih:d67c700aa9a5a4da5d1969884ed1f8bfd55eef4c
366078,"[ManyVids.com] Gia Itzel - Fucking with my dealer (2022-11-17) [2022, Transsexuals, Shemale, Anal, Bareback, Big Ass, Big Tits, Blonde, Blowjob, Cumshot, Handjob, Hardcore, POV, 1080p, SiteRip]",https://d.ptorrents.com/bt/[ptorrents.com].2972026.torrent,magnet:?xt=urn:btih:0f9a65652804773da49ee0e24f22e4b8ae42db24
366079,"迷情 / Miqing / Meijou / Passion (Tzoou Tour Jea, Erurukku, POLY ANIMATION) (1-2 of 2) [cen] [2021-2023, Big tits, Student, NTR, SiteRip] [chi / rus / jap (1) /eng(1)] [1080p]",https://d.ptorrents.com/bt/[ptorrents.com].2972903.torrent,magnet:?xt=urn:btih:c0c44555421417c11fbc7e2f4f610cbfeedf0b5e
366080,"Mable (Pack) - 36 Video / Mable (Pack) - 36 Videos [BDSM, Spanking, Fetish, SiteRip]",https://d.ptorrents.com/bt/[ptorrents.com].2972260.torrent,magnet:?xt=urn:btih:1f7f3114f4691287a1eee3cafd79886f96b1b04c
