id,title,torrent_url,magnet
367463,"Matsumoto Nanami, Yayoi Mizuki, Ohana Non, Hanayagi Anna - Dream Harem Polygamy I Don't Have Money, But I Have Colossal Tits And A Life Full Of Love Making Children [MIRD-224] (Taiga Kosakai, MOODYZ) [cen] [ 2023, Harem, Big Tits, Married Woman, Titt",https://d.ptorrents.com/bt/[ptorrents.com].2977223.torrent,magnet:?xt=urn:btih:4379c7f1c60110484cfd7ba2125d839b937f91d7
367464,"[Zishy.com] 2020-2021 Corsen Gilroy - Zishy - Corsen Gilroy [Amateur,Solo,Posing] [1920*1280, 169 photos, 3 sets]",https://d.ptorrents.com/bt/[ptorrents.com].2976850.torrent,magnet:?xt=urn:btih:ac67134134ce655575c8739788c88c30a4f797df
367465,"[Zishy.com] 2020-2021 Renee Macias - Zishy - Renee Macias [Amateur,Solo,Posing] [1920*1280, 256 photos, 5 sets]",https://d.ptorrents.com/bt/[ptorrents.com].2976597.torrent,magnet:?xt=urn:btih:f6c1fc3ee817e3aec4a26b2aa69c98ff5195f122
367466,"Haruna Hana, Mizukawa Sumire - Let's Go! God Body Icharab Summit Battle SSS Beauty BODY Erotic Older Sister Sumire & Transcendent Colossal Tits Cheerful Creampie OK Daughter Hana [ICHK-019] (SUKESUKE) [cen] [2023, Creampie, Big Tits, POV, Beautiful G",https://d.ptorrents.com/bt/[ptorrents.com].2977021.torrent,magnet:?xt=urn:btih:21445eefc9b0c57a4b8fef8bdf11721a80fcbe3d
367467,"あさきゆめみし / Letina's Odyssey / Dungeon of Retina [1.03] (Asakiyumemishi / Kagura games) [uncen] [2022, jRPG, female heroine, adventure, fantasy, big ass, big tits, vaginal sex, anal sex, creampie, group sex, groping , monster cosplay, bdsm, oral sex, p",https://d.ptorrents.com/bt/[ptorrents.com].2977087.torrent,magnet:?xt=urn:btih:5a915eeec6e829e3322fa9718da1158908518a85
367468,"[BlowJobFridays.com / BangBros.com] 2011-12-16 Rose Monroe - Rose Gives A Blowjob! (bj9210) [blowjob, brunette, pornstar, hardcore, cumshot, latina, facial, big ass, big booty] [2000x1333, 222 pics]",https://d.ptorrents.com/bt/[ptorrents.com].2976484.torrent,magnet:?xt=urn:btih:cbe68cd8f94a11ab46a73c59f6adcb1f39741cf0
367469,"Kikuno Ran - Beautiful Married Woman's Soggy Sweet Kisses And Luxury Lingerie SEX My Uncle's Wife Who Lives In The City Seduces Me Who Was Raised In The Country [JUFE-453] (Fitch) [cen] [2023, Creampie, Big Tits, Married Woman, Huge Butt, Kiss, HDRip",https://d.ptorrents.com/bt/[ptorrents.com].2977235.torrent,magnet:?xt=urn:btih:e25bf91e28442d2f6ee2f41b51c8d8e922e4f89e
367470,"[legalporno.com/analvids.com] Harper Maddox [2022, big ass, anal, DAP, gan-bang, music, 720p, WEB-DL]",https://d.ptorrents.com/bt/[ptorrents.com].2977097.torrent,magnet:?xt=urn:btih:d3b683738d6bcc519030490c2ab9cc1d5bb15bcf
367471,"[FameGirls.net] 2023-04-07 Olivia - Set 039 [Solo, Posing] [4480x6720, 186 photos]",https://d.ptorrents.com/bt/[ptorrents.com].2976418.torrent,magnet:?xt=urn:btih:f33516f6ca618a02357b03ca3682c03b3671d8aa
367472,"Adachi Yuri - Little Girl's Pussy Big Shock! Climax Portio Development Big Cock X Vaginal Orgasm [SSIS-629] (Arashiyama Michiru, S1 NO.1 STYLE) [cen] [2023, Big Tits, Beautiful Girl, Hardcore, HDRip] [720p]",https://d.ptorrents.com/bt/[ptorrents.com].2976521.torrent,magnet:?xt=urn:btih:66bf741a2d2c39268d1e0968dd64bb5546dbe5c4
367473,"Oshikawa Yuri, Arioka Miu (Shiiba Mikuru) - Big Ass Neighborhood Wife Who Seduces Me With A Bite Thong Panchira 3 Full Erection With A Thick Ass And The Sperm Was Squeezed Many Times [DVDMS-944] (Nagase Swing, Deeps) [cen] [2023, Creampie, Underwear,",https://d.ptorrents.com/bt/[ptorrents.com].2977024.torrent,magnet:?xt=urn:btih:3ba7a869bdb883d9ad03e751d5f7a5a96877df29
367474,"[NaughtyAmericaVR.com / NaughtyAmerica.com] Audrey Bitoni || Johnny Castle (Enjoy a rare pornstar experience: Audrey Bitoni in VR porn / 31821) [2023-04-26, Big Tits, POV, Titfuck, All Sex, Straight, Oral Sex, PornStar Experience, PSE Porn Star Exper",https://d.ptorrents.com/bt/[ptorrents.com].2976796.torrent,magnet:?xt=urn:btih:43fa06fc6eaf4017db20110ecfd24974f5587586
367475,"[SexLikeReal.com/VRixxens] Eva Wild, Wet Kelly - A Gifted Surprise Guest [2023-03-15, VR, Blowjob, Silicone Breasts, Cowgirl, Cum In Mouth, Hardcore, Missionary, MILF, Camera Movement, POV, Shaved Pussy , Threesome (FFM), American, SideBySide, 3072p,",https://d.ptorrents.com/bt/[ptorrents.com].2976457.torrent,magnet:?xt=urn:btih:1273800e4f1fa751ffb97a3d5ea0dddea9e6876f
367476,"[Pornhub.com] MissRedStar [Belgium] (92 videos) [2022-2023, Tittyfuck, Big Tits, Cum on Tits, Blowjob, Classic sex, Solo, Masturbation, 1080p, SiteRip]",https://d.ptorrents.com/bt/[ptorrents.com].2977188.torrent,magnet:?xt=urn:btih:141578943845d6236925a7b5b4395c333e871c32
367477,"[legalporno.com/pissvids.com] Juis Wild [2023, MILF, big tits, anal, DAP, gan-bang, music, 720p, WEB-DL]",https://d.ptorrents.com/bt/[ptorrents.com].2976869.torrent,magnet:?xt=urn:btih:bc5d11cc619528477164d7a4a5f6d57021ecf243
367478,"Playboy TV - The Last Semester 1-12 / The Last Semester (Playboy TV Latin America & Iberia, Delmota, Lucas Vivo) [2004, Erotic, TVRip]",https://d.ptorrents.com/bt/[ptorrents.com].2976866.torrent,magnet:?xt=urn:btih:4e732fac762b421216095772f4f8f91f56cbc5f3
367479,"Temple Of Flesh 3 / Temple Of Flesh 3 (Nubile Films) [2023, Cunnilingus, Group Sex, Lesbian, Lingerie, Oral, Sex Toy Play, Threesomes, Tribbing, WEB-DL, 1080p] (Split Scenes) (Lexi Luna, Anna Claire Clouds, Alex Coal, Tiffany Tatum, Aubree Valentine,",https://d.ptorrents.com/bt/[ptorrents.com].2976496.torrent,magnet:?xt=urn:btih:22b41ccb5247674f447f3676e44202572f94eb3c
367480,"Hanayagi Anna - In The Past, I Was Slender And Plain ... When I Met Again, My Sperm Was Squeezed To The Limit By The Plump Body Of My Childhood Friend Who Had A Strong Sexual Desire [JUQ-262] (Kindaichishougo Rou, Madonna) [cen] [2023, Big Tits, Marr",https://d.ptorrents.com/bt/[ptorrents.com].2976568.torrent,magnet:?xt=urn:btih:954151dc3d720acc509d41b0e85b702e43b57427
367481,"Erena - 3 Sexual Development Specials For The First Time! ! Erina [FSDSS-645] (Dazai Chinpo, FALENO) [cen] [2023, Big Tits, Tall, HDRip] [720p]",https://d.ptorrents.com/bt/[ptorrents.com].2977018.torrent,magnet:?xt=urn:btih:aec2ee86bebefde0af4d030a654878bd44c23ed5
367482,"[Pornhub.com] NICEASSSS [USA] (36 videos) [2022-2023, Tittyfuck, Big Tits, Cum on Tits, Blowjob, Classic sex, 720p, 1080p, SiteRip]",https://d.ptorrents.com/bt/[ptorrents.com].2977193.torrent,magnet:?xt=urn:btih:e3af8509a5437a04ad41654fc87d06e0bc5ebf6a
367483,"[Pornhub.com] Mastophiliac (41 videos) [2019-2022, Tittyfuck, Big Tits, Cum on Tits, Blowjob, Classic sex, SD, 720p, 1080p, SiteRip]",https://d.ptorrents.com/bt/[ptorrents.com].2977185.torrent,magnet:?xt=urn:btih:725bb3be9c3e3f5d9c8784acd7055cab05239444
367484,"[BaDoinkVR.com] Bella Blu - Once In a Blu Moon [2023-04-18, Stockings, Facial, Babe, 6K, Brunette, BDSM, Pornstar, Tattoos, 180, Big Tits, Blowjob , Doggystyle, Titty Fuck, Hairy, VR, SideBySide, 3072p, SiteRip] [Oculus Rift / Vive]",https://d.ptorrents.com/bt/[ptorrents.com].2976574.torrent,magnet:?xt=urn:btih:3f7edb2e747d7ab1276a85f1749add9ee7d0bd7c
367485,"[Pornhub.com] Lily Secret (70 videos) [2020-2023, Tittyfuck, Big Tits, Cum on Tits, Classic sex, 720p, 1080p, SiteRip]",https://d.ptorrents.com/bt/[ptorrents.com].2977176.torrent,magnet:?xt=urn:btih:53b86c48b9478b91cc4d9b678d0f5a21ee43c5ee
367486,"Moscou Amateur 15 / Moscow Amateur 15 (Luc Masson, Concorde) [2003, All Sex, WEB-DL] [rus] (Macha, Alice, Natali, Lena, Natalia)",https://d.ptorrents.com/bt/[ptorrents.com].2976671.torrent,magnet:?xt=urn:btih:92ae51cac82f313e5e4f72d9306196d18a3a68f7
367487,"[SexLikeReal.com/SLR Originals] Adrianna Jade - My Stepbrother's Girlfriend [2022-12-30, Doggy Style, Missionary, Cowgirl, Reverse Cowgirl, Closeup, Creampie, Long Hair, Fisheye, 200°, SideBySide, VR, 4K, 1920p ][Oculus Rift/Vive]",https://d.ptorrents.com/bt/[ptorrents.com].2976516.torrent,magnet:?xt=urn:btih:cbe06096d097528d8b3a3a85437d40b6c0c990d7
367488,"[VRCosplayX.com] Maya Woulfe - Kakegurui A XXX Parody [2021-02-22, Babe, Manga, Blowjob, Teen, 7k, 180, Doggystyle, Anime, Fucking, Brunette, Squirting, Cum On Body, Small Tits, SideBySide, 3584p, SiteRip] [Oculus Rift / Vive]",https://d.ptorrents.com/bt/[ptorrents.com].2976450.torrent,magnet:?xt=urn:btih:7e0304c76d95ecb7a3343b1b42e34e8754b65dc5
367489,"Misono Waka - Immoral Sex With A Father-In-Law With A Voluptuous Body Dirty Nursing Care Body Beautiful Big Tits Ass Masochist Wife M Bride Waka Misono Who Is Accused Of Big Tits And Big Ass [JYMA-032] (Buddha D, Tsukuzuku Onna Wa Tsurai Yo) [cen] [2",https://d.ptorrents.com/bt/[ptorrents.com].2976533.torrent,magnet:?xt=urn:btih:eeab8d5a14d89861fe49c4da01b063bbb319f95e
367490,"[FuckTeamFive.com / BangBros.com] 2012-12-01 Ariella Ferrera, Rose Monroe, Brandi Bae, Stella Raee - Orgy to get the Car Back (bbw16618) [all sex, blowjob, brunette, pornstar, hardcore, cumshot, latina , big ass, blonde, interracial, big tits, group,",https://d.ptorrents.com/bt/[ptorrents.com].2976475.torrent,magnet:?xt=urn:btih:320ae0f743b6f896be64fba0eee7834236886289
367491,"Tsukada Shiori - Longing Female Boss And [MOND-245] (Hotate Ikkan, Takara Eizou) [cen] [2023, Creampie, Big Tits, Mature Woman, Hot Spring, Female Boss, HDRip] [720p]",https://d.ptorrents.com/bt/[ptorrents.com].2976547.torrent,magnet:?xt=urn:btih:f1dd9c3e8ce8f31b86bf5fecdb060bdca587517e
367492,"[Erito.com] Kimono Beauty Kanon [Uncen] (28.10.2022) [Creampie, All Sex, 480p]",https://d.ptorrents.com/bt/[ptorrents.com].2976444.torrent,magnet:?xt=urn:btih:d7c774442f0c1947a0a9e5e3313f554be0b26ed0
367493,"[SexBabesVR.com] Eve Sweet - Love and Flowers [2023-04-19, 5K+, 60fps, POV, blowjob, brown hair, cowgirl, cumshot, doggystyle, girl-boy, handjob, hardcore, medium boobs, missionary, natural boobs , pussy licking, reverse cowgirl, titjob, tits cumshoo",https://d.ptorrents.com/bt/[ptorrents.com].2976563.torrent,magnet:?xt=urn:btih:fb905d5410f8cf90f7b5bac58be5575b411387c5
367494,"[LegalPorno.com/PornBox.com] Anna Esman - Pissed in bath and made her drink ! First MONSTER Cock [2023, Gonzo, Hardcore, All Sex, Anal,Piss 720p]",https://d.ptorrents.com/bt/[ptorrents.com].2977160.torrent,magnet:?xt=urn:btih:45777b6cd462964fc0e4ae03187b168215842389
367495,"[Pornhub.com] Kate Rich - Stepfather Fucks A Pregnant Stepdaughter For 9 Months And Brings Her To Squirt [2023, pregnant, pregnant sex, 1080p, SiteRip]",https://d.ptorrents.com/bt/[ptorrents.com].2976798.torrent,magnet:?xt=urn:btih:92d431d85ee3651ee778eacf35bf12db8005b6b8
367496,"[SexLikeReal.com/perVRt] Rosie Gia, Eva Ray - Rosie Gia From Eva Ray's POV [2023-02-10, VR, Blonde, Cunnilingus, Close Ups, Curly, Masturbation, Fingering, Redhead, Shaved Pussy, Pierced Navel, Pierced Nipple, Tattoos, No Male, Female POV, Lesbian, M",https://d.ptorrents.com/bt/[ptorrents.com].2976316.torrent,magnet:?xt=urn:btih:b7c23d050d830996017f915da49b3188ec211224
367497,"[MetalBondage.com] pack (38 videos) [2022-2023, Bondage, BDSM, 1080p, HDRip]",https://d.ptorrents.com/bt/[ptorrents.com].2976761.torrent,magnet:?xt=urn:btih:c21f4c01496915e05726ab9f203bb33fbe0ef5aa
367498,"[KinkTestShoots.com / Kink.com] Kasey Kei - The Good Sub: Kasey Kei And Andre Stone (04/25/2023) [2023, Shemale, Hardcore, Anal, TS Fucks On Male, Shemale On Male, Dildo, Bareback, Blowjob, BDSM, Bondage, Flogging, Ball Gag, Cumshot, Handjob, Zapper,",https://d.ptorrents.com/bt/[ptorrents.com].2976698.torrent,magnet:?xt=urn:btih:e82579c8e6f51412695a364cdeec6478dabb2f60
367499,"[FamilyScrew.com] Nensi Fox, Tabitha Poison, Bella Angel - Three Horny Stepsisters (04/27/2023) [2023, Group Sex, Orgy, Gonzo, Hardcore, All Sex, 1080p]",https://d.ptorrents.com/bt/[ptorrents.com].2976931.torrent,magnet:?xt=urn:btih:4c7f6b71592246bea91dc72f871badb70e73f1e9
367500,"[MassageSins.com / AdultPrime.com] Yukki Amay aka Yukki Amey, Yukki Amei, Dominic Anne - Happy Ending Massage (04/27/2023) [2023, Lesbian, Oil, Massage, Teen, Kissing, Pussy Licking, Masturbation, Vibrator , Orgasm, 1080p]",https://d.ptorrents.com/bt/[ptorrents.com].2976930.torrent,N/A
367501,"Sara Tsukihi - Royal Purveyor VIP Limited Soapland No.1 Awahime's Amazing Technique [BKYNB-020] (Bon Kyun Bon) [cen] [2023, Big Tits, Soapland, Beautiful Girl, Creampie, HDRip] [720p]",https://d.ptorrents.com/bt/[ptorrents.com].2976805.torrent,magnet:?xt=urn:btih:e5a520425ccbeb7b64081a9d57d4c83fb31d29e9
367502,"[Pornhub.com] Kylee Cruz [USA, Miami] (46 videos) [2019-2023, Tittyfuck, Big Tits, Cum on Tits, Classic sex, Blowjob, 720p, 1080p, SiteRip]",https://d.ptorrents.com/bt/[ptorrents.com].2976412.torrent,magnet:?xt=urn:btih:757088b86d353b2d32a2ea973215e49282012db7
367503,"[legalporno.com/analvids.com] Nicole Aria [2023, big ass, anal, DAP, gan-bang, music, 720p, WEB-DL]",https://d.ptorrents.com/bt/[ptorrents.com].2977094.torrent,magnet:?xt=urn:btih:2af1e6e22af335e563c4c6178e895df12da3d155
367504,"[MyDirtyMaid.net / BangBros.com] 2017-09-18 Rose Monroe - Horny Maid Rose Monroe (mda16088) [all sex, blowjob, brunette, pornstar, hardcore, latina, big ass, shaved, cum shot, maid, busty, big booty, doggystyle, missionary, riding, cow girl, vaginal]",https://d.ptorrents.com/bt/[ptorrents.com].2976591.torrent,magnet:?xt=urn:btih:c4c3abece75316d1301b20c5407950d8b6f46331
367505,"[Transfixed.com/AdultTime.com] Casey Calvert, Kasey Kei(MUSES: Kasey Kei)[2023, Transsexual, Feature, Hardcore, All Sex, 1080p]",https://d.ptorrents.com/bt/[ptorrents.com].2976738.torrent,magnet:?xt=urn:btih:030f380bdbb31b4a753a989033aa4f3e61924593
367506,"(AANiX) Akali-Cademy[2023, 3DCG, Animation, Anal, Blowjob, DP, TAP, DAP, Interracial, Threesome, Gangbang, Multiple Creampies, WEB-DL] [eng]",https://d.ptorrents.com/bt/[ptorrents.com].2976500.torrent,magnet:?xt=urn:btih:e914c06c5fe92fa75e42018beb40fc0d7358ec76
367507,"Shishido Riho - As A Homeroom Teacher, I Succumbed To The Temptation Of My Students And Ended Up Having Sex Over And Over Again At A Love Hotel After School [MIDV-283] (Sapporo Tarou, MOODYZ) [cen] [2023, Blowjob, Schoolgirl, Big Tits, Cowgirl, Kiss,",https://d.ptorrents.com/bt/[ptorrents.com].2977239.torrent,magnet:?xt=urn:btih:44d156e7be8a03e1d45437a7a8463902009effda
367508,"[MetArt.com] 2023-04-25 Sofi Vega,Kate Quinn - Special Friends, Olivia Lust - Watch Me Now, Jessica Brooks - Acolyte [Solo, Posing, Glamour] [3648x5472-5000x7500, 384 photos]",https://d.ptorrents.com/bt/[ptorrents.com].2976488.torrent,magnet:?xt=urn:btih:ab000f1cebeb19522e0bac49ed4a4f979504d70a
367509,"[CHATURBATE.COM] MISSELENA 23.04.23 [TYTYTYUTYU, Amateur, Big Ass, Big Tits, MILF, Natural Tits, Solo, Squirt, 1080p, WebCam]",https://d.ptorrents.com/bt/[ptorrents.com].2977016.torrent,magnet:?xt=urn:btih:0a672dd6bfba87e93c4e5ec4b9d8510b950e2936
367510,"[Pornhub.com] Kate Rich - Pregnant At 9 Months Will Get A Lot Of Sperm In The Pussy [2023, pregnant, pregnant sex, 1080p, SiteRip]",https://d.ptorrents.com/bt/[ptorrents.com].2976797.torrent,magnet:?xt=urn:btih:f60c37d1603b5bf4995e8736a37cfb63c3c52863
367511,"[Pornhub.com] emmalovesfritz (35 videos) [2022, Tittyfuck, Big Tits, Cum on Tits, 1080p, SiteRip]",https://d.ptorrents.com/bt/[ptorrents.com].2976397.torrent,magnet:?xt=urn:btih:40c4a86fb01844d0bdb76442026ebf1d8b661028
367512,"Yacht Party: Sex-Orgie am Balaton! 2 / Party on a yacht: Sex orgy at Balaton! 2 (Erotic Planet) [2014, Orgy, Anal, Outdoor, Oral, Interracial, Gonzo, DVDRip]",https://d.ptorrents.com/bt/[ptorrents.com].2976367.torrent,magnet:?xt=urn:btih:7294e4ce0e05dab250628927d96cdc0ea81f9584
367513,"[RealHotVR.com] Angelica Coralvine & Breezy Bri - Surprise Threesome With My Teen Stepdaughter & Her Shy Friend (20-04-2023) [2023, Small Tits, Hairy Pussy, Close up, Tattoo, Masturbation, 2700p] [Oculus Rift/Vive]",https://d.ptorrents.com/bt/[ptorrents.com].2976935.torrent,magnet:?xt=urn:btih:0b39e238c9d9885dae3bfc242cc2739af03a7f35
367514,"[Beauty-Angels.com / TeenMegaWorld.net] Alien & Lucky Fox aka Margarita Cross, Red Webb, Lolly Bomb - Tea And Sex Are The Best Medicines (04/27/2023) [2023, Lesbian, Brunette, College, Cowgirl, Fingering, Masturbation, Natural Tits, Pussy Licking, Re",https://d.ptorrents.com/bt/[ptorrents.com].2977121.torrent,magnet:?xt=urn:btih:7f8cca085408f0241564fdbe75a07cec90c4e782
367515,"Takarada Monami, Yoshine Yuria - Double Colossal Tits Swapping Breaking In - The Brutal Bosses Who Turn Their Mistresses Into Pleasure-Only Meat Slaves [JUFE-463] (Fitch) [cen] [2023, Creampie, Big Tits, Shibari, Deep Throat HDRip] [720p]",https://d.ptorrents.com/bt/[ptorrents.com].2977231.torrent,magnet:?xt=urn:btih:de178ac50b68a343cb0290fd396cbc6d27a38cba
367516,"[Onlyfans.com] Cumnrise - Just Some Oil [2021, solo, pregnant, 1080p, SiteRip]",https://d.ptorrents.com/bt/[ptorrents.com].2976803.torrent,magnet:?xt=urn:btih:353406cfe1c26a4b8949279e2a512d810938fe1d
367517,"Natsukawa Ayumi - Recently, My Bride's Mother, Who Began To Be Worried About Her Plump Mature Body, Was Embarrassed, And I Had An Erection [VENX-206] (Kitano Majime, Venus) [cen] [2023, Creampie, Big Tits, Married Woman, Mature Woman, Cuckold, HDRip]",https://d.ptorrents.com/bt/[ptorrents.com].2976585.torrent,magnet:?xt=urn:btih:4f40b98529d9923af477ec601b951c97634bd1ad
367518,"[onlyfans.com] Adora ???? (200 videos) Pack (@adora18) [- 2022, Big Tits, Masturbation, Squirt]",https://d.ptorrents.com/bt/[ptorrents.com].2976372.torrent,magnet:?xt=urn:btih:f841a0045189f8dae1c81cb0d62806692667e155
367519,"Yayoi Mizuki - Nipple Bottle Dirty Caregiver Big Ass Shaved Wife's Obscenity Carnal Pillow Sales [KATU-113] (Maglow, Katsuo Butsusan / Mousouzoku) [cen] [2023, Big Tits, Slut, Huge Butt, Old Man, HDRip] [ 720p]",https://d.ptorrents.com/bt/[ptorrents.com].2976546.torrent,magnet:?xt=urn:btih:2973e751403e10fc6983855ab7ce5e43129c9108
367520,"[Tiny4K.com] Winter Jade - Tiny Camgirl [2019, Latina, Small Tits, Pale, Masturbation, Toy, Blowjob, Hardcore, Big Dick, Doggystyle, Reverse Cowgirl, Cowgirl, POV, Creampie, 2160p, SiteRip]",https://d.ptorrents.com/bt/[ptorrents.com].2976883.torrent,magnet:?xt=urn:btih:4e1d4d06a645136f4bdab356947316e2a34c33af
367521,"[Moreamateurs.com] Sophydiva [2023-03-16, Lesbian, Masturbation, 720p, WebCam]",https://d.ptorrents.com/bt/[ptorrents.com].2976794.torrent,magnet:?xt=urn:btih:557c1056622a0738c28c4475b3b096f3992bfe85
367522,"[Art] Ecchi Picture Collection / Pixiv (Pixiv) [cen] [Big tits, Small tits, Bikini, Feet] [PNG]",https://d.ptorrents.com/bt/[ptorrents.com].2976832.torrent,N/A
367523,"[Pornhub.com] Epicxwinok [Argentina, Longchamps] (9 videos) [2022, Tittyfuck, Big Tits, Cum on Tits, 1080p, SiteRip]",https://d.ptorrents.com/bt/[ptorrents.com].2976398.torrent,magnet:?xt=urn:btih:284d1691d96749bcc14b869b8fead7ee0b3f7352
367524,"Kobayakawa Reiko - 2 Days And 1 Night, Reiko Kobayakawa Was Overtaken By Her Sister-In-Law Who Suddenly Invaded Her [VENX-207] (Kanie, Venus) [cen] [2023, Creampie, Big Tits, Married Woman, Mature Woman Cuckold HDRip] [720p]",https://d.ptorrents.com/bt/[ptorrents.com].2976530.torrent,magnet:?xt=urn:btih:354acfa45ededb4cca6a96e5a70d01efc36a91f6
367525,"[CzechVR.com] Alicia Trece - Hardcore Loving in the Morning (CzechVR 594) [24.04.2023, Big Tits, Blowjob, Brunette, Close ups, Cowgirl, Cum Eating, Cum in Mouth, Cum Licking, Doggy Style, Handjob, Hardcore , Hispanic, Intimate Missionary, Latina, Lon",https://d.ptorrents.com/bt/[ptorrents.com].2976543.torrent,magnet:?xt=urn:btih:29e2e35f9fef6d41daa16356ab42bd6e0da504cd
367526,"[SexLikeReal.com/LustReality] Anie Darling - Horny Gf Annie Darling Gets On Your Hard Dick [2021-11-26, Brunette, Kissing, Blowjob, Shorts, Teasing, Handjob, Cowgirl, Reverse cowgirl, Small tits, Natural tits, Doggy style, Missionary, Masturbation, C",https://d.ptorrents.com/bt/[ptorrents.com].2976988.torrent,magnet:?xt=urn:btih:a48bded64716df10efde27450416502380840c60
367527,"Morisawa Kana - 'INGO' IN GOD ECSTASY Whispering Vulgar Obscenities Into Their Ears Drives Men's Lower Bodies Crazy! Lewd Slut Dirty Talk [AVSA-243] (Buddha D, AVS Collector's) [cen] [2023, Older Sister, Dirty Words, Married Woman, Slut, POV, HDRip]",https://d.ptorrents.com/bt/[ptorrents.com].2976554.torrent,magnet:?xt=urn:btih:42d3d80694b528eed8a485d12419f9b12cd36e7a
367528,"[FameGirls.net] 2023-02-18 Olivia - Set 036 [Solo, Posing] [4480x6720, 170 photos]",https://d.ptorrents.com/bt/[ptorrents.com].2976407.torrent,magnet:?xt=urn:btih:d370d55fc5581ae1e9a0b77adad610148a8ab9f5
367529,"Maria Hoshi Explodes The Sexual Desire That Has Accumulated In 30 Days Of Abstinence And Spree! Of Course... I Put Up With It, So... You Should Put Up With Your Ejaculation [SSIS-684] (SamoAri, S1 NO.1 STYLE) [cen] [2023, Big Tits, Cowgirl, Slut , HD",https://d.ptorrents.com/bt/[ptorrents.com].2976522.torrent,magnet:?xt=urn:btih:7f6489bc6b3b583fe034a4613342d27782a41d31
367530,"[FuckTeamFive.com / BangBros.com] 2018-08-04 Rose Monroe, Holly Hendrix, Mia Martinez - A Workout for Your Cock! (bbw16651) [all sex, blowjob, brunette, pornstar, hardcore, cumshot, latina, big ass, big tits, group, orgy, cowgirl, busty, big booty, d",https://d.ptorrents.com/bt/[ptorrents.com].2976473.torrent,magnet:?xt=urn:btih:c497d6a31d03f72353f232b56c50bfca9cb43368
367531,"[BigBootyTGirls.com] Sereia Mel - Simply Sereia (bbtg238) (2023-04-28) [2023, Transsexuals, Shemale, Anal, Big Ass, Big Tits, Blowjob, Brunette, Bubble Butt, Cumshot, Hardcore, 1080p, SiteRip]",https://d.ptorrents.com/bt/[ptorrents.com].2977179.torrent,magnet:?xt=urn:btih:a87d6b175dcc9ddc764c2e3f0f4aec1a587e8162
367532,"[Pornhub.com] Luxurytitss [Mexico, Merida] (8 videos) [2022-2023, Tittyfuck, Big Tits, Cum on Tits, SD, 720p, 1080p, SiteRip]",https://d.ptorrents.com/bt/[ptorrents.com].2977181.torrent,magnet:?xt=urn:btih:d4028c769d452b9674d80cc2ddf7ec55dd571d7d
367533,"[Onlyfans.com] Preggodelight - Pregnant Belly Angles 38 Weeks [2023, solo, pregnant, 1080p, SiteRip]",https://d.ptorrents.com/bt/[ptorrents.com].2976807.torrent,magnet:?xt=urn:btih:3b69bc15c68e2a11e2677afd7493ef78045bf3a2
367534,"Yuki Rino - Forbidden Nursing Care [GVH-533] (Haruka Yukio, Glory Quest) [cen] [2023, Creampie, Married Woman, Drama, Cuckold, Old Man, HDRip] [720p]",https://d.ptorrents.com/bt/[ptorrents.com].2976532.torrent,magnet:?xt=urn:btih:9ce294286d12ebd643737801e2770eb3158f3697
367535,"[EvilAngel.com] TS Yris - TS YRIS Gorgeous Beauty Masturbates (2023-04-22) [2023, Latina, Gonzo, Solo, Masturbation, Big Dick, Trans, Fishnets, Cumshot, Transgender, Small Tits, Lingerie, 2160p , SiteRip] 4K",https://d.ptorrents.com/bt/[ptorrents.com].2976593.torrent,magnet:?xt=urn:btih:25306b4b7e584c7e9782d98ca27060f415acfa05
367536,"Asumi Mirai - Missed The Last Train And Stayed In My Colleague's Room [MIDV-325] (Kyousei, MOODYZ) [cen] [2023, Creampie, Big Tits, Titty Fuck, Beautiful Girl, Cuckold, HDRip] [720p]",https://d.ptorrents.com/bt/[ptorrents.com].2977238.torrent,magnet:?xt=urn:btih:ce663f0856e1b721f822bd046ddfdea5d27fcff7
367537,"Lolitas Anales 1 / Anal Lolitas 1 (Alain Finney, Concorde) [1999, All Sex, WEB-DL] [rus] (Sophie, Cathy, Gaelle, Dominique, Sandra)",https://d.ptorrents.com/bt/[ptorrents.com].2976874.torrent,magnet:?xt=urn:btih:e4abca8d004b261d013a35a408591fa650b6c6a6
367538,"Niimura Akari - Akari Niimura BEST [RVG-185] (Glory Quest) [cen] [2023, Solowork, Creampie, Anal, 4HR+, Best, Omnibus, HDRip] [1080p]",https://d.ptorrents.com/bt/[ptorrents.com].2977212.torrent,magnet:?xt=urn:btih:b0ce9c18e2002f436ebd6a8a907abb338d9669e7
367539,"Oda Mako - Let Me Give Me Aphrodisiac Mako Oda Who Is A Slut With Beautiful Big Tits [SCD-223] (Tsuji Kouji, Ruby) [cen] [2023, Cosplay, Big Tits, Slut, Incest, Mature Woman, HDRip ][720p]",https://d.ptorrents.com/bt/[ptorrents.com].2976553.torrent,magnet:?xt=urn:btih:42c49116e32e1e449afcad41f41b49a0b377ba0c
367540,"Shinonome Mirei - ""Everything Is For My Mother..."" A Precocious Boobed Girl Who Endured The Sexual Abuse Of Her Remarriage Partner [SSIS-708] (Innabar, S1 NO.1 STYLE) [cen] [2023, Uniform, Schoolgirl, Big Tits, Incest, Old Man, HDRip] [720p]",https://d.ptorrents.com/bt/[ptorrents.com].2976525.torrent,magnet:?xt=urn:btih:73a28346db2dbbffc8a4646d800c820c4e78a9af
367541,"Mao Hamasaki - Ultimate BODY Beautiful Breasts & Nice Ass Shaking Squirting Creampie Festa [BKYNB-014] (TAKE-D, Bon Kyun Bon) [cen] [2023, Big Tits, Beautiful Tits, Squirting, HDRip] [720p]",https://d.ptorrents.com/bt/[ptorrents.com].2976781.torrent,magnet:?xt=urn:btih:2205673536fab0f378fe0a65077d56f54c60a207
367542,"[VRPorn.com/SummerHartStudios] Sinn Sage, Summer Hart - Virtually Inside [2022-07-23, VR, Amateur, Big Tits, Blowjob, Brunette, Dildo, Female POV, Made For Women, Fingering, Strapon, Lesbian, No Male , Masturbation, Natural Tits, Piercing, Cunnilingu",https://d.ptorrents.com/bt/[ptorrents.com].2976502.torrent,magnet:?xt=urn:btih:c621299f8121a4bb904559800cdff84be674bb67
367543,"Ohana Non - A Shared Room Devised By A Sexy Female Boss Reverse NTR Whip Milk Deca Ass Cum Shot Until Morning I Got 10 Shots [WAAA-242] (WANZ FACTORY) [cen] [2023, Creampie, Big Tits, Titty Fuck , Slut, Cuckold, HDRip] [720p]",https://d.ptorrents.com/bt/[ptorrents.com].2977236.torrent,magnet:?xt=urn:btih:942fc6bccb861210eaf420c96cebd20b817f9c42
367544,"[RealityLovers] Julia Parker, Anne Wild - Lesbo Newbies POV [2017-12-07, VR, Redhead, Blonde, Cunnilingus, Fingering, Lesbian, Masturbation, Stockings, Female POV, Made For Women, SideBySide, 1920p, SiteRip] [Oculus Rift/Vive]",https://d.ptorrents.com/bt/[ptorrents.com].2976481.torrent,magnet:?xt=urn:btih:aacad03f2caf7b92f7f28386b2ed763532a1b8b9
367545,"Ver.Kimitorare ▼Goodbye, Sister [TMY-009] (Hanayama Taiji, Tamaya Label) [cen] [2023, Creampie, Voyeur, Evil, Cuckold, HDRip] [720p]",https://d.ptorrents.com/bt/[ptorrents.com].2977023.torrent,magnet:?xt=urn:btih:f124167665a2ea0c5033c610e2116541639cd544
