id,title,torrent_url,magnet
366487,"[X-Sensual.com / DirtyFlix.com] Lina Star aka Lina Shisuta - Teeny Has Anal Sex In A Kitchen (04/15/2023) [2023, Anal, Teen, Gonzo, Hardcore, 2160p]",https://d.ptorrents.com/bt/[ptorrents.com].2973905.torrent,magnet:?xt=urn:btih:bed80143918e016404bd13366d68ac2f469570a9
366488,"Start frei für die Müllers 1-3 / Clean start for the Mullers 1, 2, 3 (Deutschland Porno) [2022, Anal, Big Tits, Feature Films, German, Bubble Butt, Deep Throat, Facial Cumshot, Swallow, 540p, WEB-DL] (Split Scenes) (Ashley Cumstar, Cathy B, DaCada, E",https://d.ptorrents.com/bt/[ptorrents.com].2974263.torrent,magnet:?xt=urn:btih:3df1061681d81c8cc34a2aaf7501df1557b993df
366489,"[Wetandpuffy.com / Puffynetwork.com] Mia Hilton - Always Ready for Anal [2012-08-15, Anal Play, Blonde, Dildo, Fingering, Shaved, Solo, 1080p, SiteRip]",https://d.ptorrents.com/bt/[ptorrents.com].2974290.torrent,magnet:?xt=urn:btih:b8146e30d95f7a4bec7a2ab88a5dddb270c765f4
366490,"[RealJamVR.com] Violet Gems - Violet's Last Hope [2023-04-06, American, Brunette, Cowgirl, Doggy style, English speech, Hardcore, Missionary, Pierced navel, Pierced nipple, POV, Reverse cowgirl, Shorts / skirts, Trimmed pussy, VR, SideBySide, 3584p,",https://d.ptorrents.com/bt/[ptorrents.com].2974899.torrent,magnet:?xt=urn:btih:7852a70089be09766a5b68c795f92704a0763a55
366491,"[MomIsHorny.com / BangBros.com] Macey Jade - Naughty Stepmom's Punishment (mih18166) [2021-07-16, All sex, blowjob, brunette, white, hardcore, cumshot, facial, big ass, milf, big tits, shaved, deep throat, busty, big booty, facefuck, doggystyle, miss",https://d.ptorrents.com/bt/[ptorrents.com].2972418.torrent,magnet:?xt=urn:btih:6510c9a3714844c21dfc9508bd05ea7f52f68612
366492,"[Real Rencontre / Manyvids.com] Katarina K - Arab fuck in public for an iPhone 13 [2021-12-24, All Sex, Interracial, Public Sex, Anal, Facial, 1080p]",https://d.ptorrents.com/bt/[ptorrents.com].2974733.torrent,magnet:?xt=urn:btih:3b20f9931580bd7bea6ee5e1975177b2436018ae
366493,"[LegalPorno.com/Pornbox.com]Kate Cat - Big Cock Destroys Ass 19yo Kate Cat with Squirt, Gapes, Rimmjob and Cum on Mouth( VG170)[2023, Gonzo, Hardcore, All Sex, Anal, 720p]",https://d.ptorrents.com/bt/[ptorrents.com].2971328.torrent,magnet:?xt=urn:btih:3833dc48cb6930972bd366bd214feaf973f1c8c0
366494,"[SexMex.xxx] GaliDiva, Gali Diva (Asking For A Job To Her Son's Friend) [2021, Anal, Cum in Ass, Hardcore, MILF, Oral, Blowjob, All Sex, 720p]",https://d.ptorrents.com/bt/[ptorrents.com].2971996.torrent,magnet:?xt=urn:btih:1a4620e0bed9034ce3150af0111ade708f8d4d6d
366495,"Sumire Shiratori - Falling Plump K Cup Super Milk Wife! [EMBZ-211] (Mature School / Emanuel) [cen] [2020, MILF, Big Tits, Creampie, BBW, HDRip] [720p]",https://d.ptorrents.com/bt/[ptorrents.com].2972848.torrent,magnet:?xt=urn:btih:0c64407d2add309409b226954c79cd144c801e8e
366496,"Hinami Narisawa - Mother With Colossal Tits Who Into Creampie Slave [EMBZ-257] (Mature School / Emanuel) [2022, MILF, Big Tis, Breast Milk, Creampie, HDRip] [1080p]",https://d.ptorrents.com/bt/[ptorrents.com].2972849.torrent,magnet:?xt=urn:btih:9675227df983583e3f30e1365b8e190619b106e9
366497,"[EvilAngel.com] Bella Castler - TS BELLA CASTLER Big Boner Solo Jack (2023-04-08) [2023, Latina, Big Tits, Gonzo, Solo, Masturbation, Big Dick, Trans, Tattoo & Piercing, Bubble Butt, Cumshot Lingerie 1080p SiteRip]",https://d.ptorrents.com/bt/[ptorrents.com].2972128.torrent,magnet:?xt=urn:btih:1819b8e6107f53410637cf5b429e58234b5831c3
366498,"[Onlyfans.com] LanabeeXO - Sundress Sextape [2021-05-30, Amateur, Creampie, Hardcore, Natural Tits, Squirt, Straight, Teen, 1080p, SiteRip]",https://d.ptorrents.com/bt/[ptorrents.com].2969767.torrent,magnet:?xt=urn:btih:dc8f8ed065a9ef2d82431926069c6846f9541b1e
366499,"Honjou Suzu - Part-time Job Girl Who Feels While Flushing Her Face While Ser [NHDTB-466] (Itaka Sumithrin Powder , Natural High) [cen] [2020, Solowork, Humiliation, Squirting, Various Professions, Abuse, HDRip] [1080p]",https://d.ptorrents.com/bt/[ptorrents.com].2973928.torrent,magnet:?xt=urn:btih:472c8277b8330a136e690100ca6a87be07a2afe0
366500,"Sofi Roko (Uvapsss) [MetArt.com, Nubiles.net] (Solo, Erotic, Posing, Masturbating) FullPack [Hi-Res 3600x2026–5472x3648, 363 photos in 5 sets]",https://d.ptorrents.com/bt/[ptorrents.com].2974699.torrent,magnet:?xt=urn:btih:c65547a39a7889ec70c49787a4d2f220af848ee1
366501,"[SexMex.xxx] Vika Borja (The Gay Dressmaker Fucks Her In The Ass #1) [2021, Anal, Cum in Ass, MILF, Hardcore, All Sex, 1080p]",https://d.ptorrents.com/bt/[ptorrents.com].2971335.torrent,magnet:?xt=urn:btih:9198f4556b26e26421522203a12b2ecc7c245a52
366502,"Tina Karpov (27 videos) Pack (Tina Ray) [2020-2021, Anal Play, Anal, BBC, Blonde, Big Ass, Big Cock, Big Tits, Creampie, Doggystyle, Dildo, Hardcore, Interracial, Kinky, Natural Tits, Shaved , Solo, Tattoos, Teen, Titfuck, Toys, Large Areolae, Large",https://d.ptorrents.com/bt/[ptorrents.com].2969367.torrent,magnet:?xt=urn:btih:d988fb83c7b662f531eeb2c66a8598d6045c8899
366503,"[Private.com] Alissia aka Alisia & Eden Ivy - Eden Ivy Puts Alissia To The Test In An Anal Threesome (04/17/2023) [2023, Anal, Threesome, Rimming, Interracial, BBC, Gonzo, Hardcore, 360p]",https://d.ptorrents.com/bt/[ptorrents.com].2974502.torrent,magnet:?xt=urn:btih:cfabc8db0bce96198da2d35f7b13265756c3eea4
366504,"[bongacams] ToxicTiger - hairy pussy chat [2023-04-18, Hairy, Amateur, Dildo, Toys, 960p, WebCam]",https://d.ptorrents.com/bt/[ptorrents.com].2974812.torrent,magnet:?xt=urn:btih:94d08874588bddbb726a30a6c40e9646ad6d5032
366505,"[SLR Originals] Scarlett Alexis - Karaoke Night [2022-08-00, Big Tits, Blowjob, Titfuck, Brunette, Close Up, Cowgirl, Reverse Cowgirl, Fisheye, 60fps, Doggystyle, Hardcore, Missionary, POV, Shaved, SideBySide, 4000p , SiteRip] [Oculus Rift / Vive]",https://d.ptorrents.com/bt/[ptorrents.com].2973831.torrent,magnet:?xt=urn:btih:ed3ad1cc9c9b6e0eb9dc76784fc0777676edd7c2
366506,"Asahina Meguru - Former Kanto Local Station Weather Sister Meguru Asahina Who Captivated Men With Gcup Beautiful Big Tits That You Can Understand Even By Clothes AV Lifted After Marriage! [EYAN-195] (SamoAri, E-body) [cen] [2023, Big Tits, Married Wo",https://d.ptorrents.com/bt/[ptorrents.com].2974670.torrent,magnet:?xt=urn:btih:60c1854b01cdd51444a51e2a62137baa68c3e264
366507,"Young age and dick in the anus / Young age and dick in the anus [2022, All Sex, Anal, Asian, Natural Tits, Teen brunette, Gonzo, 720p, WebCam]",https://d.ptorrents.com/bt/[ptorrents.com].2974296.torrent,magnet:?xt=urn:btih:7d50f61f230cce1044ca50aa6bdee261920d2d19
366508,"[NaughtyAmericaVR.com / NaughtyAmerica.com] Bella Blu , Chanel Camryn , Lilian Stone || Kyle Mason (COCK HUNGRY COWGIRLS / Hot cowgirls Bella Blu, Chanel Camryn, and Lilian Stone want to ride your big cock like a wild bull! / 31806) [2023-04-14, POV,",https://d.ptorrents.com/bt/[ptorrents.com].2973688.torrent,magnet:?xt=urn:btih:f74b4c08b02ddd5fc0adc38b20ec8542e697e430
366509,"[PornWorld.com] Alexa Flexy - Naughty Russian Maid Alexa Flexy Takes Messy Facial After Fucking Her Married Boss GP2533 (12/23/2022) [2022, Anal, Gonzo, Hardcore, 2160p]",https://d.ptorrents.com/bt/[ptorrents.com].2973970.torrent,magnet:?xt=urn:btih:74127ccdaf78dac7922d4b79ef5c2240ad4c0525
366510,"[EvilAngel.com] Bella Castler - TS BELLA CASTLER Big Boner Solo Jack (2023-04-08) [2023, Latina, Big Tits, Gonzo, Solo, Masturbation, Big Dick, Trans, Tattoo & Piercing, Bubble Butt, Cumshot Lingerie 720p SiteRip]",https://d.ptorrents.com/bt/[ptorrents.com].2972127.torrent,magnet:?xt=urn:btih:dc15df4cddff1367bbea450390096d78e7337c56
366511,"Licking Girls Feet - Worship my nasty and dirty feet, young bitch! / Worship my vile and dirty feet, young bitch! [2022, Domination, Erotic, Ebony, Femdom, Fetish, Foot Fetish, Girl/Girl, Lesbian, Made For Women, Mature, Redhead, Russian Girls, Softc",https://d.ptorrents.com/bt/[ptorrents.com].2972746.torrent,magnet:?xt=urn:btih:adf7f9fd301173a3f683249d093821805c15f32e
366512,"[VRCosplayX.com] Erin Everheart - Inhumans: Medusa A XXX Parody [2022-06-30, 180, 7K, Teen, Blowjob, Doggystyle, Fucking, Redhead, Superhero, Small Tits, Comic, Babe, Cum On Body, SideBySide, 3584p, SiteRip] [Oculus Rift / Vive]",https://d.ptorrents.com/bt/[ptorrents.com].2972170.torrent,magnet:?xt=urn:btih:dac44d7448a6c692b8108ec36d83e4663db2b739
366513,"[WankzVR.com] Scarlet Skies, Ryan Reid - Best Friends Olympics [2022-06-24, Big Cocks, Blowjob, Brunette, College, Cowgirl, Creampie, Doggy Style, Kissing, Missionary, Pussy Masturbation, Redhead, Reverse Cowgirl, Small Tits, Threesomes, VR, Virtual",https://d.ptorrents.com/bt/[ptorrents.com].2974984.torrent,magnet:?xt=urn:btih:7c2f859f5bd33d7ea5034f47b421808207aef5f1
366514,"[Bongacams Chaturbate] Snoww white [2023, Amateur, Blowjob, Dildo, Masturbation, 720p, WebCam]",https://d.ptorrents.com/bt/[ptorrents.com].2973830.torrent,magnet:?xt=urn:btih:bee5156709676efdf02e52ef4ade0f4f436337a0
366515,"Fett Gefluster / Fat Whisper (Chris Austin, Eurofuck) [2012, BBW, Fat, Plump, DVDRip] (Max, Mauricio, Alessandro, Jose, Nancy, Vallerie, Pamela, Jenifer, Brenda, Michaela)",https://d.ptorrents.com/bt/[ptorrents.com].2973955.torrent,magnet:?xt=urn:btih:254d7eea14b5282e2f261191be0f6c783a65d1d2
366516,"Igarashi Seiran, Ohara Amu, Ohana Non, Nanami Noa - I Don't Care If I'm Dead! I'm In A Harem Immediately In 30 Seconds From The Start! Always A Harem State Share House! Anyway, Only Naughty Busty Female College Students Live [HUNTB-571] (Borubo Nakan",https://d.ptorrents.com/bt/[ptorrents.com].2972935.torrent,magnet:?xt=urn:btih:193216501c57eeaf58c4e9112439e37ebc42a9e2
366517,"[LegalPorno.com / AnalVids.com] Lexy Harris - Anime Hardcore with Monster Cocks ! Cute 18yo Chan (2023-04-18) [2023, anal, ass to mouth, big butt, big tits, cum swallowing, deep throat, face fucking, facial, gapes, natural tits, rough, teen, 1080p, S",https://d.ptorrents.com/bt/[ptorrents.com].2974754.torrent,magnet:?xt=urn:btih:37437c7a07bb2442729313bc046caf0e4b4116d8
366518,"[Pornhub.com] ATitNibbly (7 videos) [2022-2023, Closeup, Blowjob, Cumshot, POV, 1080p, SiteRip]",https://d.ptorrents.com/bt/[ptorrents.com].2974273.torrent,magnet:?xt=urn:btih:99e21082b07c15a6cbefd8ab25d3bccb75b988e7
366519,"Kaede Nakagawa-=a date with a short-cut club school girl and skipping school. ~even though [PIYO-162] (Hiyoko) [cen] [2022, Solowork, Outdoors, School Girls, Cowgirl, Squirting, Urination, HDRip] [720p]",https://d.ptorrents.com/bt/[ptorrents.com].2972875.torrent,magnet:?xt=urn:btih:4b10441649879a4ef97e7895f09818aa0c4a12b9
366520,"[SeducedByACougar.com / NaughtyAmerica.com] Seduced By A Cougar - Seduced By Cougar | Partial Sets Packs 2006-2022 [All Sex, Straight, Anal Sex, Oral Sex, PornStars, Group Sex, MILFs, Naughty America] [333x500 - 2136x3216, 100506 photos, 477 sets, no",https://d.ptorrents.com/bt/[ptorrents.com].2974280.torrent,magnet:?xt=urn:btih:c51f02eadb09a8600b5a71aed7ea6e325c290574
366521,"Parasite Evil [2023, Animated, 3DCG, Anal sex, Oral sex, Vaginal sex, Parody, Hardcore, Monster, Threesome, HDRip 1080p]",https://d.ptorrents.com/bt/[ptorrents.com].2974995.torrent,magnet:?xt=urn:btih:ab2d535713a646018988da3ed0c60e3e8915fe14
366522,"[Abbywinters.com] Selvaggia - Outdoors [2023-04-08, Solo, 2160p]",https://d.ptorrents.com/bt/[ptorrents.com].2972191.torrent,magnet:?xt=urn:btih:138b06da9904da863564dd1dee8b88e6258c5932
366523,"[FirstBGG.com / TeenMegaWorld.net] Rebeca Fox & Vivian Grace - Hotties Get A Double Sex Lesson (04/15/2023) [2023, Threesome, Teen, Gonzo, Hardcore, All Sex, 2160p]",https://d.ptorrents.com/bt/[ptorrents.com].2973924.torrent,magnet:?xt=urn:btih:c2b946395400aed7eeedb283899e39fe456da874
366524,"[BaDoinkVR.com] Eden Ivy - The Garden of Eden (325975) [14.06.2022, Anal, Blowjob, Brunette, Closeup Missionary, Cowgirl, Cum In Mouth, Doggy, Doggy Style, Handjob, Heavily Tattooed, High Heels, Lateral Cowgirl , Lingerie, Missionary, Natural Tits, P",https://d.ptorrents.com/bt/[ptorrents.com].2974067.torrent,magnet:?xt=urn:btih:93c89bff5f9997c7d36601ff84a7334ee2cd5f5f
366525,"[VirtualRealPorn.com] Ria Sunn - Shall We Make a Cake? [2023-04-11, Anal, Big ass, Big tits, Blonde, Blowjob, Cowgirl, Doggy, Missionary, Reverse cowgirl, VR, SideBySide, 3840p, SiteRip] [Oculus Rift / Vive]",https://d.ptorrents.com/bt/[ptorrents.com].2974175.torrent,magnet:?xt=urn:btih:a645c849b566364de14f0cc8a6a56fec2b752140
366526,"[TheFlourishXXX.com] Gia Derza, Annie Archer - Flourish Univ Ep 2 - Gia Derza and Isiah Maxwell [11.10.2021, Anal, BBC, Big Ass, Blowjob, Cowgirl, Cumshot, Cum In Ass, Deepthroat, Doggystyle, Gagging, Hardcore , Interracial, Missionary, Pool, Reverse",https://d.ptorrents.com/bt/[ptorrents.com].2972226.torrent,magnet:?xt=urn:btih:939037e2970a72820f2175c5060757f5d1ef31d9
366527,"Kikuno Ran - A Perfect Mistress With An H-Cup Glamorous Body Who Has All The Looks, Personality, And Services That The Ordinary People Can't Get Away From, If I, A Regular Employee, Could Lend You Out For A Day [EBOD -968] (Torendei Yamaguchi, E-body",https://d.ptorrents.com/bt/[ptorrents.com].2974196.torrent,magnet:?xt=urn:btih:cb3ce0b711c4a6e87b35a7358f33ca23338e9f01
366528,"[MetArt.com] 2023-04-14 Sonya Blaze - Blazing Heat, Purr Simona - En Pointe, Gwinnett - Lakeside Liaison, Konstance - Wild Curls [Solo, Posing, Glamour] [2883x4324-5792x8688, 555 photos]",https://d.ptorrents.com/bt/[ptorrents.com].2973662.torrent,magnet:?xt=urn:btih:15bd64f849c9816a44c7d6a065c2f6786cf9c44f
366529,"[Maycontaingirl.com] Jess Davies - Mono [2020-10-16, Blonde, Big Tits, Erotic, Solo, 1080p, SiteRip]",https://d.ptorrents.com/bt/[ptorrents.com].2974127.torrent,magnet:?xt=urn:btih:534dfe0655be7d3bd151b3d70c4b060b966372e9
366530,"[RealHotVR.com] 31 clips [2020 - 2021, Solo, Shaved Pussy, Masturbation, Posing, Panties, Close Up, Blowjob, Threesome, 6K 2700p] [Oculus Rift / Vive]",https://d.ptorrents.com/bt/[ptorrents.com].2974965.torrent,magnet:?xt=urn:btih:71e230e40a109a74985c878413e8c4653ece0752
366531,"[SexLikeReal.com/VRoomed] Wet Kelly - Glory and Cucksequence [2023-03-25, VR, Blowjob, Silicone Breasts, Cum In Mouth, Gloryhole, Handjob, Lipstick, Fishnet Stockings, NonPOV, Tattoos, SideBySide, 3072p, SiteRip] [Oculus Rift/Vive]",https://d.ptorrents.com/bt/[ptorrents.com].2974208.torrent,magnet:?xt=urn:btih:7fb30639f47c4b6f4db492bffeaeb997154eba56
366532,"The Babysitters / The Babysitters (David Ross, Forensic Films) [2007, Drama, DVD5] [rus] (Catherine Waterston, John Leguizamo, Cynthia Nixon, Andy Komue, Lauren Birkell, Louisa Krause, Denis O'Hare, Hallie Wegrin Gross , Ethan Phillips)",https://d.ptorrents.com/bt/[ptorrents.com].2973951.torrent,magnet:?xt=urn:btih:d0f2e9281e6c835691310260a49aaaade48e812e
366533,"Yayoi Mizuki - A Busty Sister Who Couldn't Stand To See Her Virgin Brother Who Was Dumped, [if You Imitate It, You Will Definitely Be Able To Do It] [women Absolutely Feel Good SEX] When I Taught You, I Improved Too Much Unexpectedly And Got Hooked O",https://d.ptorrents.com/bt/[ptorrents.com].2974188.torrent,magnet:?xt=urn:btih:bed968cb78e06e10d85966fa45bd114c3ea37689
366534,"JULIA - My Remarriage Partner's Son (adult) Can't Wean... I (mama) Is Forced To Play Breastfeeding And Creampie [PRED-469] (Torendei Yamaguchi, Premium) [cen] [2023, Blowjob, Creampie, Big Tits, Married Woman, Titty Fuck, HDRip] [720p]",https://d.ptorrents.com/bt/[ptorrents.com].2973673.torrent,magnet:?xt=urn:btih:a6219a738d56d2b5bdeb0ff6d0e7d2939be2410c
366535,"[DPFanatics.com / 21Sextury.com] Sata Jones - Straight To The Point (04/16/2023) [2023, DP, Anal, Big Tits, Gonzo, Hardcore, 2160p]",https://d.ptorrents.com/bt/[ptorrents.com].2974129.torrent,magnet:?xt=urn:btih:5433ab38bb6c247c242595755623285c4e289dd6
366536,"Yayoi Mizuki, Tanaka Nene, Momonaga Sarina, Ohana Non - The Smell Of The Wet Pantyhose And Anus Of Four Female Bosses Made Me Erect, And I Was Made To Work Overtime As A Company Slave Of A Black Company In A Sexual Harassment Formation [MIRD -226] (M",https://d.ptorrents.com/bt/[ptorrents.com].2973680.torrent,magnet:?xt=urn:btih:80bdea1d610c8d3f7bae057fec2f8b613d56e445
366537,"Ria Sakurai (Miu Aisaki) - Sky Angel Blue 12 [SKYHD-012] (Sky High Entertainment) [uncen] [2009, Hairy, Vibrators, Bondage, Fingering, Oral Sex, Strong Doggy Style, Cream Pie, All Sex, BDRip] [720p]",https://d.ptorrents.com/bt/[ptorrents.com].2972866.torrent,magnet:?xt=urn:btih:2b3eb341b6f4d1af6ad8ba62bd2a5b1a6e152c00
366538,"Gape Me 5 / Bang Me 5 (Jonni Darkko, Evil Angel) [2023, Anal, Asian, Latina, Interracial, Hardcore, Natural Tits, Big Tits, Double Penetration, Deepthroat, Facial, Gonzo, Hairy, Threesome, Blowjob, POV, Brunette, Mature & Milf, Fisting, Double Anal,",https://d.ptorrents.com/bt/[ptorrents.com].2974101.torrent,magnet:?xt=urn:btih:4ebc1865252feb3176fb6eb8b93374dc1502b4f2
366539,"Mao Hamasaki Drinks 123 Shots Of Cum [DJE-056] (Ichinose Kurumi, Waap Entertainment) [cen] [2015, Blowjob, Big Tits, 3P, 4P, Gokkun, Bukkake, HDRip] [1080p]",https://d.ptorrents.com/bt/[ptorrents.com].2974231.torrent,magnet:?xt=urn:btih:17c512d3f3cbf84e80ad8bf6cb6b7f8da825bdcd
366540,"kercec Porn and Hentai Music Videos (HMV, PMV) / kercec Compilations in 3D and 2D [2022-2023, SFM, Blender, 3D, 2D, Hentai, HMV, PMV, Compilation, Music, Cartoon, Furry, WEB-DL]",https://d.ptorrents.com/bt/[ptorrents.com].2974814.torrent,magnet:?xt=urn:btih:33fde0d31221c07d91013cc2ccdfe5acaadbebe9
366541,"Momiji Kokoa - A Serious Civil Servant Who Has A Gradle-Like Body That Can't Be Imagined From Her Clothes, And The Ban On Cum Inside Is Lifted! Autumn Leaves Love [PPPE-113] (Oppai) [cen] [2023, Creampie, 3P, 4P, Big Tits, Slender, HDRip] [720p]",https://d.ptorrents.com/bt/[ptorrents.com].2974657.torrent,magnet:?xt=urn:btih:0ed9781fd1d48937851c049e0fdfe0610d21abdc
366542,"Tori Black (359 videos) Ultra MegaPack Part 2 [2007-2015, Pretty Face, All Sex, Oral, BlowJob, DeepTroat, Anal, Group, DP, Solo, Lesbian, POV, Toys, Dildo, Teen, 1080p, 720p]",https://d.ptorrents.com/bt/[ptorrents.com].2969176.torrent,magnet:?xt=urn:btih:64beb8d7fd718b12dd666279a05df700bb18e242
366543,"[Blacked.com] Jia Lissa - Secret Session (2023-04-15) [2023, Anal, Blowjob, Bubble Butt, Gonzo, Hardcore, Interracial (IR), Natural Tits, Redhead, Small Tits, 1080p, SiteRip]",https://d.ptorrents.com/bt/[ptorrents.com].2974025.torrent,magnet:?xt=urn:btih:69cc2428447801d13772caf1b5993fc71ce1bc85
366544,"[BigBootyTGirls.com] Emanuely Martins - Banging Emanuely's Huge Badonk (bbtg236) (2023-04-07) [2023, Transsexuals, Shemale, Anal, Big Ass, Blonde, Blowjob, Bubble Butt, Cumshot, Hardcore, Small Tits, 2160p, SiteRip] 4K",https://d.ptorrents.com/bt/[ptorrents.com].2972019.torrent,magnet:?xt=urn:btih:4619bc66df28045f4a9bbb6b042ad723893b1ed3
366545,"Okuda Saki - I Was Removed From Flight Duty... A Cabin Attendant Who Lost Her Youth And Couldn't Fly Is An Obedient Meat Slave Of A Rich Father [SSIS-695] (Maeda Bungou, S1 NO.1 STYLE) [cen ] [2023, Restraint, Uniform, Pantyhose, Big Tits, Titty Fuck",https://d.ptorrents.com/bt/[ptorrents.com].2971949.torrent,magnet:?xt=urn:btih:d798a349758ec840f30f4cf2b37de2a870aaaaf0
366546,"[bang.com] Chanel Preston - Chanel preston gets filled up in a tent [2016-10-20, Big Tits, Blowjob, MILF, Piercing, Tattoos, Uniform, 720p, SiteRip]",https://d.ptorrents.com/bt/[ptorrents.com].2974786.torrent,magnet:?xt=urn:btih:f9dd068b6d3d0ca4de82470f1d728ffb029e6731
366547,"The Sex Boutique: Gloryholes / Sex Boutique: GloryHoles (Barrett Blade, Wicked Pictures) [2012, Feature, BDRip, 720p] (Alektra Blue, Lexi Belle, Lizz Tayler, Marie McCray, Riley Reid)",https://d.ptorrents.com/bt/[ptorrents.com].2974991.torrent,magnet:?xt=urn:btih:e4a8eb3fdc5eb79679fc083701059af963e2421a
366548,"[X-Sensual.com / DirtyFlix.com] Lina Star aka Lina Shisuta - Teeny Has Anal Sex In A Kitchen (04/15/2023) [2023, Anal, Teen, Gonzo, Hardcore, 1080p]",https://d.ptorrents.com/bt/[ptorrents.com].2973906.torrent,magnet:?xt=urn:btih:7b0b522ec136b00a16186ea62fd66f3062f505b2
366549,"Byakuya Mikuru - First Of All, I Brought Up A Natural Sensitive Child Who Never Gave Me An OK Saying ""No..."" With A Middle-aged Father's Nipple Management Discipline And Made It Into A Lewd Bitch Until I Wanted It With A Pleading Obscene Language. Mi",https://d.ptorrents.com/bt/[ptorrents.com].2974203.torrent,magnet:?xt=urn:btih:c6b7a66ebdbd29528f741dd7b731f8559f49a05e
366550,"[MetArtX.com] 2023-04-09 Lisa Bon - Lovely Governess 1 [Solo] [4516x6609, 140 photos]",https://d.ptorrents.com/bt/[ptorrents.com].2972558.torrent,magnet:?xt=urn:btih:8dca3e211c473b2e0d5bc1633c37a0b3f7fd9f90
366551,"[SexAndSubmission.com / Kink.com] Skye Maye - Make This Sale (04/14/2023) [2023, BDSM, Bondage, Anal, Anal Fingering, Hardcore, Dildo, Fingering, Vibrator, Pussy Licking, Ass Licking, Cumshot, Facial, IR, Zapper, Clothespins, Flogging, SiteRip, 480p]",https://d.ptorrents.com/bt/[ptorrents.com].2973738.torrent,magnet:?xt=urn:btih:aa107ba5cf7c800a13a8670a2e5da66eac5c33e0
366552,"Morihoshi Imari - I'm Always Thinking Of Horny Thoughts... I Want Your Big Cock To Thrust And Pound My Pussy... Fuck Me... And Plant Your Hot White Seed Inside Me [APAA-346] (Aoi Touki, Oppai) [cen] [2016, Creampie, Schoolgirl, Facials, Deep Throat,",https://d.ptorrents.com/bt/[ptorrents.com].2974015.torrent,magnet:?xt=urn:btih:a2bf6c1fde2ed696fdebf726bd357d0d95ad41df
366553,"[Camshows.tv] Annelitt [2023-01-20, Dildo, Masturbation, Solo, 720p, WebCam]",https://d.ptorrents.com/bt/[ptorrents.com].2974867.torrent,magnet:?xt=urn:btih:185b27b72a3030550296704828fdcee8d6ca488e
366554,"[BangBus.com / BangBros.com] Anna Kovachenko - Hot Yoga Student Banged in Bus (bb19087) [2023-04-05, blowjob, anal, white, hardcore, cumshot, facial, blonde, interracial, small tits, shaved, deep throat, doggy, euro, cowgirl, doggystyle, missionary,",https://d.ptorrents.com/bt/[ptorrents.com].2971387.torrent,magnet:?xt=urn:btih:8156a0ddd817b29b76eb46bb72ba20e71d22d5cd
366555,"[Tuk Tuk Patrol] Busty thai babe [All Sex, asian, small tits, brunette, Gonzo 1080p]",https://d.ptorrents.com/bt/[ptorrents.com].2974247.torrent,magnet:?xt=urn:btih:9efe8a8380397bff651e6081d42e3c0683455320
366556,"[SexLikeReal.com/FBombStudioz] Harmoni California - The Cuckold Experience Part I [2023-03-05, VR, Big Tits, Blonde, Blowjob, Cuckold / Girl Fucks Husband Watches, High Heels, Long Hair, Doggystyle, Hardcore, Missionary, MILF, Garter Belt, Nylon Stoc",https://d.ptorrents.com/bt/[ptorrents.com].2974616.torrent,magnet:?xt=urn:btih:2515ba593670f18fdfcd258e2df1bf7fa39b30e3
366557,"Crystal Knight (5 videos) / Crystal Knight [2022, Bikini, Big Tits, Erotic, Femdom, Fetish, POV, Softcore, Solo, Topless, 2160p, WEB-DL]",https://d.ptorrents.com/bt/[ptorrents.com].2972749.torrent,magnet:?xt=urn:btih:6a2e9fcf1a36a39098a95f587a6957e5a0867140
366558,"[Art] Janggun/Jeneral Patreon collection Part 3 [uncen] [Big Ass, Big Tits, Cosplay, Stripping, Teasing, Sex Toys, Vaginal Sex, Anal Sex, Group, Pee, Lactation, Pregnant, Bukkake, Piercing, Futanari, X -Ray.] [JPG]",https://d.ptorrents.com/bt/[ptorrents.com].2974245.torrent,magnet:?xt=urn:btih:d0deeeb5873a829e0e70ff2a2b1e15cd9665972c
366559,"[FuckStudies.com / TeenMegaWorld.net] Julia A aka Milly K, Maggnet - Hard Sex After Doing Homework (04/17/2023) [2023, Teen, Gonzo, Hardcore, All Sex, 720p 3900kbps]",https://d.ptorrents.com/bt/[ptorrents.com].2974732.torrent,magnet:?xt=urn:btih:955e8fa7e44f44effe2028c42f5f8940a1b4ae48
366560,"[SLR Originals] Kitty Cam - Movie Night - Hot Alt-Girl [2022-07, Alt Porn, Blowjob, Close Up, Cowgirl, Reverse Cowgirl, High Socks, Colorful, Pigtail, Doggystyle, Hardcore, Missionary, Petite, Trimmed, Piercing , Tattoo, Teen, Fisheye, 8k, SideBySide",https://d.ptorrents.com/bt/[ptorrents.com].2973837.torrent,magnet:?xt=urn:btih:850f6ca6f768fe0b394d35f9e53a44a3bbf0fe10
366561,"[TonightsGirlfriend.com] Suttin - Tattooed and pierced brunette Suttin Wears Sexy Black Lingerie To Swallow Fan's Cum - Tonight's Girlfriend [2023-03-07, Big Tits, Reverse Cowgirl, Cum In Mouth, Missionary, Straight, Hardcore, Handjob, Lingerie, Blow",https://d.ptorrents.com/bt/[ptorrents.com].2974017.torrent,magnet:?xt=urn:btih:09a30f128acafedcc37fd62903644db6d624ae68
366562,"[FakeHubOriginals.com / FakeHub.com] Josephine Jackson - Her Big Bouncy...Dick? (04/18/2023) [2023, Big Tits, Gonzo, Hardcore, All Sex, 720p]",https://d.ptorrents.com/bt/[ptorrents.com].2974740.torrent,magnet:?xt=urn:btih:cbc8a3c02c0a9fbf26161ad1633318a5148963c8
366563,"[LegalPorno.com / AnalVids.com] Anita Snow - Hard Anal 18yo Anita Snow with Big Cock, Gapes and Cum in Mouth (2023-04-08) [2023, anal, blowjob, deep throat, gapes, small tits, teen, 480p, SiteRip]",https://d.ptorrents.com/bt/[ptorrents.com].2972073.torrent,magnet:?xt=urn:btih:8528a768c4ba188439bb50207ea3e88ee55854e8
366564,"[Hogtied.com / Kink.com] Marica Hase - Marica Hase Suffers Beautifully In Brutal Bondage (04/17/2023) [2023, BDSM, Bondage, Dildo, Vibrator, Fingering, Suspension, Caning, Flogging, SiteRip, 720p]",https://d.ptorrents.com/bt/[ptorrents.com].2974767.torrent,magnet:?xt=urn:btih:4a917fc6be1f251efff4a45a5f428bb41dba00e9
366565,"[LegalPorno.com / AnalVids.com] Adeline Lafouine - Adeline Lafouine is Unbreakable bday party Wet #1, Anal Fisting, DAP, Monster ButtRose, Pee Drink, Creampie Swallow GIO1906 [01-09-2021, Swiss, MILF, anal, anal creampie, ass fisting, ass to mouth, c",https://d.ptorrents.com/bt/[ptorrents.com].2972011.torrent,magnet:?xt=urn:btih:46cf4c379dd20897229df2fe4ebf2ff71b32dcb6
366566,"[Clips4Sale.com / Taboo Family Affairs / Blazed Studios] Dixie Lynn - Dixie's Family Threesome [2020-04-29, Blonde, Blowjob, Creampie, Dildo, Facial, Straight, Teen, Threesome (MMF), Toys, 1080p, SiteRip]",https://d.ptorrents.com/bt/[ptorrents.com].2973684.torrent,magnet:?xt=urn:btih:f4220e8b3f88888f3ab00d36b6f8fc3be46bb2e3
